username,text,date,mentions,hashtags,geo,retweets,favorites,id,permalink
vitroceramico,United Airlines deniega el embarque a una mujer que viajaba con un pavo real como animal de apoyo emocional http://flip.it/RZH7c4,2018-01-30 15:59:51,[''],[''],,0,1,958489968535629825,https://twitter.com/vitroceramico/status/958489968535629825
JeffreyHare,More Proof: Emotional support peacock pouts after United Airlines rejection http://www.sfgate.com/chris-mcginnis/article/Peacock-pouts-after-United-Airlines-rejection-12537362.php?utm_campaign=twitter-tablet&utm_source=CMS%20Sharing%20Button&utm_medium=social … via @ SFGate,2018-01-30 15:59:30,[u'SFGate'],[''],,0,0,958489883357556736,https://twitter.com/JeffreyHare/status/958489883357556736
Boston_CP,A United Airlines passenger who tried to take her emotional support peacock with her on a cross-country flight has… http://toplocalnow.com/us/boston/at/18#t12300290 …,2018-01-30 15:59:18,[''],[''],,0,0,958489833214750721,https://twitter.com/Boston_CP/status/958489833214750721
DiGiorno,@ united Thoughts on an emotional support pizza?,2018-01-30 15:58:52,['united'],[''],,2,9,958489721633738752,https://twitter.com/DiGiorno/status/958489721633738752
united,Hey Erin. We'd like to take a closer look at things. Can you send over the confirmation number for the credit in a DM? ^CWhttps://twitter.com/messages/compose?recipient_id=260907612 …,2018-01-30 15:58:51,[''],[''],,0,0,958489718156439552,https://twitter.com/united/status/958489718156439552
kaybuenoesyo,Emotional support peacock pouts after United Airlines rejection https://www.sfgate.com/chris-mcginnis/article/Peacock-pouts-after-United-Airlines-rejection-12537362.php?utm_campaign=twitter-tablet&utm_source=CMS%20Sharing%20Button&utm_medium=social … via @ SFGate,2018-01-30 15:58:45,[u'SFGate'],[''],,0,0,958489692059582464,https://twitter.com/kaybuenoesyo/status/958489692059582464
jersecowboy7575,Again airlines will feel the wrath about this n loose millions boycott flying for good United Airlines Forced Emotional Support Peacock to Give Up Its Seat http://people.com/pets/united-airlines-kicks-off-emotional-support-peacock/ … via @ people,2018-01-30 15:58:27,[u'people'],[''],,0,0,958489618105753602,https://twitter.com/jersecowboy7575/status/958489618105753602
mattbigos,"Props to @ united for turning away a peacock as “emotional support animal”. I love animals more than most people, but this stuff is getting out of hand.",2018-01-30 15:58:16,[u'united'],[''],,0,1,958489574107332608,https://twitter.com/mattbigos/status/958489574107332608
daviddavis311,@ adamcarolla 'Emotional support peacock' barred from United Airlines plane - BBC News http://www.bbc.com/news/world-us-canada-42880690 …,2018-01-30 15:57:39,[u'adamcarolla'],[''],,0,0,958489418091790336,https://twitter.com/daviddavis311/status/958489418091790336
lindsayklife,Business travelers love @ SouthwestAir and @ United (and connecting to them via @ okta) @ USATODAY has the scoop on the top travel apps in # BusinessesAtWork: https://usat.ly/2DZWule  via @ nancytrejos # traveltuesday,2018-01-30 15:57:08,"[u'SouthwestAir', u'United', u'okta', u'USATODAY', u'nancytrejos']","[u'BusinessesAtWork', u'traveltuesday']",,1,6,958489285115588609,https://twitter.com/lindsayklife/status/958489285115588609
HelloMovieStar,"Not funny, nor necessary. Move on...pic.twitter.com/9moz2ieuyo",2018-01-30 15:56:45,[''],[''],,0,0,958489190035066880,https://twitter.com/HelloMovieStar/status/958489190035066880
Forian,Looks like I won’t be flying @ United anymore if they’re going to deny me my emotional support Apache attack helicopter http://www.foxnews.com/travel/2018/01/30/woman-denied-emotional-support-peacock-on-united-flight.html …,2018-01-30 15:56:44,[u'United'],[''],,0,3,958489184582254592,https://twitter.com/Forian/status/958489184582254592
mitya2,BBC News - 'Emotional support peacock' barred from United Airlines plane http://www.bbc.co.uk/news/world-us-canada-42880690 …,2018-01-30 15:54:39,[''],[''],,0,0,958488661649248256,https://twitter.com/mitya2/status/958488661649248256
RealRadio1041,United Airlines Blocks 'Emotional Support' Peacock http://ihe.art/HCbM1Zs,2018-01-30 15:54:35,[''],[''],,0,0,958488646562263041,https://twitter.com/RealRadio1041/status/958488646562263041
FenderBenderTN,Yeah. You can bring her along. You just can't inflate her.,2018-01-30 15:54:10,[''],[''],,0,0,958488538932285441,https://twitter.com/FenderBenderTN/status/958488538932285441
1037thelegend,Emotional Support Peacock Denied Boarding By United Airlines http://ihe.art/LgCStLZ pic.twitter.com/M5L6ksZshh,2018-01-30 15:54:08,[''],[''],,0,0,958488533336866816,https://twitter.com/1037thelegend/status/958488533336866816
WendyHolland2,You are reminiscent of the wisdom of Mark Twain! I love to hear your remarks,2018-01-30 15:54:07,[''],[''],,0,0,958488526458306560,https://twitter.com/WendyHolland2/status/958488526458306560
APLaurieKellman,Emotional support peacock pouts after United Airlines rejection https://www.sfgate.com/chris-mcginnis/article/Peacock-pouts-after-United-Airlines-rejection-12537362.php?utm_campaign=fb-desktop&utm_source=CMS+Sharing+Button&utm_medium=social&utm_campaign=twitter-desktop&utm_source=CMS%20Sharing%20Button&utm_medium=social … via @ SFGate,2018-01-30 15:53:16,[u'SFGate'],[''],,0,0,958488314859831296,https://twitter.com/APLaurieKellman/status/958488314859831296
SanFranciscoCP,Woman denied to bring emotional support peacock on UnitedAirlines flight because airline said it didn't meet their… http://toplocalnow.com/us/san-francisco/at/15#t12299767 …,2018-01-30 15:53:12,[''],[''],,0,0,958488295423528966,https://twitter.com/SanFranciscoCP/status/958488295423528966
jpcrailjr,United Airlines suddenly makes headway reining in Middle East carriers - Chicago Business Journal https://fb.me/FyRPWhRI,2018-01-30 15:53:04,[''],[''],,0,0,958488263379030027,https://twitter.com/jpcrailjr/status/958488263379030027
DarkfyerJay,"# UnitedAirlines You suck. I’m on a 4 hour flight with no video screen for entertainment. No, I don’t want download an app. I want video screen in front of me. I’m flying Delta from now on.",2018-01-30 15:52:54,[''],[u'UnitedAirlines'],,0,0,958488220530036736,https://twitter.com/DarkfyerJay/status/958488220530036736
mozidesigner,I think it is just United Airlines policy to be dicks to their passengers at least two or three times a month.,2018-01-30 15:52:41,[''],[''],,0,0,958488165580406784,https://twitter.com/mozidesigner/status/958488165580406784
FenderBenderTN,"Yeah. Like riding with chickens, pigs, goats & Huckabees.",2018-01-30 15:52:10,[''],[''],,0,0,958488036253274112,https://twitter.com/FenderBenderTN/status/958488036253274112
BostonGlobe,A United Airlines passenger who tried to take her emotional support peacock with her on a cross-country flight has had the bird turned away by the airline. http://bos.gl/8PBOQHm pic.twitter.com/lpkEkwqAPM,2018-01-30 15:52:02,[''],[''],,15,41,958488005387448321,https://twitter.com/BostonGlobe/status/958488005387448321
iananywhere,BBC News - 'Emotional support peacock' barred from United Airlines plane http://www.bbc.com/news/world-us-canada-42880690 …,2018-01-30 15:51:38,[''],[''],,0,1,958487902467506176,https://twitter.com/iananywhere/status/958487902467506176
MrsJavi1,"It is because I am discerning that I despise him. He is the most crass individual on the planet. An apartment decorated like Saddam Hussein's palace is not discernment. It is trashy. I, unlike trump, have standards. You did not hit a nerve. I am just sick of fake Christians.",2018-01-30 15:50:23,[''],[''],,0,0,958487586368049152,https://twitter.com/MrsJavi1/status/958487586368049152
9NEWS,"United Airlines catering workers in Denver, elsewhere move to unionize http://on9news.tv/2EoXtcx pic.twitter.com/rYgjq3TUza",2018-01-30 15:50:07,[''],[''],,2,1,958487519687069697,https://twitter.com/9NEWS/status/958487519687069697
EmperadorBG,Cuando crees que lo has visto todo. United Airlines deniega el embarque a una mujer que viajaba con un pavo real como animal de apoyo emocional https://es.gizmodo.com/united-airlines-deniega-el-embarque-a-una-mujer-que-via-1822566344about:invalid#zSoyz …,2018-01-30 15:49:31,[''],[''],,0,0,958487368624934918,https://twitter.com/EmperadorBG/status/958487368624934918
PadreInAtlanta,The # support animal craze has gone way over the top - good for @ united,2018-01-30 15:49:24,['united'],['support'],,0,0,958487341760499712,https://twitter.com/PadreInAtlanta/status/958487341760499712
wordsmeet,"How dare they refuse emotionally supportive birds aboard a plane? If anything, birds should feel right at home aboard a PLANE, shouldn't they? I sense a female protest movement brewing! http://bbc.in/2DNBqv5 # birdmetoo @ united",2018-01-30 15:49:19,[u'united'],[u'birdmetoo'],,0,1,958487317764853761,https://twitter.com/wordsmeet/status/958487317764853761
urimiscott,United Airlines denied a woman's attempt to bring a emotional support peacock onto a flight. http://www.businessinsider.com/united-denies-womans-attempt-to-bring-peacock-onto-flight-2018-1 …,2018-01-30 15:49:02,[''],[''],,0,0,958487249787805696,https://twitter.com/urimiscott/status/958487249787805696
FreddyWanKenobi,@ united thank you for taking a stand! These pets being brought on board are getting out of control!,2018-01-30 15:48:56,['united'],[''],,0,0,958487221316632576,https://twitter.com/FreddyWanKenobi/status/958487221316632576
hannie_posh,'Emotional support peacock' barred from United Airlines plane https://goo.gl/fb/xBa7to,2018-01-30 15:47:33,[''],[''],,0,0,958486873290297344,https://twitter.com/hannie_posh/status/958486873290297344
JoaoTravelPR,United Airlines Forced Emotional Support Peacock to Give Up Its Seat http://www.travelandleisure.com/travel-news/united-airlines-denies-boarding-emotional-support-peacock …,2018-01-30 15:46:26,[''],[''],,0,1,958486593270099968,https://twitter.com/JoaoTravelPR/status/958486593270099968
RalphWoodFox26,Los Angeles Memorial Coliseum will be renamed United Airlines Memorial Coliseum. There were good times in the # Coliseumhttp://kmph.com/sports/content/los-angeles-memorial-coliseum-will-be-renamed-united-airlines-memorial-coliseum …,2018-01-30 15:46:22,[''],[u'Coliseumhttp'],,1,3,958486577553932288,https://twitter.com/RalphWoodFox26/status/958486577553932288
TLNAnchorage,United Airlines grounds peacock that woman tried to take on board as a support animal http://toplocalnow.com/us/anchorage/at/14#t12299014 …,2018-01-30 15:46:09,[''],[''],,0,0,958486523720228864,https://twitter.com/TLNAnchorage/status/958486523720228864
christianebuddy,‘Emotional support peacock’ barred from United Airlines plane https://goo.gl/atyVzW # us,2018-01-30 15:46:03,[''],[u'us'],,0,0,958486496817963008,https://twitter.com/christianebuddy/status/958486496817963008
cricketliu,I gotta back @ united on this one: http://www.foxnews.com/travel/2018/01/30/woman-denied-emotional-support-peacock-on-united-flight.html …,2018-01-30 15:45:58,[u'united'],[''],,0,3,958486477071040512,https://twitter.com/cricketliu/status/958486477071040512
voltronfutura,i've been guilty of coming here just to complain. sometimes you just want to tell @ united how much they suck,2018-01-30 15:44:49,['united'],[''],,0,2,958486185181138944,https://twitter.com/voltronfutura/status/958486185181138944
aburageumai,いやいやいや… BBC News - 'Emotional support peacock' barred from United Airlines plane http://www.bbc.com/news/world-us-canada-42880690 …,2018-01-30 15:44:11,[''],[''],,0,0,958486027265609728,https://twitter.com/aburageumai/status/958486027265609728
zmholland,United airlines is trash let this peacock be emotionally supportive https://twitter.com/bbcworld/status/958477824347820032 …,2018-01-30 15:43:26,[''],[''],,1,0,958485838777716741,https://twitter.com/zmholland/status/958485838777716741
Kabanrep,'Emotional support peacock' barred from United Airlines plane: United Airlines refuses to… https://goo.gl/fb/2GCRmJ,2018-01-30 15:43:06,[''],[''],,0,0,958485754497429504,https://twitter.com/Kabanrep/status/958485754497429504
Inc,United Airlines Just Did Customers a Huge Favor For Which Everyone Should Be Grateful @ ChrisMatyszczykhttp://on.inc.com/2BElEAM,2018-01-30 15:42:53,[u'ChrisMatyszczykhttp'],[''],,3,6,958485701015887872,https://twitter.com/Inc/status/958485701015887872
Yomamafl,Haha,2018-01-30 15:42:46,[''],[''],,0,0,958485671961944064,https://twitter.com/Yomamafl/status/958485671961944064
karlitopito,'Emotional support peacock' barred from United Airlines plane http://ift.tt/2rVgVLc,2018-01-30 15:42:33,[''],[''],,0,0,958485617612083200,https://twitter.com/karlitopito/status/958485617612083200
AndreAinPA,# Peacocks # UnitedAirlines http://www.foxnews.com/travel/2018/01/30/woman-denied-emotional-support-peacock-on-united-flight.html?cmpid=prn_msn …pic.twitter.com/DHHQXDP8ho,2018-01-30 15:42:00,[''],"[u'Peacocks', u'UnitedAirlines']",,0,0,958485476284956672,https://twitter.com/AndreAinPA/status/958485476284956672
HoopsnHenna,should they ride on top of the car and drag it like your disgusting son did?,2018-01-30 15:41:46,[''],[''],,0,0,958485417720008705,https://twitter.com/HoopsnHenna/status/958485417720008705
FlightChops,That is awesome!,2018-01-30 15:41:45,[''],[''],,0,1,958485417459888128,https://twitter.com/FlightChops/status/958485417459888128
brieloskota,I tried flying with my emotional support tequila but @ TSA took it away.- Woman denied emotional support peacock on @ united flight http://fxn.ws/2DPMWKA # FoxNews,2018-01-30 15:41:19,"[u'TSA', u'united']",[u'FoxNews'],,0,1,958485304947724288,https://twitter.com/brieloskota/status/958485304947724288
945WFLA,Emotional Support Peacock Denied Boarding By United Airlines http://ihe.art/Z9XMm00,2018-01-30 15:41:02,[''],[''],,0,0,958485236547031040,https://twitter.com/945WFLA/status/958485236547031040
Yomamafl,Was it an NBC executive????,2018-01-30 15:40:59,[''],[''],,0,0,958485224018587648,https://twitter.com/Yomamafl/status/958485224018587648
BobAdam64459125,Patient belongs on bus minus bird .,2018-01-30 15:40:21,[''],[''],,0,0,958485062265184256,https://twitter.com/BobAdam64459125/status/958485062265184256
Andre_Gottshalk,'Emotional support peacock' barred from United Airlines plane: United Airlines refuses to… https://goo.gl/fb/Htdp4c,2018-01-30 15:39:52,[''],[''],,0,0,958484942056509440,https://twitter.com/Andre_Gottshalk/status/958484942056509440
warriors_mom,"# TravelTips: NO, just NO! 'Emotional support peacock' barred from United Airlines plane # Aviation @ warriors_mom http://www.bbc.com/news/world-us-canada-42880690 …",2018-01-30 15:39:46,[u'warriors_mom'],"[u'TravelTips', u'Aviation']",,0,0,958484917259788288,https://twitter.com/warriors_mom/status/958484917259788288
tessalawler,that emotional support peacock that @ united would not let board a plane today has an instagram and it is amazing @dexterthepeacock - ur welcome,2018-01-30 15:39:41,['united'],[''],,0,5,958484896951033856,https://twitter.com/tessalawler/status/958484896951033856
rhelpjilka,BBC News - 'Emotional support peacock' barred from United Airlines plane http://www.bbc.co.uk/news/world-us-canada-42880690 …,2018-01-30 15:39:40,[''],[''],,0,0,958484892635058176,https://twitter.com/rhelpjilka/status/958484892635058176
WorldWorld21,'Emotional support peacock' barred from United Airlines plane: United Airlines refuses to let a woman in New… https://goo.gl/fb/kuYMTP,2018-01-30 15:39:00,[''],[''],,0,0,958484722883137536,https://twitter.com/WorldWorld21/status/958484722883137536
COFlyerCLE,Homeward bound: Boarding@IAH: UA1513 IAH (06:05 pm LT) - CLE (08:57 pm LT) United Airlines: Houston - Cleveland # Flight,2018-01-30 15:38:59,[''],['Flight'],,0,3,958484718508527619,https://twitter.com/COFlyerCLE/status/958484718508527619
SmileAwhile242,Oh. Thought this was direct.,2018-01-30 15:38:39,[''],[''],,0,0,958484633468964864,https://twitter.com/SmileAwhile242/status/958484633468964864
Jonathan_Smth,i bet @ united would have thought twice about letting that bird on a plane if they'd known he was a social media influencer https://www.vice.com/en_us/article/59w7nq/the-support-peacock-that-couldnt-get-on-a-flight-has-a-fire-instagram-vgtrn …,2018-01-30 15:38:19,[u'united'],[''],,14,55,958484552078495745,https://twitter.com/Jonathan_Smth/status/958484552078495745
Jefe_Maextro,United Airlines deniega el embarque a una mujer que viajaba con un pavo real como animal de apoyo emocional http://dlvr.it/QDLBdW pic.twitter.com/ntUOZIFWhH,2018-01-30 15:38:10,[''],[''],,0,0,958484515478896642,https://twitter.com/Jefe_Maextro/status/958484515478896642
united,"Have a great trip, Tamara! Always great having you on board. ^AD",2018-01-30 15:37:26,[''],[''],,0,0,958484328857481216,https://twitter.com/united/status/958484328857481216
robbysoave,http://reason.com/blog/2018/01/30/you-are-not-entitled-to-bring-an-emotion …,2018-01-30 15:37:20,[''],[''],,3,9,958484302244864000,https://twitter.com/robbysoave/status/958484302244864000
mcgov4,@ adamcarolla @ AdamCarollaShow Adam when will it ever end..... Emotional support peacock pouts after United Airlines rejection onto a flight,2018-01-30 15:37:03,"['adamcarolla', 'AdamCarollaShow']",[''],,0,0,958484232418004993,https://twitter.com/mcgov4/status/958484232418004993
1184bce,# Beyond100Days BBC News - 'Emotional support peacock' barred from United Airlines plane http://www.bbc.com/news/world-us-canada-42880690 … So what happens when a fellow passenger has a morbid fear of your friend? Maybe a couple of lawsuits (airline & BFF) will stop this insanity and narcissism. .,2018-01-30 15:36:59,[''],[u'Beyond100Days'],,0,0,958484214558556161,https://twitter.com/1184bce/status/958484214558556161
Gunntwitt,But still no emotional support-peacocks allowed right?,2018-01-30 15:36:58,[''],[''],,0,0,958484213598244864,https://twitter.com/Gunntwitt/status/958484213598244864
kfranklinphd,Relieved that @ united has finally decided to hold the line ... at peacocks! http://wapo.st/2nuXy6e?tid=ss_tw&utm_term=.b5038ec55654 …,2018-01-30 15:36:49,[u'united'],[''],,0,0,958484173659897856,https://twitter.com/kfranklinphd/status/958484173659897856
Sergiio_Che,United Airlines deniega el embarque a una mujer que viajaba con un pavo real como animal de apoyo emocional https://es.gizmodo.com/united-airlines-deniega-el-embarque-a-una-mujer-que-via-1822566344 …,2018-01-30 15:36:26,[''],[''],,0,0,958484077476229120,https://twitter.com/Sergiio_Che/status/958484077476229120
TamaraMcCleary,About to # flythefriendlyskies @ united. # NYC here I come pic.twitter.com/Rd1AxLFW3i – bei Denver International Airport (DEN),2018-01-30 15:36:21,[u'united'],"[u'flythefriendlyskies', u'NYC']",,6,17,958484055997276161,https://twitter.com/TamaraMcCleary/status/958484055997276161
sidrae_,"Strangely enough, @ united doesn’t allow peacocks on their flights. https://www.msn.com/en-us/travel/news/woman-denied-emotional-support-peacock-on-united-flight/ar-BBIti2U?li=BBnbfcL …",2018-01-30 15:35:50,[u'united'],[''],,0,4,958483925873012736,https://twitter.com/sidrae_/status/958483925873012736
JohnConnolly_22,Woman's emotional support peacock denied seat on flight at Newark Airport @ EWRairport @ United https://njersy.co/2FuV4MH  via @ northjersey,2018-01-30 15:35:27,"[u'EWRairport', u'United', u'northjersey']",[''],,0,1,958483831216136192,https://twitter.com/JohnConnolly_22/status/958483831216136192
FamilyMassageWA,'Emotional support peacock' barred from United Airlines plane http://bbc.in/2EqMsaD  OMGhttps://twitter.com/BBCWorld/status/958477824347820032 …,2018-01-30 15:35:14,[''],[''],,0,0,958483776077627392,https://twitter.com/FamilyMassageWA/status/958483776077627392
i_b_ur_doug,I didn’t mind the bludgeoned doctor but this...this is the last straw United Airlines Forced Emotional Support Peacock to Give Up Its Seat http://people.com/pets/united-airlines-kicks-off-emotional-support-peacock/ … via @ people,2018-01-30 15:35:07,[u'people'],[''],,0,0,958483745861984257,https://twitter.com/i_b_ur_doug/status/958483745861984257
DJFergyFerg,And I was worried about carry-on's for economy # UnitedAirlines https://twitter.com/BBCWorld/status/958477824347820032 …,2018-01-30 15:35:01,[''],[u'UnitedAirlines'],,0,0,958483720138194944,https://twitter.com/DJFergyFerg/status/958483720138194944
SputnikInt,Emotional support # peacock denied seat on @ united (PHOTOS) https://sptnkne.ws/gAPH pic.twitter.com/kPElU4MeZD,2018-01-30 15:35:00,[u'united'],[u'peacock'],,2,6,958483716627714048,https://twitter.com/SputnikInt/status/958483716627714048
Channel933,Emotional Support Peacock Denied Boarding By United Airlines http://ihe.art/n4Y7D4T,2018-01-30 15:34:33,[''],[''],,0,1,958483605210222593,https://twitter.com/Channel933/status/958483605210222593
mwalter1624,I vaguely remember that my great-grandmother had a peacock on her farm. I also vaguely remember my family not letting me near it for fear it might peck my eyeballs out. Well done @ united # PeacocksAreMean # EmotionalSupportPeacockhttps://washingtonpost.com/news/animalia/wp/2018/01/30/a-woman-tried-to-board-a-plane-with-her-emotional-support-peacock-united-wouldnt-let-it-fly/ …,2018-01-30 15:33:39,[u'united'],"[u'PeacocksAreMean', u'EmotionalSupportPeacockhttps']",,0,1,958483376876466176,https://twitter.com/mwalter1624/status/958483376876466176
DisorderlyF,"The Coliseum will now be officially named the United Airlines Memorial Coliseum. Aka the ""Fighting Arena"". What a mess, # USC lol.",2018-01-30 15:33:26,[''],['USC'],,0,4,958483320437858304,https://twitter.com/DisorderlyF/status/958483320437858304
1057ManUp,Emotional Support Peacock Denied Boarding By United Airlines http://ihe.art/kUgf1M6,2018-01-30 15:33:17,[''],[''],,0,0,958483283515531265,https://twitter.com/1057ManUp/status/958483283515531265
AnandaBarton,"Those shithole countries, right? # FakeChristian",2018-01-30 15:33:10,[''],['FakeChristian'],,0,0,958483255111573504,https://twitter.com/AnandaBarton/status/958483255111573504
GalleyGab,"I'm getting an emotional support squid. This way, I can train it to squirt ink at all the people that annoy me!",2018-01-30 15:32:56,[''],[''],,0,1,958483196009766912,https://twitter.com/GalleyGab/status/958483196009766912
MD_Taij,If I’m flying first class explain to me how I don’t get a meal because you e ran out of food @ united keep in mind I paid for this flight didn’t use my miles and wasn’t upgraded,2018-01-30 15:32:42,[u'united'],[''],,0,0,958483137352388608,https://twitter.com/MD_Taij/status/958483137352388608
AnandaBarton,Takes a pig to know a pig. # FakeChristian,2018-01-30 15:32:36,[''],['FakeChristian'],,0,0,958483113184657408,https://twitter.com/AnandaBarton/status/958483113184657408
abc7newsbayarea,Woman denied to bring emotional support peacock on # UnitedAirlines flight because airline said it didn't meet their guidelines. http://abc7ne.ws/2nvv0tI,2018-01-30 15:32:33,[''],[u'UnitedAirlines'],,8,14,958483100262129664,https://twitter.com/abc7newsbayarea/status/958483100262129664
nuiotwo,It's now officially the United Airlines Memorial Coliseum http://www.latimes.com:80/sports/la-sp-usc-coliseum-renovation-20180129-story.html#nt=oft13a-4gp1latimes.com/sports/la-sp-u …,2018-01-30 15:32:14,[''],[''],,0,0,958483020570398720,https://twitter.com/nuiotwo/status/958483020570398720
matthewworkman,"If @ united won't let a woman bring her emotional support peacock on a plane, what's to keep them from denying boarding to my emotional support alpaca?",2018-01-30 15:32:08,['united'],[''],,1,2,958482993470783488,https://twitter.com/matthewworkman/status/958482993470783488
Rteefact,United Airlines Denies Boarding to Emotional Service Animal...a Peacock - Live and Let's Fly http://liveandletsfly.boardingarea.com/2018/01/29/united-airlines-peacock/ …,2018-01-30 15:30:49,[''],[''],,0,0,958482662381031429,https://twitter.com/Rteefact/status/958482662381031429
united,"We have moved it to Rymn's for repair. Since you haven't heard anything, it's best to call them directly at 800-355-8520. Please share the order number order #(769167) with them, and they should be able to give you an update. ^JR",2018-01-30 15:30:43,[''],[''],,0,0,958482637961613312,https://twitter.com/united/status/958482637961613312
Worldnews_Media,"'Emotional support peacock' barred from United Airlines plane - United Airlines refuses to let a woman in New Jersey board a plane with a peacock, citing its size. http://ow.ly/ZBhn50gjlVW",2018-01-30 15:30:40,[''],[''],,0,0,958482624212762624,https://twitter.com/Worldnews_Media/status/958482624212762624
garyprogressive,"BBC: 'Emotional support peacock' barred from United Airlines plane - United Airlines refuses to let a woman in New Jersey board a plane with a peacock, citing its size. http://ow.ly/91zB50gjlGy",2018-01-30 15:30:28,[''],[''],,0,0,958482576221638656,https://twitter.com/garyprogressive/status/958482576221638656
WTSLosAngeles,LA Coliseum To Be Renamed To United Airlines Memorial Coliseum in Naming Rights Deal http://ow.ly/VeSA30i4EbC,2018-01-30 15:30:23,[''],[''],,0,0,958482554780356608,https://twitter.com/WTSLosAngeles/status/958482554780356608
RS210CBFan,United Airlines suddenly makes headway reining in Middle East carriers - New York Business Journal - http://www.bizjournals.com https://www.bizjournals.com/newyork/news/2018/01/29/united-airlines-suddenly-making-headway-reining-in.html?ana=apple_newyork …,2018-01-30 15:30:04,[''],[''],,0,0,958482474509598720,https://twitter.com/RS210CBFan/status/958482474509598720
Fox35News,"United Airlines recently show down one traveler's request to bring her emotional support peacock on a flight. ""This animal did not meet guidelines for a number of reasons, including its weight and size."" http://bit.ly/2BEVpKv",2018-01-30 15:30:01,[''],[''],,5,8,958482460853010432,https://twitter.com/Fox35News/status/958482460853010432
