username,text,date,mentions,hashtags,geo,retweets,favorites,id,permalink
JoshArena512,I'm not calling it that.,2018-01-29 22:33:35,[''],[''],,0,0,958226667377479680,https://twitter.com/JoshArena512/status/958226667377479680
jetsetsam,United Airlines Denies Boarding to Emotional Service Animal&#8230;a Peacock http://liveandletsfly.boardingarea.com/2018/01/29/united-airlines-peacock/ …,2018-01-29 22:31:21,[''],[''],,0,1,958226105076367361,https://twitter.com/jetsetsam/status/958226105076367361
DanielleHolden,@ united thanks for refusing to rebook a return flight from a family funeral after I mistakenly chose the wrong date # boycottunited,2018-01-29 22:29:55,['united'],['boycottunited'],,0,0,958225745653809152,https://twitter.com/DanielleHolden/status/958225745653809152
canubekiddingme,I am living in a customer service nightmare and I am not the one with the issue. I'm just observing. # UnitedAirlines customer service gets a thumbs down all day!,2018-01-29 22:28:09,[''],['UnitedAirlines'],,0,0,958225300805976064,https://twitter.com/canubekiddingme/status/958225300805976064
misenogle,"@ Delta totally does because their fancy pretzel sticks are gluten free AND their biscoff cookies have their logo in it. That being said, if you use @ united early morning, you’ll have a life changing stroopwafel",2018-01-29 22:26:42,"[u'Delta', u'united']",[''],,0,1,958224936761528321,https://twitter.com/misenogle/status/958224936761528321
Sportazine,USC stadium to be renamed United Airlines Memorial Coliseum – ESPN http://sportazine.com/usc-stadium-to-be-renamed-united-airlines-memorial-coliseum-espn/ …,2018-01-29 22:21:35,[''],[''],,0,0,958223647055007745,https://twitter.com/Sportazine/status/958223647055007745
paydawg,Boycott @ united,2018-01-29 22:19:01,['united'],[''],,0,0,958223002008629248,https://twitter.com/paydawg/status/958223002008629248
TashaCaufield,I used to be a Woman of Troy... Now I’m a “Woman of Troy brought to you by United Airlines...” And we will still # FightOn # USC http://www.latimes.com/sports/la-sp-usc-coliseum-renovation-20180129-story.html?outputType=amp&__twitter_impression=true …,2018-01-29 22:18:31,[''],"[u'FightOn', u'USC']",,0,0,958222879119888386,https://twitter.com/TashaCaufield/status/958222879119888386
USA_Biz,United Airlines Secures Naming Rights to L.A. Coliseum https://goo.gl/t2b6eK # USA # US # USBiz,2018-01-29 22:17:59,[''],"[u'USA', u'US', u'USBiz']",,0,0,958222743673110528,https://twitter.com/USA_Biz/status/958222743673110528
travelinsports,"Coliseum sells naming rights to United Airlines - The Los Angeles Memorial Coliseum will be renamed the United Airlines Memorial Coliseum after the first naming rights deal in the history of the iconic venue was struck, USC said. http://ow.ly/SRkq50giLou",2018-01-29 22:15:54,[''],[''],,0,0,958222219200679936,https://twitter.com/travelinsports/status/958222219200679936
castrojanrx,Naming after the disgraceful act of @ UnitedAirlines ?,2018-01-29 22:15:53,['UnitedAirlines'],[''],,0,1,958222213559107584,https://twitter.com/castrojanrx/status/958222213559107584
MiamiMetropolis,United Airlines Secures Naming Rights to L.A. Coliseum http://themiamimetropolis.com/blog/2018/01/30/united-airlines-secures-naming-rights-to-l-a-coliseum/ …,2018-01-29 22:15:50,[''],[''],,0,0,958222201676877824,https://twitter.com/MiamiMetropolis/status/958222201676877824
miles_report,"The pope, the Olympics, the Rams and now, United Airlines. LA Memorial Coliseum gets new name # UnitedAirlines https://milesreport.com/airlines/ua/news#t15642 …",2018-01-29 22:12:03,[''],[u'UnitedAirlines'],,0,0,958221247774674944,https://twitter.com/miles_report/status/958221247774674944
misterbisson,I have to thank the @ united agent at ICN who was a huge help in navigating security with sensitive analog film. Thank you!,2018-01-29 22:08:35,['united'],[''],,0,0,958220379025125376,https://twitter.com/misterbisson/status/958220379025125376
united,"We're sorry to hear you say that. If you need any help with anything, please DM us and let us know. ^TY",2018-01-29 22:08:06,[''],[''],,0,0,958220253921607680,https://twitter.com/united/status/958220253921607680
FCFeed,United Airlines Secures Naming Rights to L.A. Coliseum http://dlvr.it/QDD8c1 pic.twitter.com/fBZrZE3n8g,2018-01-29 22:07:06,[''],[''],,0,0,958220005606178816,https://twitter.com/FCFeed/status/958220005606178816
jeffsyou,United Airlines Memorial Coliseum just doesn’t have the same ring to it,2018-01-29 22:06:45,[''],[''],,0,1,958219918092185601,https://twitter.com/jeffsyou/status/958219918092185601
miles_report,United Airlines purchases naming rights for 'United Airlines Memorial Coliseum' # UnitedAirlines https://milesreport.com/airlines/ua/news#t15644 …,2018-01-29 22:06:03,[''],[u'UnitedAirlines'],,0,0,958219739649708032,https://twitter.com/miles_report/status/958219739649708032
miles_report,United Airlines purchases naming rights for 'United Airlines Memorial Coliseum' # UnitedAirlines https://milesreport.com/airlines/ua/news#t15643 …,2018-01-29 22:06:03,[''],[u'UnitedAirlines'],,0,0,958219738777378817,https://twitter.com/miles_report/status/958219738777378817
elizabezenitram,@ united Decided it would be awesome to not ship my luggage with my flight and to top it off they give me the shittiest gift bag as a sorry. Umm no I want my bag like ASAP. If anything goes missing I'm throwing the biggest fit of life.,2018-01-29 22:04:18,['united'],[''],,0,0,958219300271153153,https://twitter.com/elizabezenitram/status/958219300271153153
itsjustAdrienne,And no one wants to hear your baby crying on the red eye. Can’t fucking drive 3000 mi over the Pacific.,2018-01-29 22:02:46,[''],[''],,0,1,958218913896054785,https://twitter.com/itsjustAdrienne/status/958218913896054785
topsecretk9,but what about all those long time # UnitedAirlines employees that got shafted out of their pensions during mergers and whatnot? 70 million for naming rights?,2018-01-29 22:02:36,[''],['UnitedAirlines'],,0,1,958218872879923201,https://twitter.com/topsecretk9/status/958218872879923201
knockaroundguy2,@ united is the worst airline and possibly worst company ever.,2018-01-29 22:02:35,['united'],[''],,0,0,958218866231881728,https://twitter.com/knockaroundguy2/status/958218866231881728
sdkhuntersports,Coliseum sells naming rights to United Airlines http://www.espn.com/college-football/story/_/id/22259284/los-angeles-coliseum-sells-naming-rights-united-airlines …,2018-01-29 22:01:46,[''],[''],,0,0,958218661847642112,https://twitter.com/sdkhuntersports/status/958218661847642112
DavalynCorp,"United Airlines Secures Naming Rights to L.A. Coliseum - The Los Angeles Memorial Coliseum will become the United Airlines Memorial Coliseum in a $69 million deal struck with the airline and the coliseum’s operator, the University of Southern Californ... http://ow.ly/D3Bs50giKTX",2018-01-29 22:00:53,[''],[''],,0,0,958218439985958913,https://twitter.com/DavalynCorp/status/958218439985958913
smetso,You’ll love the way the Rams fly @ united pic.twitter.com/hj40Ec2YNQ,2018-01-29 22:00:44,[u'united'],[''],,0,0,958218402190864384,https://twitter.com/smetso/status/958218402190864384
EINAirlineNews,Los Angeles Memorial Coliseum to get new name after deal with United Airlines http://s.einnews.com/m6t5BahAhQ,2018-01-29 22:00:18,[''],[''],,0,0,958218293755764736,https://twitter.com/EINAirlineNews/status/958218293755764736
timarts,@ united I have a connecting flight in Houston on February 8. Arrive from LAX and fly to Amsterdam. Is 37 minutes enough to make my flight? Both flights are United Airlines.,2018-01-29 21:59:27,['united'],[''],,0,0,958218080429080577,https://twitter.com/timarts/status/958218080429080577
lamack,"USC Partners w/United Airlines, the NEW UNITED AIRLINES MEMORIAL COLISEUM # usc # unitedairlines # memorialcoliseum http://www.president.usc.edu/files/2018/01/Wall-Street-Journal-LA-Coliseum.pdf …",2018-01-29 21:59:23,[''],"[u'usc', u'unitedairlines', u'memorialcoliseum']",,0,0,958218061223403520,https://twitter.com/lamack/status/958218061223403520
itsjustAdrienne,I can’t even tell if you’re being sarcastic or not...,2018-01-29 21:59:13,[''],[''],,0,0,958218019146100738,https://twitter.com/itsjustAdrienne/status/958218019146100738
pdinatale09,Coliseum sells naming rights to United Airlines http://www.espn.com/college-football/story/_/id/22259284 …,2018-01-29 21:58:35,[''],[''],,0,0,958217861436190720,https://twitter.com/pdinatale09/status/958217861436190720
united,"Hi, Liv. Have you heard about our same day change policy here? http://bit.ly/GJX0RL  ^TY",2018-01-29 21:57:37,[''],[''],,0,0,958217615796666369,https://twitter.com/united/status/958217615796666369
topsecretk9,United universally fucked a shit ton of long time employees out of their retirements (pennies) during mergers etc. -- terrible look @ UnitedAirlines # Shamehttps://twitter.com/FOXLA/status/958206486206758914 …,2018-01-29 21:57:03,[u'UnitedAirlines'],[u'Shamehttps'],,0,0,958217474217975808,https://twitter.com/topsecretk9/status/958217474217975808
JackO116,nobody is going to call the LA Coliseum the 'United Airlines Memorial Coliseum'. I still call the 'StubHub... https://fb.me/58pRHV4Kz,2018-01-29 21:56:22,[''],[''],,0,0,958217303312752640,https://twitter.com/JackO116/status/958217303312752640
pracasgautam,United Airlines ko chakab yo year pani continue hune bho jasto xa,2018-01-29 21:55:43,[''],[''],,0,1,958217141307588608,https://twitter.com/pracasgautam/status/958217141307588608
clevelprogram,Los Angeles Memorial Coliseum to get new name after deal with United Airlines https://goo.gl/MbVTGg # Business # FOX News,2018-01-29 21:55:14,[''],"[u'Business', u'FOX']",,0,0,958217018641039360,https://twitter.com/clevelprogram/status/958217018641039360
bj_youngerman,"Exciting day for United, USC and the new United Airlines Memorial Coliseum! # beingunitedpic.twitter.com/WvE1VDLnxE",2018-01-29 21:54:12,[''],['beingunitedpic'],,0,13,958216757126168577,https://twitter.com/bj_youngerman/status/958216757126168577
LosAngelesSRH,# WeLoveLA # USCTrojans # FightOn Los Angeles Memorial Coliseum to get new name after deal with United Airlines http://srhlink.com/QDD5qy # SportsRoadhouse,2018-01-29 21:53:07,[''],"[u'WeLoveLA', u'USCTrojans', u'FightOn', u'SportsRoadhouse']",,0,0,958216486929117184,https://twitter.com/LosAngelesSRH/status/958216486929117184
LosAngelesSRH,# WeLoveLA # USCTrojans # FightOn A Win for Los Angeles: United Airlines Comes to the Coliseum http://srhlink.com/QDD5pr # SportsRoadhouse,2018-01-29 21:53:06,[''],"[u'WeLoveLA', u'USCTrojans', u'FightOn', u'SportsRoadhouse']",,0,0,958216482147610624,https://twitter.com/LosAngelesSRH/status/958216482147610624
_BusinessAngels,United Airlines Secures Naming Rights to L.A. Coliseum http://ift.tt/2nok5lg # WSJ # WallStreet # BusinessAngel # OnlineBusiness # Finance # Markets # Money,2018-01-29 21:52:23,[''],"[u'WSJ', u'WallStreet', u'BusinessAngel', u'OnlineBusiness', u'Finance', u'Markets', u'Money']",,0,0,958216300085596160,https://twitter.com/_BusinessAngels/status/958216300085596160
anthrsdo,The # LosAngeles Memorial Coliseum will have a new official name: the @ United Airlines Memorial Coliseum. # LA # avgeekhttp://www.latimes.com/sports/la-sp-usc-coliseum-renovation-20180129-story.html …,2018-01-29 21:51:51,[u'United'],"[u'LosAngeles', u'LA', u'avgeekhttp']",,1,1,958216165754630145,https://twitter.com/anthrsdo/status/958216165754630145
Artscphoto,Landmark L.A. venue to be renamed United Airlines Memorial Coliseum https://www.ocregister.com/2018/01/29/landmark-l-a-venue-to-be-renamed-united-airlines-memorial-coliseum/ …,2018-01-29 21:51:24,[''],[''],,0,1,958216054110433280,https://twitter.com/Artscphoto/status/958216054110433280
lavapajamas,"i'm never going to call it that. and anyone that does, you're getting a swirly.",2018-01-29 21:51:23,[''],[''],,0,1,958216050478215168,https://twitter.com/lavapajamas/status/958216050478215168
costanzo740,"United Airlines purchases naming rights for 'United Airlines Memorial Coliseum', http://www.foxla.com/news/local-news/united-airlines-purchases-naming-rights-for-united-airlines-memorial-coliseum …",2018-01-29 21:51:15,[''],[''],,0,0,958216014709182464,https://twitter.com/costanzo740/status/958216014709182464
aclvinbot,4 out of 5 doctors recommend @ united,2018-01-29 21:50:53,['united'],[''],,0,0,958215923114143746,https://twitter.com/aclvinbot/status/958215923114143746
summedupusa,Los Angeles Memorial Coliseum To Get New Name After Deal With United Airlines http://www.newssummedup.com/a/fwnspf,2018-01-29 21:50:36,[''],[''],,0,0,958215852624506880,https://twitter.com/summedupusa/status/958215852624506880
LindseyThiry,Outrage! USC sold the naming rights to the Coliseum. It will officially be the United Airlines Memorial Coliseum. (But you can still just call it... the Coliseum). http://www.latimes.com/sports/la-sp-usc-coliseum-renovation-20180129-story.html …,2018-01-29 21:50:25,[''],[''],,6,33,958215806189322241,https://twitter.com/LindseyThiry/status/958215806189322241
Edoardocignoli,United Airlines Secures Naming Rights to L.A. Coliseum http://ift.tt/2nok5lg,2018-01-29 21:50:21,[''],[''],,0,0,958215789856870401,https://twitter.com/Edoardocignoli/status/958215789856870401
TravelTourisgo,United Airlines' Plan to Beat Delta and American Could Lower Airfares for Everybody - Fortune http://dlvr.it/QDD4yw,2018-01-29 21:48:03,[''],[''],,0,0,958215210119999488,https://twitter.com/TravelTourisgo/status/958215210119999488
r_duke71,RIP @ united,2018-01-29 21:46:40,['united'],[''],,0,0,958214863398100993,https://twitter.com/r_duke71/status/958214863398100993
Lead_ership,United Airlines Secures Naming Rights to L.A. Coliseum http://ift.tt/2nok5lg,2018-01-29 21:46:31,[''],[''],,0,0,958214824399433728,https://twitter.com/Lead_ership/status/958214824399433728
alftroika,The latest The ACG Post! https://paper.li/alftroika/1386557140?edition_id=5bc77370-055f-11e8-b29f-0cc47a0d15fd … # unitedairlines,2018-01-29 21:45:40,[''],[u'unitedairlines'],,0,0,958214611899121664,https://twitter.com/alftroika/status/958214611899121664
Newszweek,United Airlines Secures Naming Rights to L.A. Coliseum http://ift.tt/2nok5lg,2018-01-29 21:44:20,[''],[''],,0,0,958214275830607872,https://twitter.com/Newszweek/status/958214275830607872
DavidWSheppard,United Airlines Secures Naming Rights to L.A. Coliseum http://ift.tt/2nok5lg,2018-01-29 21:44:16,[''],[''],,0,0,958214259338555392,https://twitter.com/DavidWSheppard/status/958214259338555392
economy2018,United Airlines Secures Naming Rights to L.A. Coliseum http://dlvr.it/QDD481 # Economypic.twitter.com/CbVsbgXj6e,2018-01-29 21:44:09,[''],[u'Economypic'],,0,0,958214227004612608,https://twitter.com/economy2018/status/958214227004612608
shelbylaneMD,United Airlines Secures Naming Rights to L.A. Coliseum http://dlvr.it/QDD46H pic.twitter.com/hqEGEowwCy,2018-01-29 21:44:08,[''],[''],,0,0,958214222374043649,https://twitter.com/shelbylaneMD/status/958214222374043649
earlduncand,United Airlines Secures Naming Rights to L.A. Coliseum https://www.wsj.com/articles/los-angeles-memorial-coliseum-to-get-new-name-after-deal-with-united-airlines-1517248800?mod=pls_whats_news_us_business_f …,2018-01-29 21:44:05,[''],[''],,0,0,958214211666051072,https://twitter.com/earlduncand/status/958214211666051072
united,"Hey there, it looks like you purchased our Basic Economy ticket. If you'd like us to verify this for you, please DM your confirmation number. Also, please make sure you understand the restrictions of this type of ticket before your flight: http://bit.ly/2f20e8K . ^JBhttps://twitter.com/messages/compose?recipient_id=260907612 …",2018-01-29 21:43:53,[''],[''],,0,0,958214161560842240,https://twitter.com/united/status/958214161560842240
IAMAFLATA,Y’all paid to promote this?,2018-01-29 21:43:34,[''],[''],,0,1,958214080623534080,https://twitter.com/IAMAFLATA/status/958214080623534080
RamsNewsNow,Coliseum sells naming rights to United Airlines http://www.espn.com/college-football/story/_/id/22259284 …,2018-01-29 21:43:27,[''],[''],,2,3,958214050936119296,https://twitter.com/RamsNewsNow/status/958214050936119296
daily_economy,United Airlines Secures Naming Rights to L.A. Coliseum http://ift.tt/2nok5lg,2018-01-29 21:43:08,[''],[''],,0,0,958213973614219265,https://twitter.com/daily_economy/status/958213973614219265
back2babylon5,"Wait...United Airlines is dead, and this is their memorial? I know they had some problems with their PR disasters over the past year, but I thought they were starting to bounce back?",2018-01-29 21:42:57,[''],[''],,0,0,958213928269549568,https://twitter.com/back2babylon5/status/958213928269549568
briantmarshall,Third time in a row that WIFI isn’t working on @ united flight...two being international. maybe it’ll work the next two flights this week? pic.twitter.com/QdEXmXVW0d,2018-01-29 21:42:26,[u'united'],[''],,0,2,958213798057295872,https://twitter.com/briantmarshall/status/958213798057295872
aakashjain92,United Airlines Secures Naming Rights to L.A. Coliseum http://ift.tt/2nok5lg,2018-01-29 21:42:06,[''],[''],,0,0,958213712392933376,https://twitter.com/aakashjain92/status/958213712392933376
DannyMerkury,"Go home Jack, you're drunk.",2018-01-29 21:40:38,[''],[''],,0,0,958213343835144193,https://twitter.com/DannyMerkury/status/958213343835144193
MeanestMom017,Yankee Echo Sierra,2018-01-29 21:40:26,[''],[''],,0,0,958213292194922496,https://twitter.com/MeanestMom017/status/958213292194922496
TehMafiaJoe,United Airlines Secures Naming Rights to L.A. Coliseum https://www.wsj.com/articles/los-angeles-memorial-coliseum-to-get-new-name-after-deal-with-united-airlines-1517248800?mod=pls_whats_news_us_business_f …,2018-01-29 21:40:13,[''],[''],,0,0,958213237379600384,https://twitter.com/TehMafiaJoe/status/958213237379600384
NighteStudios,Wow that's terrible I'm so sorry Kins :(,2018-01-29 21:39:35,[''],[''],,0,2,958213079048781825,https://twitter.com/NighteStudios/status/958213079048781825
Feeds4U,United Airlines Secures Naming Rights to L.A. Coliseum http://bit.ly/2Eo8riu # Business # News,2018-01-29 21:39:06,[''],"[u'Business', u'News']",,0,0,958212959674576896,https://twitter.com/Feeds4U/status/958212959674576896
TravelIndustry2,United Airlines Memorial Coliseum: Name change for one of LA's historic venues - http://FOXSports.com http://dlvr.it/QDD3GF,2018-01-29 21:38:48,[''],[''],,0,0,958212883552264192,https://twitter.com/TravelIndustry2/status/958212883552264192
hankalan,Owning up to missing my flight. Definitely my fault. Also definitely way more costly than other airlines. Classic millennial calling out other millennials...,2018-01-29 21:36:39,[''],[''],,0,0,958212343044845570,https://twitter.com/hankalan/status/958212343044845570
bridges2italy,"Los Angeles Memorial Coliseum To Get New Name After Deal With United Airlines Renaming deal, largest in college sports, supports stadium’s $270 million upgrade ahead of the 2028 Summer Olympics @ USC # FightOn",2018-01-29 21:36:29,[u'USC'],[u'FightOn'],,0,0,958212298513965056,https://twitter.com/bridges2italy/status/958212298513965056
turnertweets2,Bag Check boutta be a disaster... Coliseum sells naming rights to United Airlines http://www.espn.com/college-football/story/_/id/22259284 …,2018-01-29 21:34:58,[''],[''],,0,0,958211917067182080,https://twitter.com/turnertweets2/status/958211917067182080
WePublishMedia,The latest online news. Check it in the new WePublish Media ® Paper! https://paper.li/WePublishMedia/1413876768?edition_id=07ffcbf1-057f-11e8-84c2-0cc47a0d164b … # unitedairlines,2018-01-29 21:33:01,[''],[u'unitedairlines'],,0,0,958211426849624064,https://twitter.com/WePublishMedia/status/958211426849624064
united,"Yes, depending on volume, we do our best to engage with all customers who have questions or need assistance. ^JB",2018-01-29 21:32:25,[''],[''],,0,0,958211274164207616,https://twitter.com/united/status/958211274164207616
iOCDad,United Airlines Memorial Coliseum. # lame,2018-01-29 21:31:07,[''],['lame'],,0,0,958210947620904960,https://twitter.com/iOCDad/status/958210947620904960
LosAngelesSRH,# WeLoveLA # LARams LA landmark stadium to be renamed as United Airlines Memorial Coliseum http://srhlink.com/QDD1NY # SportsRoadhouse,2018-01-29 21:29:07,[''],"[u'WeLoveLA', u'LARams', u'SportsRoadhouse']",,0,0,958210447311712256,https://twitter.com/LosAngelesSRH/status/958210447311712256
LosAngelesSRH,# WeLoveLA # LARams Los Angeles Memorial Coliseum to get new name after deal with United Airlines http://srhlink.com/QDD1NP # SportsRoadhouse,2018-01-29 21:29:07,[''],"[u'WeLoveLA', u'LARams', u'SportsRoadhouse']",,0,0,958210446133051392,https://twitter.com/LosAngelesSRH/status/958210446133051392
Bahdal,Coliseum sells naming rights to United Airlines http://dlvr.it/QDD1Dr pic.twitter.com/b8luguHIS1,2018-01-29 21:29:06,[''],[''],,0,0,958210441070563328,https://twitter.com/Bahdal/status/958210441070563328
DOCWASH,Still gonna call it the Coliseum.,2018-01-29 21:26:50,[''],[''],,0,1,958209869378592769,https://twitter.com/DOCWASH/status/958209869378592769
luisoninternett,Congrats on 1k! Thank you for choosing United as your airline to travel!,2018-01-29 21:26:17,[''],[''],,0,1,958209733105561600,https://twitter.com/luisoninternett/status/958209733105561600
DNurmi,United Airlines denies boarsing to a “emotional support peacock.” http://liveandletsfly.boardingarea.com/2018/01/29/united-airlines-peacock/ …,2018-01-29 21:25:14,[''],[''],,0,0,958209466515812352,https://twitter.com/DNurmi/status/958209466515812352
LosAngelesShow,USC stadium to be renamed United Airlines Memorial Coliseum - ESPN http://dlvr.it/QDD0XG,2018-01-29 21:24:37,[''],[''],,0,0,958209313679450112,https://twitter.com/LosAngelesShow/status/958209313679450112
Aali_Inam,Nice!,2018-01-29 21:24:03,[''],[''],,0,0,958209168120406016,https://twitter.com/Aali_Inam/status/958209168120406016
KuzmaNews,Does that mean people will be selected at random to be dragged out of the stadium?,2018-01-29 21:21:57,[''],[''],,0,0,958208639663144960,https://twitter.com/KuzmaNews/status/958208639663144960
M_Mohsin_Ali,@ united Ticket pricing and customer service aren't mutually exclusive. Please try to do a better job at letting people fly on somewhat economical prices while not paying insane fees for checked baggage.,2018-01-29 21:21:28,['united'],[''],,0,0,958208519882362880,https://twitter.com/M_Mohsin_Ali/status/958208519882362880
VIPortalINC,USC stadium to be renamed United Airlines Memorial Coliseum http://dlvr.it/QDCzsl pic.twitter.com/9Mrl7qWiMN,2018-01-29 21:20:20,[''],[''],,0,0,958208235458125824,https://twitter.com/VIPortalINC/status/958208235458125824
mmkjc717,The Los Angeles Memorial Coliseum will now be officially known as the United Airlines Memorial Coliseum. http://www.latimes.com/sports/la-sp-usc-coliseum-renovation-20180129-story.html …,2018-01-29 21:20:01,[''],[''],,0,0,958208156567453696,https://twitter.com/mmkjc717/status/958208156567453696
TheMajorsLA,[Charlotte Observer] – USC Trojans’ home is now officially the United Airlines Memorial Coliseum http://sportspyder.com/teams/usc-trojans-football/articles/23948726 …,2018-01-29 21:15:46,[''],[''],,0,0,958207086076317697,https://twitter.com/TheMajorsLA/status/958207086076317697
mksanto,Coliseum sells naming rights to United Airlines http://dlvr.it/QDCywz pic.twitter.com/5fZub7ZhkF,2018-01-29 21:15:11,[''],[''],,0,0,958206938059177984,https://twitter.com/mksanto/status/958206938059177984
NMGRadio5,# Sports: USC stadium to be renamed United Airlines Memorial Coliseum - ESPN http://dlvr.it/QDCycn # MixAlotDjz,2018-01-29 21:15:01,[''],"[u'Sports', u'MixAlotDjz']",,0,0,958206897315655680,https://twitter.com/NMGRadio5/status/958206897315655680
LosAngelesPlaza,USC stadium to be renamed United Airlines Memorial Coliseum - ESPN http://dlvr.it/QDCyT7,2018-01-29 21:14:04,[''],[''],,0,0,958206656122253313,https://twitter.com/LosAngelesPlaza/status/958206656122253313
GDLA,United Airlines purchases naming rights for 'United Airlines Memorial Coliseum' http://www.foxla.com/news/local-news/united-airlines-purchases-naming-rights-for-united-airlines-memorial-coliseum …,2018-01-29 21:13:23,[''],[''],,4,8,958206486215192577,https://twitter.com/GDLA/status/958206486215192577
FOXLA,United Airlines purchases naming rights for 'United Airlines Memorial Coliseum' http://www.foxla.com/news/local-news/united-airlines-purchases-naming-rights-for-united-airlines-memorial-coliseum …,2018-01-29 21:13:23,[''],[''],,27,27,958206486206758914,https://twitter.com/FOXLA/status/958206486206758914
RealRayLalonde,"Très célèbre LA Memorial Coliseum, domicile @ USC Trojans depuis 1923, sera renommé United Airlines Memorial Coliseum dès 2019. United Airlines paiera 69M$/16 ans pour les droits. Avec une réno de 270M$ menant aux JO de 2028, ces $$ serviront à absorber une partie des coûts pic.twitter.com/lGzpAHxwZw",2018-01-29 21:12:06,[u'USC'],[''],,2,4,958206164059205633,https://twitter.com/RealRayLalonde/status/958206164059205633
thestyIestimes,11:11 for my dad to get a job in united airlines at sf,2018-01-29 21:11:33,[''],[''],,0,0,958206024493752320,https://twitter.com/thestyIestimes/status/958206024493752320
davilyra,"I don't have a problem with selling the naming rights. It is an excellent source of revenue. And the almost 70 million dollars in the deal will be nice. However, @ united has to prove it's a worth partner for @ USC's tradition.http://www.latimes.com/sports/la-sp-usc-coliseum-renovation-20180129-story.html …",2018-01-29 21:09:36,"[u'united', u'USC']",[''],,0,0,958205535739760640,https://twitter.com/davilyra/status/958205535739760640
