username,text,date,mentions,hashtags,geo,retweets,favorites,id,permalink
kdivcni,Oh brother!!! I need my therapy donkey next time I fly.,2018-01-30 08:43:18,[''],[''],,0,0,958380107692953601,https://twitter.com/kdivcni/status/958380107692953601
BrianAHodges46,Enough is enough. Good job @ united! https://twitter.com/FoxNews/status/958369092817350656 …,2018-01-30 08:43:07,[u'united'],[''],,0,1,958380061014548480,https://twitter.com/BrianAHodges46/status/958380061014548480
MrsJavi1,"For someone who claims to love Jesus, your attitude is appallingly elitist. I miss when Christians actually attempted to emulate Christ's behavior.",2018-01-30 08:43:01,[''],[''],,0,2,958380039082594311,https://twitter.com/MrsJavi1/status/958380039082594311
psanchezdl,Why waste my time asking me to DM if you're not actually going to help? Extremely frustrating way to treat a customer that's been flying @ traveloneworld for 20 years now. Guess it's @ staralliance and @ united for me from now on.,2018-01-30 08:42:51,"['traveloneworld', 'staralliance', 'united']",[''],,0,0,958379997567356928,https://twitter.com/psanchezdl/status/958379997567356928
ArielSierra,@ united > @ Delta,2018-01-30 08:42:34,"['united', 'Delta']",[''],,0,0,958379923781009408,https://twitter.com/ArielSierra/status/958379923781009408
Mueller52111,"Just last week, I was denied my nude, emotional support dominatrix. United Airlines are Nazis. https://twitter.com/GovMikeHuckabee/status/958371842347106305 …",2018-01-30 08:42:18,[''],[''],,0,0,958379857032990720,https://twitter.com/Mueller52111/status/958379857032990720
charzdesigns,"My buddy, Tiny, always flies with me...I need his emotional support and I always seem to get the whole plane to myself! # Emotionalsupport @ GovMikeHuckabeepic.twitter.com/8UHTFzpyJE",2018-01-30 08:42:07,['GovMikeHuckabeepic'],['Emotionalsupport'],,0,4,958379812569182210,https://twitter.com/charzdesigns/status/958379812569182210
VTRaiderBooster,"Next time I fly, I want to bring my Emotional Support Girlfriend, and i better not have to pay for a ticket...that will shame me, and I will not tolerate that! # sarcasm",2018-01-30 08:42:00,[''],['sarcasm'],,0,3,958379779895513089,https://twitter.com/VTRaiderBooster/status/958379779895513089
Cheryl_Searle,Lobby reception full of wonderful Supervisors from across @ United’s system networking and learning about # Core4. # BeingUnited @ weareunited pic.twitter.com/DJCRh0jMwV – bei Palmer House Hilton,2018-01-30 08:41:50,"[u'United', u'weareunited']","[u'Core4', u'BeingUnited']",,1,27,958379738589954048,https://twitter.com/Cheryl_Searle/status/958379738589954048
PeculiarBaptist,"Thank you, @ united. https://twitter.com/foxnews/status/958369092817350656 …",2018-01-30 08:41:38,[u'united'],[''],,0,0,958379688002437120,https://twitter.com/PeculiarBaptist/status/958379688002437120
DawnMacc,Your son tortured a puppy.,2018-01-30 08:41:30,[''],[''],,0,0,958379656003993600,https://twitter.com/DawnMacc/status/958379656003993600
melonhead97,"Honestly, there have been times that I would have preferred to sit next to a peacock on a flight. Elbow room is under rated",2018-01-30 08:40:54,[''],[''],,1,2,958379506246418434,https://twitter.com/melonhead97/status/958379506246418434
CapitalEdgeNY,Not the Onion Good on ya @ united - people have lost their minds https://twitter.com/FoxNews/status/958369092817350656 …,2018-01-30 08:40:07,[u'united'],[''],,0,1,958379307830861824,https://twitter.com/CapitalEdgeNY/status/958379307830861824
dmolish85,Tee up an “Airplane “ follow up @ keeneniwayans ! I’m in!!!,2018-01-30 08:39:34,[u'keeneniwayans'],[''],,0,0,958379167543836672,https://twitter.com/dmolish85/status/958379167543836672
TrumpblueMe,I knew there was something good about United.,2018-01-30 08:39:26,[''],[''],,0,1,958379135562387457,https://twitter.com/TrumpblueMe/status/958379135562387457
LuxAngela,Just don't let your son near anyone's pet.,2018-01-30 08:39:11,[''],[''],,0,1,958379075088896002,https://twitter.com/LuxAngela/status/958379075088896002
HoustonInterAir,Squawk 7601 Federal Law Enforcement: ABB537/N85323//UNITED AIRLINES INC https://flightaware.com/live/modes/ABB537/ident/N85323/redirect …,2018-01-30 08:39:06,[''],[''],,0,0,958379053010046978,https://twitter.com/HoustonInterAir/status/958379053010046978
jajais4u,"That's a ""window"" seat because it has a view of a window lml",2018-01-30 08:39:05,[''],[''],,0,0,958379046353719297,https://twitter.com/jajais4u/status/958379046353719297
Becks543,Did you know emotional support animals help combat vets with PTSD? So you’re saying a combat vet is too fragile to rent a car?,2018-01-30 08:38:38,[''],[''],,0,3,958378935183663106,https://twitter.com/Becks543/status/958378935183663106
TadpoleSwimming,,2018-01-30 08:38:25,[''],[''],,0,0,958378881983098880,https://twitter.com/TadpoleSwimming/status/958378881983098880
smartconserv76,Thanks. That’s how I roll bitchy waiter.,2018-01-30 08:38:24,[''],[''],,0,0,958378876148776960,https://twitter.com/smartconserv76/status/958378876148776960
JCStegeman,This is the last time I ever even think about flying @ united!! A completely classes corporation IMO https://twitter.com/FoxNews/status/958369092817350656 …,2018-01-30 08:38:01,[u'united'],[''],,0,4,958378779524640771,https://twitter.com/JCStegeman/status/958378779524640771
BayStaterInFL,"People today are SELFISH. They have no problem with YOU stepping/sitting in their dog hair/waste, or even getting bitten.. Just so long as they get what they want. They do the same thing in restaurants and retail locations.",2018-01-30 08:37:37,[''],[''],,0,0,958378680593600513,https://twitter.com/BayStaterInFL/status/958378680593600513
SupaFud,He’s an all-purpose insulter...gets as many in as possible.,2018-01-30 08:37:25,[''],[''],,0,0,958378629460840448,https://twitter.com/SupaFud/status/958378629460840448
Ironpelvis_IV,Don't dare bring your dog as Huckabee's kid will murder it.,2018-01-30 08:36:16,[''],[''],,0,0,958378338917191683,https://twitter.com/Ironpelvis_IV/status/958378338917191683
Lighty99,"Sometimes it doesn’t work as well as planned. I had a security check on my own that took forever because they had no experience doing it with a wheelchair. There are positives, but negatives as well.",2018-01-30 08:36:15,[''],[''],,0,1,958378336211931138,https://twitter.com/Lighty99/status/958378336211931138
RosangelaTho,"It truly became a festival of mediocricy. West Palm Beach ppl are as nasty as ghetto towns. And they r entitled. I miss when air travel was expensive, not everyone could do it",2018-01-30 08:36:09,[''],[''],,0,0,958378308294643712,https://twitter.com/RosangelaTho/status/958378308294643712
SupaFud,"Well, your kids kill dogs for entertainment, so yah... we get it. Maybe keep your opinions on this down.",2018-01-30 08:35:40,[''],[''],,0,1,958378188035493888,https://twitter.com/SupaFud/status/958378188035493888
stan_mcmurray,"This emotional support business with animals is being abused, as in most things, a few selfish self-centered jerks take advantage and ruin it for those that really need it.",2018-01-30 08:35:30,[''],[''],,0,0,958378147946393600,https://twitter.com/stan_mcmurray/status/958378147946393600
luvforusa,End up making people ill on plane from some sort of bacteria or virus from animals.,2018-01-30 08:35:14,[''],[''],,0,0,958378077322702848,https://twitter.com/luvforusa/status/958378077322702848
dan_covfefe,Instead of a peacock she should get an Obama doll. Same difference.,2018-01-30 08:35:08,[''],[''],,0,0,958378052517380096,https://twitter.com/dan_covfefe/status/958378052517380096
cdowskdad,Was the person doing yoga in the United Airlines airplane aisle appropriating culture or just being obnoxious?,2018-01-30 08:34:54,[''],[''],,0,0,958377995160440833,https://twitter.com/cdowskdad/status/958377995160440833
Doctor_JRD,"Without notification, you just changed my flights. Never again!",2018-01-30 08:34:23,[''],[''],,0,0,958377864105250816,https://twitter.com/Doctor_JRD/status/958377864105250816
Doctor_JRD,"Without notification, you just changed my flights. Never again!",2018-01-30 08:34:14,[''],[''],,0,0,958377826369056771,https://twitter.com/Doctor_JRD/status/958377826369056771
Willow_Shakes,Looks like a slow news day on @ FoxNews. Are they having trouble coming up with new lies and conspiracy theories?,2018-01-30 08:33:51,['FoxNews'],[''],,1,9,958377731934142464,https://twitter.com/Willow_Shakes/status/958377731934142464
Bmichaelhimself,pic.twitter.com/oYEdyLjvXJ,2018-01-30 08:33:47,[''],[''],,0,0,958377714989191168,https://twitter.com/Bmichaelhimself/status/958377714989191168
pgrandee10,I don't fly united...last time was when oj was being chased down the freeway by the police,2018-01-30 08:33:45,[''],[''],,0,0,958377707070308352,https://twitter.com/pgrandee10/status/958377707070308352
JolieBloue,She could just identify as a peacock...,2018-01-30 08:33:12,[''],[''],,0,4,958377567236575232,https://twitter.com/JolieBloue/status/958377567236575232
AmericansCreed,"I wonder if the bird would have to be ""padded down"".",2018-01-30 08:33:01,[''],[''],,0,0,958377519350255617,https://twitter.com/AmericansCreed/status/958377519350255617
MissTree18,LOL Mike.... too much my man,2018-01-30 08:32:55,[''],[''],,0,2,958377496776462337,https://twitter.com/MissTree18/status/958377496776462337
tom_tsetung,McCabe still didn’t want to leave his seat. Wray had to call United Airlines Security to come dragging him away. https://twitter.com/jali_cat/status/958109395371651072 …,2018-01-30 08:32:41,[''],[''],,4,5,958377437464702976,https://twitter.com/tom_tsetung/status/958377437464702976
primesilver,"""Rent a car"" - do you know how air travel works? Specifically that there are places that cars actually can't reach, due to things like ""oceans""?",2018-01-30 08:32:36,[''],[''],,0,2,958377415188860928,https://twitter.com/primesilver/status/958377415188860928
ricz,"at least they took care of you, as for me, I'm not so happy with them lately... @ united overbooked 3 of the 4 flights on my last trip and changed the seats we choose before, so our group had to go separate....",2018-01-30 08:32:25,['united'],[''],,0,0,958377370544738304,https://twitter.com/ricz/status/958377370544738304
iamwinston7,Pigs you say?pic.twitter.com/4Uo33nSdGi,2018-01-30 08:32:17,[''],[''],,0,0,958377334884786178,https://twitter.com/iamwinston7/status/958377334884786178
bitchywaiter,That’s hilarious! Such a cunning way to insult Hillary Clinton. Brilliant!,2018-01-30 08:32:02,[''],[''],,0,0,958377273526292480,https://twitter.com/bitchywaiter/status/958377273526292480
AlJanetMagee1,Lordy.,2018-01-30 08:31:43,[''],[''],,0,0,958377195562590208,https://twitter.com/AlJanetMagee1/status/958377195562590208
jday02,About its loyal customers who have spent tens of thousands of dollars a year on AA. Hello @ united!! Goodbye @ AmericanAir.,2018-01-30 08:31:28,"['united', 'AmericanAir']",[''],,0,0,958377131138011136,https://twitter.com/jday02/status/958377131138011136
RickWNicholson,I side with @ united also. @ FoxNewshttps://twitter.com/govmikehuckabee/status/958371842347106305 …,2018-01-30 08:31:21,"[u'united', u'FoxNewshttps']",[''],,0,0,958377099726860290,https://twitter.com/RickWNicholson/status/958377099726860290
LindseyThiry,A sign of the times: USC has sold naming rights to the Coliseum. Coming in August 2019: United Airlines Memorial Coliseum. Necessary they say to fund renovations and upgrades. http://www.latimes.com/sports/usc/la-sp-usc-coliseum-renovation-20180129-story.html …,2018-01-30 08:30:59,[''],[''],,3,7,958377008001462272,https://twitter.com/LindseyThiry/status/958377008001462272
bitchywaiter,Who exactly are you trying to insult?,2018-01-30 08:30:29,[''],[''],,0,3,958376882264858624,https://twitter.com/bitchywaiter/status/958376882264858624
OCDVirgo51,"The answer is very simple. All ""support"" animals must go through training and be certified. Change the law where someone must show the certification in a closed environment.",2018-01-30 08:30:20,[''],[''],,0,0,958376845694693376,https://twitter.com/OCDVirgo51/status/958376845694693376
Kathy_g417,This is the funniest tweet of the day!pic.twitter.com/BzSifFkNJG,2018-01-30 08:29:58,[''],[''],,0,0,958376755521294336,https://twitter.com/Kathy_g417/status/958376755521294336
jday02,"After 3 years of being Executive Platinum on @ AmericanAir and 2.1 million miles, I am switching to @ united. I am so frustrated with not being able to use my systemwide upgrades on AA when there is 80%+ availability and the flight is less than 3 weeks away. AA doesn’t care......",2018-01-30 08:29:46,"[u'AmericanAir', u'united']",[''],,0,0,958376704430526465,https://twitter.com/jday02/status/958376704430526465
TrashyTrashPand,"""...ppl get on with their chickens, pigs, and goats."" In other words, the Huckabee family has boarded.",2018-01-30 08:29:38,[''],[''],,0,0,958376669651390464,https://twitter.com/TrashyTrashPand/status/958376669651390464
JeffreyGuterman,Agreed. The airlines even let you on board.,2018-01-30 08:29:36,[''],[''],,2,22,958376660457451521,https://twitter.com/JeffreyGuterman/status/958376660457451521
LisaRago1,"I’m informing the huckster here, who doesn’t understand that not all service animals are dogs only.",2018-01-30 08:29:09,[''],[''],,0,0,958376546670006272,https://twitter.com/LisaRago1/status/958376546670006272
skr52562,Yes!!,2018-01-30 08:28:59,[''],[''],,0,0,958376504668307456,https://twitter.com/skr52562/status/958376504668307456
Impact97,Get a life!!,2018-01-30 08:28:23,[''],[''],,0,0,958376353467895810,https://twitter.com/Impact97/status/958376353467895810
hurrymurray,You would be better off getting them to offer medical insurance. Deep Vein Thrombosis can be a real pain.,2018-01-30 08:28:17,[''],[''],,0,1,958376329845596160,https://twitter.com/hurrymurray/status/958376329845596160
Impact97,"That may be true, but it doesn’t belong on an airplane!!",2018-01-30 08:27:56,[''],[''],,0,0,958376241891078148,https://twitter.com/Impact97/status/958376241891078148
_secrets_japan_,# Japan # Japantravel # travel Inflight WIFI On United Airlines http://bit.ly/2E0BydK pic.twitter.com/x1nRNxRLkz,2018-01-30 08:27:39,[''],"[u'Japan', u'Japantravel', u'travel']",,0,2,958376170210365440,https://twitter.com/_secrets_japan_/status/958376170210365440
Impact97,Huh!!,2018-01-30 08:26:38,[''],[''],,0,0,958375914706006016,https://twitter.com/Impact97/status/958375914706006016
donnauhlmann,Are you still a governor? # southernfriedfatass,2018-01-30 08:26:31,[''],['southernfriedfatass'],,0,1,958375885555621888,https://twitter.com/donnauhlmann/status/958375885555621888
Nardongputik91,How about a small dog instead.,2018-01-30 08:26:17,[''],[''],,0,0,958375827347066880,https://twitter.com/Nardongputik91/status/958375827347066880
Impact97,Oh lighten up please!!!,2018-01-30 08:25:46,[''],[''],,0,0,958375698355367937,https://twitter.com/Impact97/status/958375698355367937
TXWayne,Gotta hear both sides......United Airlines Forced Emotional Support Peacock to Give Up Its Seat http://www.travelandleisure.com/travel-news/united-airlines-denies-boarding-emotional-support-peacock …,2018-01-30 08:25:44,[''],[''],,0,0,958375686997184512,https://twitter.com/TXWayne/status/958375686997184512
38specialcolt,And dressed in their Walmart pajamas,2018-01-30 08:25:21,[''],[''],,0,1,958375590784131073,https://twitter.com/38specialcolt/status/958375590784131073
LadyJessMacBeth,You need an emotional support sloth.,2018-01-30 08:25:03,[''],[''],,0,2,958375517941465088,https://twitter.com/LadyJessMacBeth/status/958375517941465088
united,Can we help you with your luggage situation? Please direct message us if you can: ^NJhttps://twitter.com/messages/compose?recipient_id=260907612 …,2018-01-30 08:24:41,[''],[''],,0,0,958375424425250816,https://twitter.com/united/status/958375424425250816
jfink23,"I don’t care what anyone else says, @ united is the best airline. Switched loyalty from American to them. Flight just landed 40 minutes early. Didn’t have to wait to get to gate. Service has always been great",2018-01-30 08:24:19,[u'united'],[''],,0,0,958375330145820674,https://twitter.com/jfink23/status/958375330145820674
thoed_e,Help RT @ TravelLeisure: United Airlines forced emotional support peacock to give up its seat http://tandl.me/2EkUpxW pic.twitter.com/54TKNcUBjH,2018-01-30 08:24:18,[u'TravelLeisure'],[''],,0,0,958375327855775750,https://twitter.com/thoed_e/status/958375327855775750
RickieMC84,Mike Huckabee...world’s fakest Christian.,2018-01-30 08:23:47,[''],[''],,0,1,958375196053901312,https://twitter.com/RickieMC84/status/958375196053901312
joannperrone15,"Does this woman work for NBC, because that would certainly explain a lotpic.twitter.com/BcGP5ZxEJO",2018-01-30 08:23:22,[''],[''],,1,15,958375091917684736,https://twitter.com/joannperrone15/status/958375091917684736
BlueCrush2018,Can I bring my emotional support horse? @ united,2018-01-30 08:22:52,['united'],[''],,0,0,958374966076104704,https://twitter.com/BlueCrush2018/status/958374966076104704
LisaRago1,"I’ve seen all kinds of service animals. A kid who had high functioning autism, who only responded to one particular chicken. His family tried dogs, along with other kinds of animals. The chicken is what helped him. You may want to do some research.",2018-01-30 08:22:23,[''],[''],,0,2,958374845107941377,https://twitter.com/LisaRago1/status/958374845107941377
DaveWarstler,RIP @ united https://twitter.com/joeyrkaufman/status/958075298498560000 …,2018-01-30 08:22:14,[u'united'],[''],,0,0,958374807879536641,https://twitter.com/DaveWarstler/status/958374807879536641
FedUp610,"Instead of a peacock, this woman needs a psychiatrist!",2018-01-30 08:22:11,[''],[''],,0,0,958374795300823040,https://twitter.com/FedUp610/status/958374795300823040
campbellsl,"I see a pattern in your bullying, Rev. Mike. You go for low-hanging fruit and have fun with it. And I find myself again flipping through my Bible to see your scriptural basis for this waste of time. People are hungry. Children go without shelter. But you want to argue a peacock.",2018-01-30 08:22:06,[''],[''],,0,5,958374774299942913,https://twitter.com/campbellsl/status/958374774299942913
GarnetBill,paging Gloria Allred,2018-01-30 08:21:59,[''],[''],,0,0,958374742486147073,https://twitter.com/GarnetBill/status/958374742486147073
shoeler,are you mad you can't bring the family dog onto a plane,2018-01-30 08:21:55,[''],[''],,0,0,958374727382458369,https://twitter.com/shoeler/status/958374727382458369
DeltaSegmentFly,I know all about the small cities paying a premium. Maybe United will also come to @ triflight ! United Airlines' plan to beat Delta and American could lower airfares for everybody http://for.tn/2Eny17m  via @ FortuneMagazine,2018-01-30 08:21:54,"[u'triflight', u'FortuneMagazine']",[''],,1,1,958374721506201600,https://twitter.com/DeltaSegmentFly/status/958374721506201600
sandisellshomes,,2018-01-30 08:21:53,[''],[''],,0,2,958374718779817985,https://twitter.com/sandisellshomes/status/958374718779817985
TYMAYA,"Please Please TBN take this so called preacher who talks about this racist president, and should be talking about God off your show!!!! He is a disgrace to TBN!!!!!!!!!!!!!!!!",2018-01-30 08:21:46,[''],[''],,0,1,958374690342555649,https://twitter.com/TYMAYA/status/958374690342555649
Sparks1Sharon,# ItsAllAboutMe with this generation.,2018-01-30 08:21:40,[''],['ItsAllAboutMe'],,0,0,958374666820710400,https://twitter.com/Sparks1Sharon/status/958374666820710400
sickoftheleft,I bet it’s the first time in her life anyone said no to her.,2018-01-30 08:21:33,[''],[''],,0,0,958374637561352193,https://twitter.com/sickoftheleft/status/958374637561352193
liongrit1,"The world is regressing, as if to return to the stone age. My God. The potential to progress is here. It seems, a lot of people dont want it. I use to think zombies were just in the movies.",2018-01-30 08:21:21,[''],[''],,0,3,958374586990645254,https://twitter.com/liongrit1/status/958374586990645254
thisjohnalston,"@ united Airlines strikes deal with @ USC for naming rights to # LAColiseum. First 100 spectators will receive $13,000 bribe and then be dragged from their seats.",2018-01-30 08:21:19,"['united', 'USC']",['LAColiseum'],,0,0,958374577133924352,https://twitter.com/thisjohnalston/status/958374577133924352
HiDaveGarcia,@ ZachHonig @ united Why no United Club @ iflymia MIA? And the food options in this Concourse G are terrible!,2018-01-30 08:20:58,"['ZachHonig', 'united', 'iflymia']",[''],,0,0,958374490047729664,https://twitter.com/HiDaveGarcia/status/958374490047729664
ItsAboutTime18,Can you imagine if the next person bring a ororororororororor. This is too funny,2018-01-30 08:20:29,[''],[''],,0,7,958374366764417024,https://twitter.com/ItsAboutTime18/status/958374366764417024
k30blzr,Did @ emirates contract out # CustomerService to # UnitedAirlines? @ UAL @ unitedsucksbuzz,2018-01-30 08:20:03,"['emirates', 'UAL', 'unitedsucksbuzz']","['CustomerService', 'UnitedAirlines']",,0,0,958374257402269696,https://twitter.com/k30blzr/status/958374257402269696
LisaRago1,"I hope your son rents cars instead of flys, God forbid someone needs a service dog. I’m sure they don’t want their dog tortured until it dies right in front of them.",2018-01-30 08:20:03,[''],[''],,0,0,958374257251172352,https://twitter.com/LisaRago1/status/958374257251172352
MrCspotRun,But you get to save your energy for more important activities and skip the security line.,2018-01-30 08:20:00,[''],[''],,0,1,958374246920671233,https://twitter.com/MrCspotRun/status/958374246920671233
belmore_art,We thought @ United was bad!,2018-01-30 08:19:18,['United'],[''],,0,0,958374069757448192,https://twitter.com/belmore_art/status/958374069757448192
captionreportin,"Ignorance is not a virtue, http://Mike.You  should travel beyond Walmart.",2018-01-30 08:19:18,[''],[''],,0,1,958374068088197120,https://twitter.com/captionreportin/status/958374068088197120
JHarrison2014,I always have emotional support vodka.,2018-01-30 08:19:04,[''],[''],,1,9,958374011955707904,https://twitter.com/JHarrison2014/status/958374011955707904
GoForLiberty,Ugh - you are so right.,2018-01-30 08:19:00,[''],[''],,0,0,958373995384107009,https://twitter.com/GoForLiberty/status/958373995384107009
kmk6435,All the wrong information by @ united providing HORRIBLE customer service. # YOUSUCKUNITEDhttps://twitter.com/kmk6435/status/957251947899314177 …,2018-01-30 08:18:33,[u'united'],[u'YOUSUCKUNITEDhttps'],,0,0,958373882016272384,https://twitter.com/kmk6435/status/958373882016272384
booomersays,@ united told me the same thing about my emotional support buffalo that i tried to take to Florida. THESE RULES NEED CHANGED # TRIGGERED,2018-01-30 08:18:32,['united'],['TRIGGERED'],,0,0,958373877595430918,https://twitter.com/booomersays/status/958373877595430918
michael48717145,# ReleaseTheMemo # WeThePeople,2018-01-30 08:18:03,[''],"['ReleaseTheMemo', 'WeThePeople']",,0,1,958373755339845632,https://twitter.com/michael48717145/status/958373755339845632
imbearclansami,How diverse will these 'selfie' people become only for attention? (and/or lawsuits) Just like bad children. Pitiful. @ PressSec @ larryelder @ JudgeJeanine @ JesseBWatters @ realDonaldTrump @ FoxNews @ BreitbartNews @ DianeBlackTN,2018-01-30 08:18:02,"['PressSec', 'larryelder', 'JudgeJeanine', 'JesseBWatters', 'realDonaldTrump', 'FoxNews', 'BreitbartNews', 'DianeBlackTN']",[''],,1,1,958373748452872193,https://twitter.com/imbearclansami/status/958373748452872193
SouthernTamm,This is so funny! I for one do not want to sit by a peacock when I fly!,2018-01-30 08:17:59,[''],[''],,0,0,958373739854430208,https://twitter.com/SouthernTamm/status/958373739854430208
MrUnrequited,Leave it to that unscrupulous shit stain of an institution to develop a brilliant renovation plan and then take a massive chipotle fueled shit right on it. United airlines memorial coliseum my ass.,2018-01-30 08:17:23,[''],[''],,0,0,958373586728763393,https://twitter.com/MrUnrequited/status/958373586728763393
mistybrown369,Standing with @ united on this one.,2018-01-30 08:17:17,['united'],[''],,0,0,958373561588056072,https://twitter.com/mistybrown369/status/958373561588056072
CovfefeLadyC,Yes Gov Huckabee it is I hate it now.,2018-01-30 08:17:14,[''],[''],,0,0,958373549617631234,https://twitter.com/CovfefeLadyC/status/958373549617631234
smartconserv76,I bet you she voted for HRC.,2018-01-30 08:17:11,[''],[''],,0,0,958373536409837576,https://twitter.com/smartconserv76/status/958373536409837576
Russ_Graves,"Well, we do have a Jackass in the White House... # AnimalFarm # Resistance",2018-01-30 08:16:35,[''],"['AnimalFarm', 'Resistance']",,0,0,958373385209335808,https://twitter.com/Russ_Graves/status/958373385209335808
wkanter,"When you need absolute clarity on stupid acts from the liberal crowd, Gov Huck can cut to the quick with the best of them. And the apple doesn't fall far as his daughter @ PressSec, Mrs. Sanders, chops down MSM daily. Patriots thru and thru. God bless.",2018-01-30 08:16:33,['PressSec'],[''],,1,2,958373377076613120,https://twitter.com/wkanter/status/958373377076613120
Old_Privateer,So true. I can remember when we dressed in Sunday clothes to take a trip on a plane. We had stewardesses that served you. Not Flight attendants who just attended the same flight you are on. Seats were comfortable. Plane was clean. Now its like riding the old Trailways bus.,2018-01-30 08:16:31,[''],[''],,0,3,958373369111564289,https://twitter.com/Old_Privateer/status/958373369111564289
KevDwy,"If I were getting on an airplane with my dog and found out your son was on the same plane, I would definitely rent a car.",2018-01-30 08:16:22,[''],[''],,0,3,958373329190170628,https://twitter.com/KevDwy/status/958373329190170628
PrestidgJerry,Toss her off let the peacock ride bird probably has better people mixing values.,2018-01-30 08:15:56,[''],[''],,0,8,958373220477997056,https://twitter.com/PrestidgJerry/status/958373220477997056
