text,date,retweets,favorites,negative,neutral,positive,compound
"We can't control TSA operations, but we are happy to confirm you for the next available flight. Please DM us. ^TY",2017-04-09 03:11:58,0,0,0.0,0.704,0.296,0.8402
Omgg,2017-04-09 03:11:08,0,0,0.0,1.0,0.0,0.0
"Pardon the delay, Christopher. We see that this flight has arrived. Are you now on your way? ^MD",2017-04-09 03:09:52,0,0,0.112,0.777,0.112,0.0
How about giving free flights to rescued animals needing homes or flight buddies to new home locations instead of killing baby chicks to eat,2017-04-09 03:09:42,0,0,0.134,0.608,0.258,0.4767
@ united I will be sitting here on standby all day in EWR because I got to the gate 1 minute late because of security.,2017-04-09 03:09:28,0,0,0.0,0.785,0.215,0.6369
We responded to your DM. ^DP,2017-04-09 03:09:19,0,0,0.0,1.0,0.0,0.0
Sorry already erase the previous Tweet and send the DM,2017-04-09 03:08:29,0,0,0.126,0.874,0.0,-0.0772
"Hey, Keith. We're sorry to hear you are having this experience with us. If you need assistance with your reservation, DM us. ^TYhttps://twitter.com/messages/compose?recipient_id=260907612 …",2017-04-09 03:07:15,0,0,0.056,0.944,0.0,-0.0772
"Please send your post in a DM. Thanks, Luis. ^DP https://twitter.com/messages/compose?recipient_id=260907612 …",2017-04-09 03:05:59,0,0,0.0,0.606,0.394,0.6369
"Enjoy, Mandy. ^DP",2017-04-09 03:04:50,0,0,0.0,0.385,0.615,0.4939
We do not allow online video streaming (or online meetings) as it takes away from bandwidth from the rest of the cabin. ^TY,2017-04-09 03:03:55,0,0,0.07,0.93,0.0,-0.1695
"Luis, what part of Premier Access was not offered in GDL and in IAH? ^DP",2017-04-09 03:03:03,0,0,0.0,1.0,0.0,0.0
"Checking out the movies on my @ united flight.. I'm so not going to be bored!! Suicide Squad, 8x Harry Potter and só many new movies!",2017-04-09 03:02:27,0,1,0.232,0.682,0.087,-0.6884
You should not have any problems. ^DP,2017-04-09 03:00:52,0,0,0.0,0.727,0.273,0.3089
Yes. It appears in the image that I sent in the previous twit,2017-04-09 02:57:50,0,0,0.0,0.803,0.197,0.4019
"Are you saying they have the benefit, and they did not apply it? ^DP",2017-04-09 02:55:57,0,0,0.0,0.813,0.188,0.4588
@ united And the captain and the crew arrived after me,2017-04-09 02:54:45,0,0,0.0,0.763,0.237,0.4215
@ united After waiting in premier access security and getting to gate 1 minute after the 30 min boarding United gives my seat away. You suck,2017-04-09 02:54:09,0,0,0.094,0.647,0.259,0.6249
"In Guadalajara and in Houston if they have that benefit, badly which did not respect it",2017-04-09 02:54:00,0,0,0.261,0.6,0.139,-0.3927
We apologize for the setback. Let us know if you have any questions along the way. ^RD,2017-04-09 02:52:28,11,56,0.0,0.92,0.08,0.1027
Apparently @ united thinks it's ok to delay a flight 7 HOURS and just wants us to be ok with that. Not like we have plans or anything.,2017-04-09 02:51:15,0,0,0.072,0.625,0.303,0.7506
We regret you were unable to bring your carry-on on board. Gate agents have the discretion to ga... https://ual.response.lithium.com/portal/conversation/17784503 …,2017-04-09 02:50:58,0,0,0.135,0.865,0.0,-0.4215
Hey @ united thanks for making me pay to check my 9x14x22 carry on,2017-04-09 02:49:53,0,4,0.082,0.585,0.333,0.6486
"Sit back, relax, and enjoy the comfort. ^RD",2017-04-09 02:49:30,0,1,0.0,0.368,0.632,0.8225
"Premier Access is not guaranteed in all airports. There are 4 items and not all 4 maybe available, as... https://ual.response.lithium.com/portal/conversation/17786016 …",2017-04-09 02:49:18,0,0,0.0,1.0,0.0,0.0
"This is very disturbing to hear, George. Your loyalty means a lot to us. Can you please DM us further details? ^RD",2017-04-09 02:49:04,0,0,0.131,0.657,0.212,0.2975
"N5506Y United Airlines Boeing 777-322(ER): Photo by Colin Moeser taken 07 April, 2017 at… https://goo.gl/fb/jkDoDR",2017-04-09 02:48:42,0,0,0.0,0.833,0.167,0.4215
@ united well done! # Polaris # saksfifthavenue @ saks @Muinch Airport https://www.instagram.com/p/BSqPyCtgdya/,2017-04-09 02:47:23,0,0,0.0,0.574,0.426,0.636
Buy this ticket on your web page for Mexico at the airport told me that it didn't Premiere Access and my tickets say that if I have it,2017-04-09 02:44:52,0,0,0.0,1.0,0.0,0.0
Please see this page regarding Premier Access: http://bit.ly/1qlry3C . ^DP,2017-04-09 02:40:34,0,0,0.0,0.777,0.223,0.3182
"Sorry for the late response. Benjamin, has your friend been helped? DM us the details. ^RD",2017-04-09 02:39:42,0,0,0.07,0.757,0.173,0.4404
"While safety is our top priority, we apologize for any stress these delays caused. ^RD",2017-04-09 02:37:45,0,0,0.141,0.556,0.303,0.296
"['United Airlines 777 airplane toy plane, RT6266'] https://www.amazon.com/United-Airlines-airplane-plane-RT6266/dp/B00176N1UW?SubscriptionId=AKIAIUXRJQI57DUVIN6A&tag=victoriaebren-20&linkCode=xm2&camp=2025&creative=165953&creativeASIN=B00176N1UW … # offer # off2017-04-09 09:37",2017-04-09 02:37:07,0,0,0.0,1.0,0.0,0.0
"$346 r/t - Los Angeles (LAX) to San Juan, Puerto Rico (SJU): https://goo.gl/Qw4bdo  | @ United @ flyLAXairportpic.twitter.com/B5VBk0jj5J",2017-04-09 02:36:55,0,0,0.0,0.823,0.177,0.4215
"['United Airlines 777 airplane toy plane, RT6266'] https://www.amazon.com/United-Airlines-airplane-plane-RT6266/dp/B00176N1UW?SubscriptionId=AKIAIUXRJQI57DUVIN6A&tag=victoriaebren-20&linkCode=xm2&camp=2025&creative=165953&creativeASIN=B00176N1UW … # offer # off2017-04-09 09:36",2017-04-09 02:36:07,0,0,0.0,1.0,0.0,0.0
@ united Hi! why it says Premier Access on the reservation ? pic.twitter.com/85LwNvQoso,2017-04-09 02:35:26,0,0,0.0,0.764,0.236,0.4753
# nowater sit on tarmac in # economyplus @ UnitedAirlines @ unitedair_sucks ?? Watch # unitedpolaris get lots of liquids. # unitedairlinessucks,2017-04-09 02:29:30,1,3,0.0,1.0,0.0,0.0
We know we can do better than this. Thank you for bringing this to our attention. ^RD,2017-04-09 02:29:20,0,0,0.0,0.735,0.265,0.6597
"Oh no. Jared, were you able to get your luggage evaluated at the airport? ^RD",2017-04-09 02:28:48,0,0,0.136,0.864,0.0,-0.296
"This is upsetting, Theresa. Please DM us further details. ^RD",2017-04-09 02:28:08,1,0,0.231,0.597,0.172,-0.2023
Yes I am still in DC. Trying to get home to SC. 24 hours later. But I did get to hotel...,2017-04-09 02:25:26,8,237,0.0,0.87,0.13,0.4019
"We acknowledge your frustration, Joe. This isn't the experience we like to hear. DM us if you need help. ^RD",2017-04-09 02:21:43,0,0,0.123,0.672,0.206,0.2732
# loseyourflight # economyplus? @ UnitedAirlines # group5 @ unitedair_sucks Worst airline ever,2017-04-09 02:20:43,0,1,0.369,0.631,0.0,-0.6249
That flight is currently 90% boarded. It is currently at 15 minutes from departure. They are aware of any... https://ual.response.lithium.com/portal/conversation/17785984 …,2017-04-09 02:20:29,0,0,0.0,1.0,0.0,0.0
"['United Airlines 777 airplane toy plane, RT6266'] https://www.amazon.com/United-Airlines-airplane-plane-RT6266/dp/B00176N1UW?SubscriptionId=AKIAIUXRJQI57DUVIN6A&tag=victoriaebren-20&linkCode=xm2&camp=2025&creative=165953&creativeASIN=B00176N1UW … # offer # off2017-04-09 09:17",2017-04-09 02:17:06,0,0,0.0,1.0,0.0,0.0
David is the coolest. DM us the details. We'll let his team know. ^RD,2017-04-09 02:15:50,0,0,0.0,1.0,0.0,0.0
"@ girlsnogood Just checking in, Sophia. Your safety is very important to us. DM us if you need help. ^RD",2017-04-09 02:14:53,0,0,0.0,0.678,0.322,0.7645
@ united please don't leave without me. UA975. I'm at GVA and clearing passport control from on time connection.,2017-04-09 02:13:52,0,0,0.0,0.706,0.294,0.6426
"We got you covered, Sara. Glad it all worked out. ^RD",2017-04-09 02:12:29,0,0,0.0,0.769,0.231,0.4588
"Jon, we're terribly sorry to hear this. Were they able to get this resolved for you? ^RD",2017-04-09 02:11:32,0,0,0.236,0.674,0.09,-0.4633
"Oh no, this sounds unsettling. Rob, which flight were you on? ^RD",2017-04-09 02:07:57,0,0,0.367,0.633,0.0,-0.7003
# unitedairlinessucks @ UnitedAirlines @ unitedsucksbuzz @ unitedair_sucks want worst service ever? Fly # UA -worse than budget carriers,2017-04-09 02:07:06,4,5,0.369,0.564,0.067,-0.7845
"Hi Rob, we value your concern. However, those seats are available for purchase prior to the flight. ^RD",2017-04-09 02:06:33,0,0,0.164,0.727,0.109,-0.296
De vliegtuigmaatschappij United Airlines per jaar 16 miljoen vellen papier en 1 miljoen liter brandstof bespaard door de iPad.,2017-04-09 02:05:41,0,1,0.0,0.859,0.141,0.4215
"['United Airlines 777 airplane toy plane, RT6266'] https://www.amazon.com/United-Airlines-airplane-plane-RT6266/dp/B00176N1UW?SubscriptionId=AKIAIUXRJQI57DUVIN6A&tag=victoriaebren-20&linkCode=xm2&camp=2025&creative=165953&creativeASIN=B00176N1UW … # offer # off2017-04-09 09:05",2017-04-09 02:05:07,0,0,0.0,1.0,0.0,0.0
"Alison, we regret any trouble. Our agents will check bags if they anticipate a full flight. ^RD",2017-04-09 02:01:42,0,0,0.282,0.718,0.0,-0.6705
"['United Airlines 777 airplane toy plane, RT6266'] https://www.amazon.com/United-Airlines-airplane-plane-RT6266/dp/B00176N1UW?SubscriptionId=AKIAIUXRJQI57DUVIN6A&tag=victoriaebren-20&linkCode=xm2&camp=2025&creative=165953&creativeASIN=B00176N1UW … # offer # off2017-04-09 09:01",2017-04-09 02:01:08,0,0,0.0,1.0,0.0,0.0
Hi Katie. DM us further details to help us better understand. ^RD,2017-04-09 02:00:31,0,0,0.0,0.641,0.359,0.6808
@ united I want a free flight I'm jelly of @ carterjwm,2017-04-09 01:58:38,0,0,0.0,0.403,0.597,0.7506
"['United Airlines 777 airplane toy plane, RT6266'] https://www.amazon.com/United-Airlines-airplane-plane-RT6266/dp/B00176N1UW?SubscriptionId=AKIAIUXRJQI57DUVIN6A&tag=victoriaebren-20&linkCode=xm2&camp=2025&creative=165953&creativeASIN=B00176N1UW … # offer # off2017-04-09 08:56",2017-04-09 01:56:07,0,0,0.0,1.0,0.0,0.0
"He's got @ amazon, @ united, @ Google, @ Microsoft behind him. He'll definitely break world record on the retweet.",2017-04-09 01:49:32,0,0,0.0,0.644,0.356,0.7351
United Airlines Pilot Rants About Her Divorce and Donald Trump http://bit.ly/2oT06uW,2017-04-09 01:49:14,48,6,0.163,0.638,0.199,0.128
"['United Airlines 777 airplane toy plane, RT6266'] https://www.amazon.com/United-Airlines-airplane-plane-RT6266/dp/B00176N1UW?SubscriptionId=AKIAIUXRJQI57DUVIN6A&tag=victoriaebren-20&linkCode=xm2&camp=2025&creative=165953&creativeASIN=B00176N1UW … # offer # off2017-04-09 08:47",2017-04-09 01:47:07,0,0,0.0,1.0,0.0,0.0
United Airlines Pilot Rants About Her Divorce and Donald Trump http://bit.ly/2oT06uW,2017-04-09 01:40:13,32,2,0.163,0.638,0.199,0.128
united airlines is making me want to jump off a cliff,2017-04-09 01:36:43,0,1,0.0,0.661,0.339,0.4767
"['United Airlines 777 airplane toy plane, RT6266'] https://www.amazon.com/United-Airlines-airplane-plane-RT6266/dp/B00176N1UW?SubscriptionId=AKIAIUXRJQI57DUVIN6A&tag=victoriaebren-20&linkCode=xm2&camp=2025&creative=165953&creativeASIN=B00176N1UW … # offer # off2017-04-09 08:29",2017-04-09 01:29:07,0,0,0.0,1.0,0.0,0.0
"['United Airlines 777 airplane toy plane, RT6266'] https://www.amazon.com/United-Airlines-airplane-plane-RT6266/dp/B00176N1UW?SubscriptionId=AKIAIUXRJQI57DUVIN6A&tag=victoriaebren-20&linkCode=xm2&camp=2025&creative=165953&creativeASIN=B00176N1UW … # offer # off2017-04-09 08:28",2017-04-09 01:28:07,0,0,0.0,1.0,0.0,0.0
,2017-04-09 01:25:38,0,0,0.0,1.0,0.0,0.0
We apologize for any rudeness. You should always be treated with the utmost respect. Please DM det... https://ual.response.lithium.com/portal/conversation/17785884 …https://twitter.com/messages/compose?recipient_id=260907612 …,2017-04-09 01:25:19,0,0,0.107,0.601,0.292,0.5106
May 19th,2017-04-09 01:24:41,0,0,0.0,1.0,0.0,0.0
We're terribly sorry to hear this. Please DM us if you need any help. ^RD,2017-04-09 01:24:01,0,0,0.231,0.518,0.251,0.1091
We strive for your journey to be a breeze and apologize if this has not been the case. Do you need as... https://ual.response.lithium.com/portal/conversation/17785773 … https://twitter.com/messages/compose?recipient_id=260907612 …,2017-04-09 01:23:58,0,0,0.0,0.94,0.06,0.1027
Бег и гонки в тропическом раю! В этом году Марафон United Airlines на Гуаме собрал 4 335 зарегистрированных... http://fb.me/WnZyhyG9,2017-04-09 01:21:25,0,0,0.0,0.846,0.154,0.4753
"Hey Jonathan, what is going on? Send us a DM and we'll continue from there. ^DP",2017-04-09 01:21:08,0,0,0.0,1.0,0.0,0.0
Day 1 Truk trip - Saturday - first chance to work the new flightplan after United Airlines stopped flying... http://fb.me/6ACM2uv7G,2017-04-09 01:19:56,0,0,0.092,0.676,0.232,0.4404
"Sandra, this sounds concerning. Please send a DM with details. ^DP https://twitter.com/messages/compose?recipient_id=260907612 …",2017-04-09 01:19:37,0,0,0.0,0.813,0.187,0.3182
Day 1 Truk trip - first chance to work the new flightplan after United Airlines stopped flying Cairns Guam. Early... http://fb.me/RYR2mhVv,2017-04-09 01:14:51,0,0,0.084,0.705,0.211,0.4404
"While our crew is required strict rest schedules, we apologize for the wait, Omar. Thanks for your patience. ^RD",2017-04-09 01:13:06,0,0,0.0,0.798,0.202,0.5106
"GO BE A BABY ELSEWHERE, WORRYING ABOUT WHAT A COMPNAY DOES ON TWITTER. PEOPLE THESE DAYSpic.twitter.com/oP5Z7kksjp",2017-04-09 01:13:00,0,1,0.194,0.806,0.0,-0.4824
"Sadly I can only push for the reimbursement of that amount, not for the misery you have caused today. # shameonyou # travel",2017-04-09 01:10:23,0,0,0.118,0.756,0.126,0.0511
@ United you have just caused me USD 750.- in costs. You jokers will pay every cent of this amount back. Even if I need to sue. # travel,2017-04-09 01:08:18,0,0,0.05,0.851,0.099,0.34
"['United Airlines 777 airplane toy plane, RT6266'] https://www.amazon.com/United-Airlines-airplane-plane-RT6266/dp/B00176N1UW?SubscriptionId=AKIAIUXRJQI57DUVIN6A&tag=victoriaebren-20&linkCode=xm2&camp=2025&creative=165953&creativeASIN=B00176N1UW … # offer # off2017-04-09 08:08",2017-04-09 01:08:08,0,0,0.0,1.0,0.0,0.0
@ united # UA26 @ bhx_official & # UA901 @ HeathrowAirport seen from # Walsall # avgeek @ SkyBrex https://youtu.be/swxH2m8Z-cI  - https://youtu.be/upWEwc-D14Y pic.twitter.com/BzLx9XN3Wr,2017-04-09 01:07:02,0,1,0.0,0.797,0.203,0.4215
We are delighted to hear this. Great pic too. Did you by any chance catch their names? DM us the details. ^RD,2017-04-09 01:06:34,0,0,0.0,0.651,0.349,0.88
"We regret any trouble, Christopher. ^RD",2017-04-09 01:05:24,0,0,0.579,0.421,0.0,-0.6705
United doesn't want your entitled ass flying with them anyways :),2017-04-09 01:05:09,0,0,0.356,0.327,0.316,0.068
United lost my luggage and said it's not their problem to get it to me when it arrives since I'm in a foreign country. BIG FAIL @ united,2017-04-09 00:50:55,0,0,0.185,0.593,0.222,0.0836
I added a video to a @ YouTube playlist http://youtu.be/upWEwc-D14Y?a  United Airlines Flight 901 (San Francisco to LHR),2017-04-09 00:50:05,0,0,0.0,0.823,0.177,0.4215
United Airlines Flight 901 (San Francisco to LHR): http://youtu.be/upWEwc-D14Y?a  via @ YouTube,2017-04-09 00:49:43,0,0,0.0,0.781,0.219,0.4215
Can he board with or without leggings?,2017-04-09 00:49:20,0,0,0.0,1.0,0.0,0.0
Review: Flying United Airlines with Kids http://piccoloexplorer.com/2015/09/flying-london-honolulu-with-toddler/ … # FamilyTravel,2017-04-09 00:48:49,6,2,0.0,0.714,0.286,0.4215
@ united please don't sell me tickets and stick me with @ _austrian on the way back. My morning has been a nightmare,2017-04-09 00:45:30,0,0,0.0,0.779,0.221,0.6249
Thank you for your wonderful patience. ^RD,2017-04-09 00:44:19,0,0,0.0,0.446,0.554,0.7351
This is outrageous nonsense - I will never fly with @ united again. @ EVAAirUS not helpful either. Service level subzero. # travel # Seattle # lt,2017-04-09 00:41:57,0,0,0.393,0.607,0.0,-0.8542
# warning: avoid the so called # services of @ united at ANY cost. These utter idiots put me in an overbooked flight. Costs me USD 750.- now.,2017-04-09 00:39:53,0,0,0.156,0.748,0.095,-0.2023
"While seating assignments can change, please find our U.K. contact here: http://bit.ly/1Ir3Mqj . ^RD",2017-04-09 00:38:14,0,0,0.0,0.839,0.161,0.3182
"And speak to someone at the airport? Just, drive there and ask right now? Isn't that the point of customer support? lol",2017-04-09 00:37:21,0,0,0.0,0.768,0.232,0.7219
"Yes specific details THAT ARE ON YOUR WEBSITE, and not what I asked the original responder.",2017-04-09 00:36:22,0,0,0.0,0.722,0.278,0.6124
We're sorry to hear this. Was anything damaged? ^RD,2017-04-09 00:35:14,0,0,0.375,0.625,0.0,-0.4939
"We apologize this wasn't the case, Dave. So we can gather some specific details, give us a DM and we... https://ual.response.lithium.com/portal/conversation/17784586 …",2017-04-09 00:33:26,0,0,0.0,0.931,0.069,0.1027
Hey @ Wendys and @ United how many RTs to fix the middle east and end the refugee crisis https://twitter.com/tmhdoncaster/status/850762143712649217 …,2017-04-09 00:32:45,0,0,0.179,0.699,0.122,-0.3182
Not everyone is a reciprocal participant. Please let us know Houston's reason for not allowing you entrance. ^DP,2017-04-09 00:30:45,0,0,0.0,0.874,0.126,0.3182
The Retweet Call Out for @ carterjwm is on !!!!! http://calloutnews.com/VRblm # NuggsForCarter @ Wendys @ Amazon @ Google @ Microsoft @ United pic.twitter.com/6WGRJPneoc,2017-04-09 00:29:44,166,96,0.0,0.726,0.274,0.6876
Is houston part of that??? Apparently not. And why not all star alliance??,2017-04-09 00:27:25,0,0,0.0,1.0,0.0,0.0
This is concerning to hear. Can you please elaborate further? DM us the details. ^RD,2017-04-09 00:26:48,0,0,0.0,0.859,0.141,0.3182
"We apologize for any trouble, David. Let us know if you need any assistance. ^RD",2017-04-09 00:24:06,0,0,0.158,0.76,0.082,-0.3182
"Sounds unpleasant, Molly. We're sorry to hear this. Let us know if we can help. ^RD",2017-04-09 00:23:16,0,1,0.219,0.647,0.134,-0.1779
"Thank you for the accolades, Ken. We love our friendly skies team. ^DP",2017-04-09 00:21:47,0,0,0.0,0.503,0.497,0.872
@ united shoutout to 2 of the most wonderful flight attendants who helped me through a 16-hour flight from ORD to HKG on April 6th. Thanks!!! pic.twitter.com/cBIz2oMbdh,2017-04-09 00:17:27,0,1,0.0,0.665,0.335,0.8902
"It does give you access to Star Alliance-Affiliated Lounges but not all. Please see this page, ... https://ual.response.lithium.com/portal/conversation/17785329 …https://twitter.com/messages/compose?recipient_id=260907612 …",2017-04-09 00:14:15,0,0,0.126,0.874,0.0,-0.3491
"You got it, Kim. Thanks for being on board with us. ^RD",2017-04-09 00:12:43,0,0,0.0,0.791,0.209,0.4404
This includes the Houston airport,2017-04-09 00:11:17,0,0,0.0,1.0,0.0,0.0
"Hi Amanda, just wanted to check in. Were you able to make your connection? ^RD",2017-04-09 00:10:58,0,0,0.0,1.0,0.0,0.0
I have flown united to Dubai via Frankfurt 2 times in 3 weeks and denied access in all star alliance clubs. Is there a reason to have card?,2017-04-09 00:10:40,0,0,0.105,0.794,0.101,-0.0258
"Maybe you should tell the employees that since they don't know. Also, it doesn't get you into star alliance clubs. Please do something",2017-04-09 00:08:01,0,0,0.0,0.905,0.095,0.3182
We apologize if this was the case with your bag. Our intention is to always have your bag out first if i... https://ual.response.lithium.com/portal/conversation/17784604 …,2017-04-08 23:54:14,0,0,0.0,0.94,0.06,0.1027
A truly amazing airshow - love the annual performance put on by @ united # SFO # avgeek # fleetweekhttps://twitter.com/airliners_net/status/850800934615646209 …,2017-04-08 23:51:33,1,0,0.0,0.422,0.578,0.9287
Good to hear. Have an amazing flight. ^DP,2017-04-08 23:50:39,0,0,0.0,0.472,0.528,0.7717
B/E Aerospace to Launch Aspire Wide Body Main Cabin Seating with United Airlines - http://aaablogsite.gbp.com.sg/?p=2547 pic.twitter.com/mg7pqkzTSc,2017-04-08 23:49:22,0,0,0.0,0.823,0.177,0.4215
"We regret you were unable to make your flight, Marc. Although we appreciate your loyalty, we do not ... https://ual.response.lithium.com/portal/conversation/17785316 …",2017-04-08 23:49:13,0,0,0.108,0.654,0.238,0.5267
"Michael, this is concerning. The MileagePlus Club card does get you into United Clubs. It doesn't get ... https://ual.response.lithium.com/portal/conversation/17785329 …",2017-04-08 23:44:43,0,0,0.0,0.865,0.135,0.4215
Pricing will fluctuate. Were you able to get this resolved? ^RD,2017-04-08 23:37:06,0,0,0.0,0.842,0.158,0.2204
"We are delighted to hear that, Juliette. We will go right ahead and let her team know. ^RD",2017-04-08 23:32:29,0,1,0.0,0.837,0.163,0.5106
Great Kelly the first FA was professional. She made the flight very pleasant. She clearly loves her job. Flight 5678 den-tus,2017-04-08 23:30:26,0,0,0.0,0.542,0.458,0.9366
Best headline all day... United Airlines Is Facing an Extreme Wine Shortage Because We Drank It All http://ow.ly/x9wh30aHduI,2017-04-08 23:30:06,0,0,0.083,0.625,0.292,0.7184
"Thanks for taking the time to tweet us your concerns, Sacha. Keep us posted. ^RD",2017-04-08 23:30:02,0,0,0.0,0.828,0.172,0.4404
How was the rest of your flight? ^AD,2017-04-08 23:29:17,0,0,0.0,1.0,0.0,0.0
I flew to Tucson.,2017-04-08 23:28:16,0,0,0.0,1.0,0.0,0.0
http://garage.vintage.store  UNITED AIR LINES アイロンワッペン入荷しました！ # garagevintagestore # ガレージヴィンテージストア # 雑貨 # ワッペン # アイロンワッペン # UnitedAirlines pic.twitter.com/WfOo5tkhLz,2017-04-08 23:26:00,0,0,0.0,0.757,0.243,0.5473
"Captain Mike is a rock star. Enjoy the flight, Ryan. Please keep us posted. ^RD",2017-04-08 23:23:01,0,1,0.0,0.686,0.314,0.6705
We apologize if you were treated rudely by any of our employees. That is not the flyer friendly service ... https://ual.response.lithium.com/portal/conversation/17785416 …https://twitter.com/messages/compose?recipient_id=260907612 …,2017-04-08 23:19:12,0,0,0.231,0.713,0.055,-0.6628
They do need to be used by expiration date. You do have a 30 day grace period. Please see this page o... https://ual.response.lithium.com/portal/conversation/17785430 …,2017-04-08 23:17:35,0,0,0.0,0.797,0.203,0.6249
"Then to top it off, @ UnitedAirlines loses my bag... oh, no worries, it'll be delivered 18 hours after I've landed. Never again.",2017-04-08 23:16:21,0,0,0.269,0.664,0.066,-0.6705
Please DM your reservation number. We can take a look and see what happened. ^DP https://twitter.com/messages/compose?recipient_id=260907612 …,2017-04-08 23:15:22,0,1,0.0,0.783,0.217,0.3818
I just tried logging on and there are no issues. Maybe try a different server. ^DP,2017-04-08 23:13:51,0,0,0.145,0.855,0.0,-0.296
@ united @ Chase FYI apparently the MileageClub card doesn't give you @ staralliance lounge access in Rome # travelwoes # longdayoftravel,2017-04-08 23:12:48,0,0,0.0,0.738,0.262,0.6523
"We acknowledge your frustration, and apologize for any trouble. Please keep us posted. ^RD",2017-04-08 23:08:45,0,0,0.297,0.513,0.19,-0.4767
Please DM your reservation number so we can take a look at what happened and then we can guide you in th... https://ual.response.lithium.com/portal/conversation/17778014 …https://twitter.com/messages/compose?recipient_id=260907612 …,2017-04-08 23:07:53,0,0,0.0,0.847,0.153,0.3818
Yes I did thanks but still had a horrible day yesterday,2017-04-08 23:07:52,0,0,0.326,0.412,0.261,-0.4497
We do want your voice heard and we advise you to reach out to Customer Care for a formal complaint ... https://ual.response.lithium.com/portal/conversation/17777964 …,2017-04-08 23:06:47,0,0,0.089,0.685,0.226,0.34
@ united is your site down? Not able to book flights... just continues to load. Thanks! (I'm out of the country right now),2017-04-08 23:01:45,0,0,0.0,0.769,0.231,0.7177
"We do try to keep you in your paid seat assignments; however, they are not guaranteed. If you did... https://ual.response.lithium.com/portal/conversation/17777140 … https://twitter.com/messages/compose?recipient_id=260907612 …",2017-04-08 23:01:45,0,0,0.0,1.0,0.0,0.0
Please RT? # travel # traveller How illy Premium Coffee Augments a United Airlines Vacation http://tinyurl.com/zb3r2om pic.twitter.com/VxKDtZqxGv,2017-04-08 23:01:31,0,0,0.0,0.683,0.317,0.6249
"When @ united mess you about and decide to cancel your ticket without telling you and now run about trying to sort it, thinking upgrade",2017-04-08 23:00:13,0,0,0.159,0.742,0.099,-0.1779
Thank you for protecting us from nervous high school kids asking questions about the delay. Good move kicking them off the plane # safety?,2017-04-08 22:59:45,0,0,0.144,0.588,0.268,0.5859
Congratulations to North Shore City on their U13 3-peat after winning the United Airlines U13 Ripken National... http://fb.me/27P5GggkE,2017-04-08 22:58:54,1,1,0.0,0.598,0.402,0.8779
"Understood. If you have any later on, do not hesitate to let us know. ^DP",2017-04-08 22:58:52,0,0,0.0,0.885,0.115,0.2057
pic.twitter.com/l4HgRJ2USx,2017-04-08 22:57:45,0,0,0.0,1.0,0.0,0.0
No thanks. I'm on the last leg now and on board. Fly easyJet out again later this afternoon. Hope I'm more lucky there :-),2017-04-08 22:56:42,0,0,0.067,0.582,0.351,0.8503
We regret any trouble. Thanks for taking the time to tweet us. ^RD,2017-04-08 22:56:39,0,0,0.299,0.543,0.158,-0.3818
Just one??? Not even going to fly'em back smh,2017-04-08 22:55:14,0,0,0.262,0.738,0.0,-0.4291
"['United Airlines 777 airplane toy plane, RT6266'] https://www.amazon.com/United-Airlines-airplane-plane-RT6266/dp/B00176N1UW?SubscriptionId=AKIAIUXRJQI57DUVIN6A&tag=victoriaebren-20&linkCode=xm2&camp=2025&creative=165953&creativeASIN=B00176N1UW … # offer # off2017-04-09 05:55",2017-04-08 22:55:08,0,0,0.0,1.0,0.0,0.0
"Oh no, that is not good. Do you currently need assistance with a reservation? Please DM. ^DP",2017-04-08 22:55:01,0,0,0.231,0.653,0.116,-0.3195
Just to follow up - there have been issues with the tickets at every flight on the way. Friendly personnel but not really impressed.,2017-04-08 22:52:52,0,0,0.137,0.785,0.078,-0.3728
