text,date,retweets,favorites,negative,neutral,positive,compound
Emotional Support Peacock Denied Boarding By United Airlines http://ihe.art/ula1N1M,2018-01-30 12:43:03,0,0,0.193,0.333,0.473,0.4939
http://l6905.offerteonline2017.com/affiliateproject/tracker/click/5iB …,2018-01-30 12:43:01,0,0,0.0,1.0,0.0,0.0
"Hey Nicholas, we feel your frustration with the inconvenience. The airport security lines are operated by TSA. ^AD",2018-01-30 12:43:00,0,0,0.243,0.652,0.104,-0.4939
"@ united I am VERY disappointed in your policies. My dentist called to cancel my appointment in another state because he wife is having her baby on the day of my original appt. I called @ Delta to reschedule and they accommodate me no problem and waived the reschedule fee, UNITED",2018-01-30 12:42:51,0,0,0.185,0.67,0.145,-0.3384
Sometimes even United Airlines gets one right. https://twitter.com/SortaBad/status/958439050326589440 …,2018-01-30 12:42:21,0,0,0.0,0.714,0.286,0.4215
United Airlines Just Did Customers a Huge Favor For Which Everyone Should Be Grateful http://mariopgrant.com/2018/01/30/united-airlines-just-did-customers-a-huge-favor-for-which-everyone-should-be-grateful/ …pic.twitter.com/bPMQxLS4pR,2018-01-30 12:42:15,0,0,0.0,0.481,0.519,0.8689
Emotional Support Peacock Denied Boarding By United Airlines http://ihe.art/JbSOlYS https://fb.me/9kEicffGw,2018-01-30 12:42:08,0,0,0.193,0.333,0.473,0.4939
@ United how does this work?,2018-01-30 12:41:47,0,0,0.0,0.588,0.412,0.4215
"@ united Good afternoon, I would like to know if you are processing the transit passenger permit for a flight from Bogota to Bombay with three stopovers and change of airline with Qatar Airways",2018-01-30 12:41:41,0,0,0.0,0.773,0.227,0.802
United Airlines Just Did Customers a Huge Favor For Which Everyone Should Be Grateful by http://Inc.com  http://serebral360.com/blog/united-airlines-just-did-customers-a-huge-favor-for-which-everyone-should-be-grateful-by-inc-com/ …pic.twitter.com/m5cFFBz3Cn,2018-01-30 12:41:29,0,0,0.0,0.526,0.474,0.8689
Emotional Support Peacock Denied Boarding By United Airlines http://ihe.art/yq4Voj9,2018-01-30 12:40:48,0,0,0.193,0.333,0.473,0.4939
Can you please provide the confirmation number in DM? We can take a look. ^KFhttps://twitter.com/messages/compose?recipient_id=260907612 …,2018-01-30 12:40:35,0,0,0.0,0.752,0.248,0.4515
@ united when you gonna grow up and treat customers with respect ? https://twitter.com/nicholasg88/status/958438482522918912 …,2018-01-30 12:40:13,0,0,0.0,0.511,0.489,0.8225
"Well, at least @ united wanted to send flowers after denying this woman a chance to see her dying mother. And, of course, that no one flew for free... https://www.nytimes.com/2018/01/26/business/united-airlines-traveler-help-desk.html …",2018-01-30 12:40:13,0,0,0.133,0.667,0.2,0.3182
"Birds of a feather may flock together, but # UnitedAirlines recently shot down one traveler’s request to bring her emotional support peacock on a flight http://bit.ly/2FuJTDU",2018-01-30 12:40:00,16,24,0.0,0.794,0.206,0.6652
Noooooo en eso si no estoy de acuerdo,2018-01-30 12:39:35,0,0,0.239,0.761,0.0,-0.296
And so it goes. # travel # airlines @ united # WTF http://www.foxnews.com/travel/2018/01/30/woman-denied-emotional-support-peacock-on-united-flight.html …,2018-01-30 12:39:19,1,3,0.316,0.488,0.195,-0.4084
"Please be sympathetic to those of us who need emotional support animals. I recently was denied by American Airlines to bring ""Tookie"" my pet wolverine on-board a flight!!",2018-01-30 12:38:20,0,0,0.084,0.611,0.305,0.7639
Emotional Support Peacock Denied Boarding By United Airlines http://ihe.art/kYgLQww,2018-01-30 12:38:12,0,1,0.193,0.333,0.473,0.4939
"If you put # regtech, # fintech, # Insurtech and # AI in one product, you have # aXpire. This is the best solution if you want to maximize your operational effectiveness. @ aXpire_official have worked with: @ ATT @ intel @ Sysco @ IBM @ united @ NFL and more !!! Deal of the day !!!pic.twitter.com/sKG6bNAZud",2018-01-30 12:37:52,5,12,0.0,0.777,0.223,0.8949
Emotional Support Peacock Denied Boarding By United Airlines http://ihe.art/FhYJvCM,2018-01-30 12:36:59,0,0,0.193,0.333,0.473,0.4939
"Just when you thought you've seen it all, here comes the emotional support peacock! What?",2018-01-30 12:36:43,0,1,0.0,0.739,0.261,0.5562
Emotional Support Peacock Denied Boarding By United Airlines http://ihe.art/j2eAzPk,2018-01-30 12:36:35,0,0,0.193,0.333,0.473,0.4939
United Airlines Forced Emotional Support Peacock to Give Up Its Seat http://peoplem.ag/Ip0ngui,2018-01-30 12:36:35,87,245,0.166,0.442,0.392,0.4767
"Seriously, who actually thinks they can get away with this sort of thing!!!",2018-01-30 12:35:56,0,1,0.177,0.823,0.0,-0.3769
I tried to take my emotional support Chinese man on an @ united airlines flights but they dragged Hims off!!,2018-01-30 12:35:54,1,1,0.062,0.669,0.269,0.5162
# Notiturismo La guerra de tarifas hace caer a las líneas aéreas en bolsa @ united @ AmericanAir @ Deltapic.twitter.com/oPQTRqW0mt,2018-01-30 12:35:36,1,1,0.0,0.833,0.167,0.4215
this is why i try to avoid @ united....TSA line non-existent at Newark # shittyflyingpic.twitter.com/8UzX0FmJy7,2018-01-30 12:35:15,0,0,0.167,0.833,0.0,-0.296
Emotional Support Peacock Denied Boarding By United Airlines http://ihe.art/SquTe60,2018-01-30 12:34:54,2,0,0.193,0.333,0.473,0.4939
In-Flight # Wi-Fi Is About to Get a Lot Faster - Bloomberg @ AmericanAir is #2 and #1 is @ United https://apple.news/AhlLuqDRtRq6xdsW4W6zfIg …,2018-01-30 12:34:39,0,1,0.0,0.851,0.149,0.4215
"Wow @ united, how unpheasant. pic.twitter.com/TglRTdb1L5",2018-01-30 12:34:35,0,2,0.0,0.313,0.688,0.765
Yeah they’re telling me that doesn’t apply since the flight is exactly 24 hours apart,2018-01-30 12:34:28,0,0,0.0,0.864,0.136,0.296
@ united cowards https://twitter.com/FoxNews/status/958369092817350656 …,2018-01-30 12:34:13,0,0,0.0,0.417,0.583,0.4215
"The gate agent for United Airlines removed the woman from the flight she had already boarded. That's when they told her that her ticket had been cancelled. Despite her desperate pleas, she missed telling her dying mother goodbye. https://www.liftable.com/carolynfultz/woman-removed-united-flight-ticket-cancelled-misses-telling-dying-mom-goodbye/?utm_source=twitter&utm_medium=liftable&utm_campaign=dlvrit&utm_content=2018-01-30 …",2018-01-30 12:33:38,0,0,0.147,0.79,0.063,-0.4019
Emotional Support Peacock Denied Boarding By United Airlines http://ihe.art/EUO7h30,2018-01-30 12:33:13,0,0,0.193,0.333,0.473,0.4939
USC Trojans' home is now officially the United Airlines Memorial Coliseum: http://ift.tt/2E1zMJs,2018-01-30 12:33:09,0,0,0.0,0.797,0.203,0.4215
Emotional Support Peacock Denied Boarding By United Airlines http://ihe.art/4vkIfvg,2018-01-30 12:32:47,1,0,0.193,0.333,0.473,0.4939
$270 million @ lacoliseum renovation is officially underway # FightOn @ USC @ united https://www.prnewswire.com/news-releases/a-win-for-los-angeles-united-airlines-comes-to-the-coliseum-300589236.html …pic.twitter.com/b219LWJfpZ,2018-01-30 12:30:33,1,3,0.0,0.781,0.219,0.4215
...and may a peacock nest in your hair.,2018-01-30 12:30:30,0,0,0.0,1.0,0.0,0.0
"Emotional support peacock denied a seat on a United flight. A woman tried to bring a peacock onboard a flight out of Newark Liberty International Airport after paying for a second seat, but United Airlines turned the bird away pic.twitter.com/7i9Km7Iqpk",2018-01-30 12:30:25,0,0,0.048,0.685,0.268,0.7906
Wow! Unreal...!!,2018-01-30 12:29:34,0,1,0.0,0.176,0.824,0.6884
This is the over-the-top emotional support peacock denied by @ United as I just mentioned on @ KGO810http://www.businessinsider.com/united-denies-womans-attempt-to-bring-peacock-onto-flight-2018-1?r=UK&IR=T …,2018-01-30 12:28:55,1,4,0.138,0.524,0.338,0.4939
Emotional Support Peacock Denied Boarding By United Airlines http://ift.tt/2rRJwRU,2018-01-30 12:28:34,0,0,0.193,0.333,0.473,0.4939
Emotional Support Peacock Denied Boarding By United Airlines http://ihe.art/lOy3Hx5,2018-01-30 12:28:08,9,2,0.193,0.333,0.473,0.4939
"Hey Robin, we feel your frustration with the lack of in-seat power. What is your flight number? ^AD",2018-01-30 12:27:20,0,1,0.249,0.691,0.06,-0.6249
# UnitedAirlines Forced Emotional Support Peacock to Give Up Its Seat. Oh hell no! No way I’d want that on the plane w/me...emotional support or not. http://people.com/pets/united-airlines-kicks-off-emotional-support-peacock/ …,2018-01-30 12:27:17,1,3,0.319,0.466,0.215,-0.7177
Could of been...The LA United Airlines Coliseum of Anaheim? Lol,2018-01-30 12:27:12,0,0,0.0,0.588,0.412,0.6808
Peacocks can be nasty at zoos. I would not want to fly or sit near one. United Airlines Forced Emotional Support Peacock to Give Up Its Seat http://people.com/pets/united-airlines-kicks-off-emotional-support-peacock/ … via @ people,2018-01-30 12:27:10,0,1,0.206,0.607,0.187,-0.1833
United Airlines ranked #1 among global carriers in Newsweek’s 2017 Global 500 Green Rankings. Check out 10 of their most-significant environmental achievements: http://bit.ly/2Bw4IfI pic.twitter.com/HY0p6KaIQG,2018-01-30 12:27:08,0,0,0.0,0.887,0.113,0.4215
"To the woman who tried to bring an emotional support peacock on to a @ united flight, I salute you.",2018-01-30 12:26:47,0,0,0.0,0.664,0.336,0.7269
Love this! Thanks for sharing. ^AD,2018-01-30 12:26:35,0,0,0.0,0.227,0.773,0.8805
"Wow, another person trying to avoid fees for their pet to travel by calling it an emotional support animal. Kudos to @ united for stopping such crap. Woman denied emotional support peacock on United flight. http://fxn.ws/2DPMWKA",2018-01-30 12:26:08,0,2,0.174,0.429,0.397,0.9001
How dare you deny my emotional support Komodo Dragon @ united ! https://twitter.com/foxnews/status/958369092817350656 …,2018-01-30 12:25:59,0,0,0.143,0.417,0.44,0.6114
"Hey Andy, can you please DM more details about what's going on with your status match? Thank you. ^ADhttps://twitter.com/messages/compose?recipient_id=260907612 …",2018-01-30 12:25:48,0,0,0.0,0.767,0.233,0.6322
# FightOn . @ USC_Athletics and thank you . @ HTSNetwork1 # LosAngeles Memorial Coliseum to get new name after deal with . @ United https://www.wsj.com/articles/los-angeles-memorial-coliseum-to-get-new-name-after-deal-with-united-airlines-1517248800 … via . @ WSJ,2018-01-30 12:25:27,0,0,0.0,0.773,0.227,0.6486
"Thanks, @ United. That was the right things to do. # NotMyPeacock",2018-01-30 12:25:19,0,0,0.0,0.584,0.416,0.6908
@ JamieAsnow’s superhero action figure by @ United. # TeamUnited # ArcticAngelpic.twitter.com/5DQtU9avIn,2018-01-30 12:25:17,0,1,0.0,0.714,0.286,0.4215
This is an outrage - shame on you @ united I will be boycotting all things United not limited to but including - @ united @ ManUtd @ UN @ ATLUTD Peacock are people too & deserve to be treated as suchhttps://twitter.com/foxnews/status/958369092817350656 …,2018-01-30 12:24:46,0,0,0.148,0.636,0.216,0.4182
Excited about this. But they also need to set their sights on the US airline industry and their horrible customer experience. Looking at you @ AmericanAir @ united @ Delta # CustomerExperience # Airlines # Amazon @ JeffBezos # AvGeekhttps://twitter.com/nytimesbusiness/status/958414625980039168 …,2018-01-30 12:24:22,0,0,0.091,0.729,0.18,0.34
United Airlines’ Limited Global Services Challenge - How To Get It! http://crwd.fr/2n0o8nH,2018-01-30 12:24:16,0,0,0.133,0.56,0.307,0.3595
">>United Airlines Kicked Off Women Traveling To See Dying Mother (Chicago, IL) -- United Airlines is navigating some turbulent customer relations once again. The airline kicked off a woman who was traveling to see her dying mother because a travel agency voided her ticket.",2018-01-30 12:24:12,0,0,0.0,0.936,0.064,0.4215
"An emotional support peacock? ""United Airlines recently shot down one traveler’s request to bring her emotional support peacock on a flight departing Newark Liberty International Airport"" http://bit.ly/2DNIOe2",2018-01-30 12:23:58,0,0,0.0,0.575,0.425,0.9153
United Airlines wouldn't allow a traveler to bring her emotional support peacock on a flight departing Newark. https://fb.me/8GA2WZNyi,2018-01-30 12:23:44,0,0,0.08,0.578,0.342,0.6634
LA Coliseum to be renamed United Airlines Memorial Coliseum # WeAreUnited # USC # powercouplepic.twitter.com/TeIbyPajL2,2018-01-30 12:22:35,0,4,0.0,0.797,0.203,0.4215
Should United Airlines have denied a passengers emotional sport pet? Did we mention it was peacock?? What do you think!,2018-01-30 12:22:04,0,0,0.12,0.663,0.217,0.3252
“Emotional support peacock denied seat on United airlines flight.” You can’t make this shit up.,2018-01-30 12:21:36,0,2,0.302,0.465,0.233,-0.3919
@ united for not putting up with this nonsense.,2018-01-30 12:20:58,0,1,0.262,0.503,0.235,-0.0836
So true!!,2018-01-30 12:20:21,0,1,0.0,0.214,0.786,0.5686
Liberia? I didn't know you were a freedom fighter!!,2018-01-30 12:19:39,0,0,0.0,0.439,0.561,0.7494
"@ Expedia, another airline telling you that the charges that have been sitting on my credit card for two months are on you, not them",2018-01-30 12:19:38,0,0,0.079,0.824,0.097,0.128
"Nothing to get your feathers ruffles about... I bet this was a dare, and @ united called her bluff https://twitter.com/fox5dc/status/958408567345819653 …",2018-01-30 12:18:48,0,0,0.0,0.851,0.149,0.4215
I see I hit ur nerve. Certainly I described ur typical behavior. Ur despise towards # PresudentTrump shows well discernment is not ur forté,2018-01-30 12:18:47,0,0,0.1,0.711,0.188,0.2732
"How could United Airlines not allow...wait, what? A service peacock? https://twitter.com/VICE/status/958421490441031681 …",2018-01-30 12:18:29,0,0,0.0,0.74,0.26,0.4871
"I know you try your best. I also know that a lot of things are out of your control. What is frustrating is poor communication by gate agents, flight deck, etc. on THAT, you can certainly work on.",2018-01-30 12:18:19,0,0,0.138,0.711,0.151,0.1531
"Exactly, everyone wins! United gets revenue/happy customers. Alums are happy, and USC gets passionate alums to # FightOn. # TrojanFamily",2018-01-30 12:18:16,0,1,0.0,0.502,0.498,0.9312
@ AerLingus not a great partnership with @ united smallest seats I've ever experienced. Let's hope for better on connecting flight to Dublin! pic.twitter.com/TCY6vwBU5I,2018-01-30 12:17:42,1,3,0.113,0.582,0.305,0.6806
"Yes, but it's probably not a good # marketing or # branding technique to start your tweet with "" @ Delta"" maybe..? @ thepointsguy @ scottsflights @ OneMileataTime",2018-01-30 12:16:42,0,1,0.135,0.784,0.081,-0.3091
Sounds like flying on Air Force One,2018-01-30 12:16:22,0,0,0.0,0.706,0.294,0.3612
"This makes us so happy, Laura. Please DM us more details so we can share the kudos. ^ADhttps://twitter.com/messages/compose?recipient_id=260907612 …",2018-01-30 12:16:06,0,0,0.0,0.517,0.483,0.9196
Don’t be so quick to outlaw pigs on planes...you won’t get a seat!,2018-01-30 12:15:47,0,3,0.0,1.0,0.0,0.0
"United Airlines, en alianza con Best Day Travel Group y BD TRAVELSOLUTION, lanzó United Vacations # UnitedVacations @ united @ BestDay_Travel @ EdelmanMx @ VisitLasVegasUS http://topmanagement.com.mx/united-airlines-alianza-best-day-travel-group-bd-travelsolution-lanzo-united-vacations/ …pic.twitter.com/KcKaL3zkEm",2018-01-30 12:15:46,1,0,0.0,0.559,0.441,0.9118
USC stadium to be renamed United Airlines Memorial Coliseum http://es.pn/2BFvYZ5,2018-01-30 12:15:28,0,1,0.0,0.763,0.237,0.4215
"Hey Patriek, can you please DM us details about this including their confirmation number and your MileagePlus number? ^AD https://twitter.com/messages/compose?recipient_id=260907612 …",2018-01-30 12:15:03,0,0,0.0,0.764,0.236,0.504
A woman was denied emotional support peacock on a United Airlines flight. Even though she had a second ticket for the bird. DETAILS: http://www.fox5dc.com/news/woman-denied-emotional-support-peacock-on-united-flight …pic.twitter.com/v1FXFJ4XUu,2018-01-30 12:15:00,17,13,0.107,0.63,0.263,0.4939
"@ united finally answers the age old question ""Can peacocks fly?"" http://www.foxnews.com/travel/2018/01/30/woman-denied-emotional-support-peacock-on-united-flight.html …",2018-01-30 12:14:48,0,0,0.0,0.781,0.219,0.4215
@ united HAVE YOU LEARNED NOTHING https://twitter.com/foxnews/status/958369092817350656 …,2018-01-30 12:14:46,0,0,0.0,0.641,0.359,0.4215
United Airlines Denies Boarding to Emotional Service Animal...a Peacock - Live and Let's Fly http://liveandletsfly.boardingarea.com/2018/01/29/united-airlines-peacock/ …,2018-01-30 12:14:45,0,0,0.154,0.604,0.242,0.1531
"What are the most popular # travel apps? According to @ Okta's latest Businesses@Work report, @ SouthwestAir and @ United lead the pack! https://usat.ly/2DZWule  via @ usatoday @ nancytrejos",2018-01-30 12:14:29,1,2,0.0,0.772,0.228,0.7339
@ united i understood 2 weeks ago when there was an ice storm in houston and we had a 5 hr delay. But this is just stupid. Logistics team needs to get it together. pic.twitter.com/Qk7MbbqQHg,2018-01-30 12:14:27,0,0,0.161,0.761,0.079,-0.4404
"I'm sorry, but was @ united the only people in Los Angeles who lost friends & relatives in combat? pic.twitter.com/w92Ktvpnsv",2018-01-30 12:14:09,0,2,0.257,0.463,0.28,0.3919
Newark must be the place bags go to die! I have heard so many people say they lost theirs a Newark and mine got lost at Newark too! I have no clue what they do with them but it seems that once they get to Newark they disappear. I'm hoping you get yours back soon,2018-01-30 12:14:02,0,0,0.171,0.767,0.062,-0.555
Thanks to Great crew on UA408 @ united,2018-01-30 12:13:45,0,0,0.0,0.29,0.71,0.8689
"So does this mean I can’t bring my emotional support cobra onto my next flight, @ united? https://twitter.com/i/moments/958398145737740288 …",2018-01-30 12:13:02,0,0,0.0,0.647,0.353,0.7269
"God damn it, united fucking airlines back at it again with their inhumane behaviour towards paying costumers",2018-01-30 12:12:51,0,1,0.125,0.648,0.227,0.296
"I gave up on flying @ united years ago, I've had to try them again twice in the past year and both times were epic failures.",2018-01-30 12:12:17,0,1,0.108,0.791,0.101,-0.0516
"THANK YOU @ united, this emotional support animals is getting RIDIDICULOUS.",2018-01-30 12:12:09,0,0,0.0,0.364,0.636,0.8585
"I am @ united_1k, with 12 upgrade vouchers that expire Jan31. Was donating 2 of them to 2 senior citizens for V-day travel, on their 35th anniversary. # UnitedAirlines denied this! One has an auto-immune illness, won't be around much # heartless @ united Suggestions, anyone? # travel",2018-01-30 12:11:51,1,0,0.19,0.752,0.058,-0.7424
United Airlines wouldn't allow a traveler to bring her emotional support peacock on a flight departing Newark. http://ihe.art/f8c9Djo,2018-01-30 12:10:30,0,0,0.08,0.578,0.342,0.6634
@ united would rather render the majority of their plane useless than look out for the comfort of the passengers they do have.,2018-01-30 12:10:22,0,0,0.103,0.701,0.196,0.3612
@ united # SHAME on you..... Woman denied emotional support peacock on United flight http://fxn.ws/2DPMWKA pic.twitter.com/gUYyGJGIXz,2018-01-30 12:10:06,0,0,0.285,0.296,0.419,0.2885
November Oscar,2018-01-30 12:09:43,0,0,0.0,1.0,0.0,0.0
USC now plays at the “United Airlines Memorial Coliseum”. Gross.,2018-01-30 12:09:40,0,0,0.237,0.611,0.153,-0.2732
fuck united airlines pic.twitter.com/sI0zLQSl0a,2018-01-30 12:09:24,1,13,0.422,0.241,0.337,-0.1779
What is the stupid logic in keeping seats empty and cramping the few people on this plane because of ludicrous policy @ united??? This is the kind thing that will lose me as a customer.,2018-01-30 12:09:23,0,0,0.248,0.612,0.14,-0.5775
That’s the crazy thing. It supposedly never left Newark. When I returned there a couple days later to collect it they could not produce the bag and said they would bring it to my house. Now they have no idea where it is.,2018-01-30 12:09:13,0,0,0.106,0.894,0.0,-0.5574
pic.twitter.com/ndBfgPzFWJ,2018-01-30 12:08:52,0,0,0.0,1.0,0.0,0.0
No Emotional Support Peacocks on @ United. SAD. https://thepointsguy.com/2018/01/emotional-support-peacock-denied-boarding/ …,2018-01-30 12:07:57,3,24,0.374,0.186,0.44,0.0173
He paid for his seat just like everyone else @ united pic.twitter.com/sKxiCAoUCX,2018-01-30 12:07:24,4,18,0.0,0.629,0.371,0.6486
# People United Airlines Forced Emotional Support Peacock to Give Up Its Seat https://goo.gl/eLzA9j,2018-01-30 12:07:23,0,0,0.157,0.471,0.372,0.4767
United Airlines Canceled Ticket Of Woman On Technicalities While Her Mother Was Dying https://buff.ly/2Em8dIF,2018-01-30 12:07:01,0,0,0.0,0.823,0.177,0.4215
There was a good @ NewYorker article about ESA‘s about 2 years ago. People abuse the system.,2018-01-30 12:06:50,0,0,0.22,0.628,0.152,-0.3182
So a bird can be denied to fly south for the winter @ United? :( https://twitter.com/foxnews/status/958369092817350656 …,2018-01-30 12:06:30,0,1,0.296,0.561,0.143,-0.4588
"Hey @ United my emotional support animal is an octopus. Well trained, superb behaviour, & I need his eight arms to feel OK. He is not, for Cthulhu's sake, a hedgehog, a ferret, an insect, a rodent, and has not horns, hooves or tusks! # peacock # united https://youtu.be/P3fBkLOGWWM https://twitter.com/VICE/status/958421490441031681 …",2018-01-30 12:06:23,0,0,0.0,0.638,0.362,0.954
"# lacklustercustomerservice @ united Come-on, 5 years for matching status? not 4 years 11 months? Clearly it isn't about getting a new frequent flier? Know and retain your # idealcustomers. Expecting too much??",2018-01-30 12:06:12,0,0,0.0,0.795,0.205,0.755
i have seen these ads all over manhattan. love them!,2018-01-30 12:05:55,0,1,0.0,0.64,0.36,0.6696
struggling not to reference united airlines here..,2018-01-30 12:05:49,0,0,0.507,0.493,0.0,-0.6288
Guessing @ united puts a big broadcast spend behind the entitlement to make sure announcers mention the right name often.,2018-01-30 12:05:46,0,0,0.0,0.758,0.242,0.6249
Bc everyone loves when this shit happens on a commercial flight.pic.twitter.com/5AqByiTP22,2018-01-30 12:05:36,0,0,0.235,0.523,0.242,0.0258
@ united This is my second 4hour+ flight without inflight charging! How am I supposed to use your inflight entertainment without access to charging?! # struggles # falseadvertising,2018-01-30 12:05:26,0,0,0.084,0.707,0.208,0.5696
The Wall Street Journal: New name for Los Angeles Memorial Coliseum with United Airlines deal that is largest in college sports https://www.asberryfinancial.com/financialnews/20-marketwatch/33368-the-wall-street-journal-new-name-for-los-angeles-memorial-coliseum-with-united-airlines-deal-that-is-largest-in-college-sports …,2018-01-30 12:04:59,0,0,0.0,0.882,0.118,0.4215
"On a @ united flight. The flight is empty. Economy plus is empty, but those with just Economy aren’t allowed to use those seats because others paid more to sit there. No one is sitting there. So no one paid your stupid fees.",2018-01-30 12:04:32,0,1,0.267,0.695,0.038,-0.8895
I can't imagine how a peacock would provide emotional support. Gotta be a joke. “Emotional support peacock denied a seat on a @ united flight” https://twitter.com/i/moments/958398145737740288 …,2018-01-30 12:03:55,0,1,0.1,0.484,0.415,0.7964
pic.twitter.com/nUadZ52ulP,2018-01-30 12:03:20,0,0,0.0,1.0,0.0,0.0
I’ve never been prouder to be a @ united MileagePlus member https://twitter.com/karinbrulliard/status/958381594447884291 …,2018-01-30 12:02:32,0,0,0.196,0.596,0.209,0.0444
Why do people have to be such A-HOLES?!? A PEACOCK?! Thankfully @ united has a brain and shut it DOWN! http://bit.ly/2DY2JWK,2018-01-30 12:02:24,1,2,0.0,0.695,0.305,0.7915
Peacock..... new word for safe room,2018-01-30 12:02:18,0,0,0.0,0.633,0.367,0.4404
"# SupportAnimals come in all forms, just ask the passengers that aren't disabled & take animals like cats & parrots on planes @ united https://twitter.com/CSULB_DSS/status/958423769122422785 …",2018-01-30 12:01:40,0,0,0.0,0.782,0.218,0.6486
United Airlines Forced Emotional Support Peacock to Give Up Its Seat (Video) http://www.travelandleisure.com/travel-news/united-airlines-denies-boarding-emotional-support-peacock#6569983b-0752-45b7-8adc-91f06461a0d9 … via @ TravelLeisure,2018-01-30 12:01:36,1,0,0.142,0.521,0.336,0.4767
Renovation began on the United Airlines Memorial Coliseum after a revision of the original name. http://ow.ly/B7Bd50gj6Zw pic.twitter.com/veNh0T1gj9,2018-01-30 12:00:47,1,7,0.0,0.718,0.282,0.6249
"El Memorial Coliseum de Los Ángeles cambiara de nombre gracias a un convenio comercial de 69 millones de dólares que se prolongará por 16 años; ahora se llamará ""The United Airlines Memorial Coliseum"".",2018-01-30 12:00:30,2,4,0.0,0.917,0.083,0.4215
We're glad it's back in his safe keeping. Let the games begin. ^JR,2018-01-30 12:00:22,0,0,0.0,0.651,0.349,0.7096
"Thank you, @ United This ‘support animal’ abuse on flights has got to stop. People are turning plane interiors into barnyards. If you need your peacock, drive! Woman denied emotional support peacock on United flight http://fxn.ws/2DPMWKA # FoxNews",2018-01-30 12:00:03,0,1,0.186,0.56,0.254,0.3382
"My dear friend Karla, a @ united flight attendant, is part of the SuperHero Team in @ united 's current # TeamUSA campaign, so proud of her, she's just as beautiful on the inside as out! @ weareunited # TeamUnitedpic.twitter.com/17ZUbED7VH",2018-01-30 11:59:50,1,2,0.0,0.588,0.412,0.9617
That’s “United Airlines Mausoleum”!,2018-01-30 11:59:46,0,1,0.0,1.0,0.0,0.0
just you wait. this time next month @ united will be charging an extra 50 bucks to *not* sit next to someone's emotional support peacock.,2018-01-30 11:59:31,1,3,0.0,0.747,0.253,0.7269
Support Peacock?? United Airlines Forced Emotional Support Peacock to Give Up Its Seat http://www.travelandleisure.com/travel-news/united-airlines-denies-boarding-emotional-support-peacock … via @ TravelLeisure,2018-01-30 11:59:12,0,0,0.124,0.455,0.421,0.7319
