text,date,retweets,favorites,negative,neutral,positive,compound
Historic LA venue renamed United Airlines Memorial Coliseum http://zpr.io/nYJFQ,2018-01-29 23:17:15,0,1,0.0,0.741,0.259,0.4215
Coliseum sells naming rights to United Airlines http://es.pn/2DLViT7  via @ ESPN App http://es.pn/app  Wait have people already forgotten about the pr nightmare they had last year?,2018-01-29 23:12:54,0,0,0.069,0.83,0.101,0.2263
USC Trojans’ home is now officially the United Airlines Memorial Coliseum – Los Angeles Times http://sportazine.com/usc-trojans-home-is-now-officially-the-united-airlines-memorial-coliseum-los-angeles-times/ …,2018-01-29 23:10:31,0,0,0.0,0.843,0.157,0.4215
"As I’m about to fall asleep, I decided to go on Instagram. As I am scrolling past photos and videos, I stumbled upon @ USC_Athletics post about how the Los Angeles Memorial Coliseum has changed its name...ladies and gentlemen, I present United Airlines Memorial Coliseum. No.",2018-01-29 23:08:24,0,1,0.05,0.886,0.064,0.1531
United Airlines in a PR crisis once again... https://www.nytimes.com/2018/01/26/business/united-airlines-traveler-help-desk.html …,2018-01-29 23:07:00,0,0,0.318,0.465,0.217,-0.3182
I can’t wait to go to the United Airlines Memorial Coliseum and order United Airlines nachos and a United Airlines soft drink and watch the United Airlines USC Trojans. I might have to go to the United Airlines bathroom at some point.,2018-01-29 23:04:40,2,28,0.0,0.708,0.292,0.9186
L.A. Memorial Coliseum sells naming rights to United Airlines - ESPN - http://www.espn.com/college-football/story/_/id/22259284 …,2018-01-29 23:01:31,0,0,0.0,0.781,0.219,0.4215
It would have worked better if you spelled @ united correctly. @ joeyrkaufman @ trumwill @ lacoliseum @ USC @ uscfootball @ USC_Athletics,2018-01-29 23:00:19,0,0,0.0,0.711,0.289,0.6908
Así te das cuenta de la obsesión por el peso de la industria aeroespacial: United Airlines aligera el papel de su revista a bordo para ahorrar combustible - Actualidad Aeroespacial https://buff.ly/2G7dHaL,2018-01-29 23:00:14,4,2,0.0,0.909,0.091,0.4215
Hello. You can see any upgrade opportunities at http://united.com/managereservations …. ^TY,2018-01-29 22:58:57,0,0,0.0,0.776,0.224,0.3818
Coliseum sells naming rights to United Airlines - ESPN http://ift.tt/2DVRoGB,2018-01-29 22:58:16,0,0,0.0,0.741,0.259,0.4215
"United Airlines, not American.",2018-01-29 22:57:41,0,0,0.0,0.517,0.483,0.4215
"Work already underway MT @ lacoliseum: Today, @ united @ USC announced a naming rights agreement to help sustain & renovate @ lacoliseum, one of the sports world’s most beloved historical landmarks & home of @ USC_Athletics since 1923 http://prn.to/2FozBFd pic.twitter.com/zc6sG7i00a",2018-01-29 22:55:56,0,2,0.0,0.695,0.305,0.9061
"Know that LA city and county officials are good with the sponsored ""United Airlines Memorial Coliseum"" and now understand how they are all good with all the sponsored studies suggesting they stay the course with their permanent supportive housing strategy to house the homeless.",2018-01-29 22:53:55,0,1,0.0,0.787,0.213,0.8689
# WeLoveLA # USCTrojans # FightOn Renovated Home of USC Football to Be Know as United Airlines Memorial Coliseum in Naming ... http://srhlink.com/QDDMkP # SportsRoadhouse,2018-01-29 22:53:07,0,0,0.0,0.877,0.123,0.4215
They are literally the worst airline ever!,2018-01-29 22:52:23,0,1,0.423,0.577,0.0,-0.6588
"@ United Nations Security Council What would take for UNSC’s to move and do the right thing and stop Turkey’s barbaric attack on Afrin, Northern Syria. Kurds have sacrificed 1000’s of lives fighting extremism on behalf of the world. For sake of humanity Erdogan. # UNSCpic.twitter.com/PNxiDCjTTe",2018-01-29 22:51:04,0,0,0.15,0.75,0.1,-0.3818
The United Airlines Flight 93 Memorial Coliseum.,2018-01-29 22:48:08,0,1,0.0,0.682,0.318,0.4215
Kinda sad in a way. A sign of the times! USC Trojans' home is now officially the United Airlines Memorial Coliseum http://www.latimes.com/sports/la-sp-usc-coliseum-renovation-20180129-story.html …,2018-01-29 22:47:36,0,1,0.13,0.753,0.117,-0.077
The New USC dwarf throwing ring!!,2018-01-29 22:42:59,0,0,0.0,1.0,0.0,0.0
I'll ignore the United Airlines name....it will always be the Los Angeles Menorial Couliseum... Home of the USC TROJANS,2018-01-29 22:38:27,1,2,0.112,0.762,0.126,0.0772
I'm not calling it that.,2018-01-29 22:33:35,0,0,0.0,1.0,0.0,0.0
United Airlines Denies Boarding to Emotional Service Animal&#8230;a Peacock http://liveandletsfly.boardingarea.com/2018/01/29/united-airlines-peacock/ …,2018-01-29 22:31:21,0,1,0.197,0.493,0.31,0.1531
@ united thanks for refusing to rebook a return flight from a family funeral after I mistakenly chose the wrong date # boycottunited,2018-01-29 22:29:55,0,0,0.372,0.426,0.202,-0.5859
I am living in a customer service nightmare and I am not the one with the issue. I'm just observing. # UnitedAirlines customer service gets a thumbs down all day!,2018-01-29 22:28:09,0,0,0.0,1.0,0.0,0.0
"@ Delta totally does because their fancy pretzel sticks are gluten free AND their biscoff cookies have their logo in it. That being said, if you use @ united early morning, you’ll have a life changing stroopwafel",2018-01-29 22:26:42,0,1,0.0,0.84,0.16,0.7269
USC stadium to be renamed United Airlines Memorial Coliseum – ESPN http://sportazine.com/usc-stadium-to-be-renamed-united-airlines-memorial-coliseum-espn/ …,2018-01-29 22:21:35,0,0,0.0,0.797,0.203,0.4215
Boycott @ united,2018-01-29 22:19:01,0,0,0.451,0.0,0.549,0.128
I used to be a Woman of Troy... Now I’m a “Woman of Troy brought to you by United Airlines...” And we will still # FightOn # USC http://www.latimes.com/sports/la-sp-usc-coliseum-renovation-20180129-story.html?outputType=amp&__twitter_impression=true …,2018-01-29 22:18:31,0,0,0.0,0.891,0.109,0.4215
United Airlines Secures Naming Rights to L.A. Coliseum https://goo.gl/t2b6eK # USA # US # USBiz,2018-01-29 22:17:59,0,0,0.0,0.662,0.338,0.6249
"Coliseum sells naming rights to United Airlines - The Los Angeles Memorial Coliseum will be renamed the United Airlines Memorial Coliseum after the first naming rights deal in the history of the iconic venue was struck, USC said. http://ow.ly/SRkq50giLou",2018-01-29 22:15:54,0,0,0.047,0.822,0.131,0.5574
Naming after the disgraceful act of @ UnitedAirlines ?,2018-01-29 22:15:53,0,1,0.0,1.0,0.0,0.0
United Airlines Secures Naming Rights to L.A. Coliseum http://themiamimetropolis.com/blog/2018/01/30/united-airlines-secures-naming-rights-to-l-a-coliseum/ …,2018-01-29 22:15:50,0,0,0.0,0.579,0.421,0.6249
"The pope, the Olympics, the Rams and now, United Airlines. LA Memorial Coliseum gets new name # UnitedAirlines https://milesreport.com/airlines/ua/news#t15642 …",2018-01-29 22:12:03,0,0,0.0,0.859,0.141,0.4215
I have to thank the @ united agent at ICN who was a huge help in navigating security with sensitive analog film. Thank you!,2018-01-29 22:08:35,0,0,0.0,0.492,0.508,0.9259
"We're sorry to hear you say that. If you need any help with anything, please DM us and let us know. ^TY",2018-01-29 22:08:06,0,0,0.051,0.751,0.198,0.5719
United Airlines Secures Naming Rights to L.A. Coliseum http://dlvr.it/QDD8c1 pic.twitter.com/fBZrZE3n8g,2018-01-29 22:07:06,0,0,0.0,0.579,0.421,0.6249
United Airlines Memorial Coliseum just doesn’t have the same ring to it,2018-01-29 22:06:45,0,1,0.0,0.797,0.203,0.4215
United Airlines purchases naming rights for 'United Airlines Memorial Coliseum' # UnitedAirlines https://milesreport.com/airlines/ua/news#t15644 …,2018-01-29 22:06:03,0,0,0.0,0.641,0.359,0.6808
United Airlines purchases naming rights for 'United Airlines Memorial Coliseum' # UnitedAirlines https://milesreport.com/airlines/ua/news#t15643 …,2018-01-29 22:06:03,0,0,0.0,0.641,0.359,0.6808
@ united Decided it would be awesome to not ship my luggage with my flight and to top it off they give me the shittiest gift bag as a sorry. Umm no I want my bag like ASAP. If anything goes missing I'm throwing the biggest fit of life.,2018-01-29 22:04:18,0,0,0.16,0.556,0.284,0.7783
And no one wants to hear your baby crying on the red eye. Can’t fucking drive 3000 mi over the Pacific.,2018-01-29 22:02:46,0,1,0.218,0.782,0.0,-0.6486
but what about all those long time # UnitedAirlines employees that got shafted out of their pensions during mergers and whatnot? 70 million for naming rights?,2018-01-29 22:02:36,0,1,0.0,1.0,0.0,0.0
@ united is the worst airline and possibly worst company ever.,2018-01-29 22:02:35,0,0,0.456,0.389,0.156,-0.7506
Coliseum sells naming rights to United Airlines http://www.espn.com/college-football/story/_/id/22259284/los-angeles-coliseum-sells-naming-rights-united-airlines …,2018-01-29 22:01:46,0,0,0.0,0.714,0.286,0.4215
"United Airlines Secures Naming Rights to L.A. Coliseum - The Los Angeles Memorial Coliseum will become the United Airlines Memorial Coliseum in a $69 million deal struck with the airline and the coliseum’s operator, the University of Southern Californ... http://ow.ly/D3Bs50giKTX",2018-01-29 22:00:53,0,0,0.046,0.774,0.18,0.7096
You’ll love the way the Rams fly @ united pic.twitter.com/hj40Ec2YNQ,2018-01-29 22:00:44,0,0,0.0,0.5,0.5,0.7906
Los Angeles Memorial Coliseum to get new name after deal with United Airlines http://s.einnews.com/m6t5BahAhQ,2018-01-29 22:00:18,0,0,0.0,0.823,0.177,0.4215
@ united I have a connecting flight in Houston on February 8. Arrive from LAX and fly to Amsterdam. Is 37 minutes enough to make my flight? Both flights are United Airlines.,2018-01-29 21:59:27,0,0,0.0,0.828,0.172,0.6808
"USC Partners w/United Airlines, the NEW UNITED AIRLINES MEMORIAL COLISEUM # usc # unitedairlines # memorialcoliseum http://www.president.usc.edu/files/2018/01/Wall-Street-Journal-LA-Coliseum.pdf …",2018-01-29 21:59:23,0,0,0.0,0.786,0.214,0.5473
I can’t even tell if you’re being sarcastic or not...,2018-01-29 21:59:13,0,0,0.2,0.8,0.0,-0.25
Coliseum sells naming rights to United Airlines http://www.espn.com/college-football/story/_/id/22259284 …,2018-01-29 21:58:35,0,0,0.0,0.714,0.286,0.4215
"Hi, Liv. Have you heard about our same day change policy here? http://bit.ly/GJX0RL  ^TY",2018-01-29 21:57:37,0,0,0.0,1.0,0.0,0.0
United universally fucked a shit ton of long time employees out of their retirements (pennies) during mergers etc. -- terrible look @ UnitedAirlines # Shamehttps://twitter.com/FOXLA/status/958206486206758914 …,2018-01-29 21:57:03,0,0,0.348,0.564,0.088,-0.8519
nobody is going to call the LA Coliseum the 'United Airlines Memorial Coliseum'. I still call the 'StubHub... https://fb.me/58pRHV4Kz,2018-01-29 21:56:22,0,0,0.0,0.859,0.141,0.4215
United Airlines ko chakab yo year pani continue hune bho jasto xa,2018-01-29 21:55:43,0,1,0.0,0.797,0.203,0.4215
Los Angeles Memorial Coliseum to get new name after deal with United Airlines https://goo.gl/MbVTGg # Business # FOX News,2018-01-29 21:55:14,0,0,0.0,0.851,0.149,0.4215
"Exciting day for United, USC and the new United Airlines Memorial Coliseum! # beingunitedpic.twitter.com/WvE1VDLnxE",2018-01-29 21:54:12,0,13,0.0,0.524,0.476,0.8439
# WeLoveLA # USCTrojans # FightOn Los Angeles Memorial Coliseum to get new name after deal with United Airlines http://srhlink.com/QDD5qy # SportsRoadhouse,2018-01-29 21:53:07,0,0,0.0,0.859,0.141,0.4215
# WeLoveLA # USCTrojans # FightOn A Win for Los Angeles: United Airlines Comes to the Coliseum http://srhlink.com/QDD5pr # SportsRoadhouse,2018-01-29 21:53:06,0,0,0.0,0.663,0.337,0.765
United Airlines Secures Naming Rights to L.A. Coliseum http://ift.tt/2nok5lg # WSJ # WallStreet # BusinessAngel # OnlineBusiness # Finance # Markets # Money,2018-01-29 21:52:23,0,0,0.0,0.733,0.267,0.6249
The # LosAngeles Memorial Coliseum will have a new official name: the @ United Airlines Memorial Coliseum. # LA # avgeekhttp://www.latimes.com/sports/la-sp-usc-coliseum-renovation-20180129-story.html …,2018-01-29 21:51:51,1,1,0.0,0.843,0.157,0.4215
Landmark L.A. venue to be renamed United Airlines Memorial Coliseum https://www.ocregister.com/2018/01/29/landmark-l-a-venue-to-be-renamed-united-airlines-memorial-coliseum/ …,2018-01-29 21:51:24,0,1,0.0,0.687,0.313,0.4767
"i'm never going to call it that. and anyone that does, you're getting a swirly.",2018-01-29 21:51:23,0,1,0.0,1.0,0.0,0.0
"United Airlines purchases naming rights for 'United Airlines Memorial Coliseum', http://www.foxla.com/news/local-news/united-airlines-purchases-naming-rights-for-united-airlines-memorial-coliseum …",2018-01-29 21:51:15,0,0,0.0,0.616,0.384,0.6808
4 out of 5 doctors recommend @ united,2018-01-29 21:50:53,0,0,0.0,0.361,0.639,0.6486
Los Angeles Memorial Coliseum To Get New Name After Deal With United Airlines http://www.newssummedup.com/a/fwnspf,2018-01-29 21:50:36,0,0,0.0,0.823,0.177,0.4215
Outrage! USC sold the naming rights to the Coliseum. It will officially be the United Airlines Memorial Coliseum. (But you can still just call it... the Coliseum). http://www.latimes.com/sports/la-sp-usc-coliseum-renovation-20180129-story.html …,2018-01-29 21:50:25,6,33,0.111,0.803,0.086,-0.2003
United Airlines Secures Naming Rights to L.A. Coliseum http://ift.tt/2nok5lg,2018-01-29 21:50:21,0,0,0.0,0.579,0.421,0.6249
United Airlines' Plan to Beat Delta and American Could Lower Airfares for Everybody - Fortune http://dlvr.it/QDD4yw,2018-01-29 21:48:03,0,0,0.122,0.722,0.156,0.1531
RIP @ united,2018-01-29 21:46:40,0,0,0.0,0.263,0.737,0.4215
United Airlines Secures Naming Rights to L.A. Coliseum http://ift.tt/2nok5lg,2018-01-29 21:46:31,0,0,0.0,0.579,0.421,0.6249
The latest The ACG Post! https://paper.li/alftroika/1386557140?edition_id=5bc77370-055f-11e8-b29f-0cc47a0d15fd … # unitedairlines,2018-01-29 21:45:40,0,0,0.0,1.0,0.0,0.0
United Airlines Secures Naming Rights to L.A. Coliseum http://ift.tt/2nok5lg,2018-01-29 21:44:20,0,0,0.0,0.579,0.421,0.6249
United Airlines Secures Naming Rights to L.A. Coliseum http://ift.tt/2nok5lg,2018-01-29 21:44:16,0,0,0.0,0.579,0.421,0.6249
United Airlines Secures Naming Rights to L.A. Coliseum http://dlvr.it/QDD481 # Economypic.twitter.com/CbVsbgXj6e,2018-01-29 21:44:09,0,0,0.0,0.611,0.389,0.6249
United Airlines Secures Naming Rights to L.A. Coliseum http://dlvr.it/QDD46H pic.twitter.com/hqEGEowwCy,2018-01-29 21:44:08,0,0,0.0,0.579,0.421,0.6249
United Airlines Secures Naming Rights to L.A. Coliseum https://www.wsj.com/articles/los-angeles-memorial-coliseum-to-get-new-name-after-deal-with-united-airlines-1517248800?mod=pls_whats_news_us_business_f …,2018-01-29 21:44:05,0,0,0.0,0.579,0.421,0.6249
"Hey there, it looks like you purchased our Basic Economy ticket. If you'd like us to verify this for you, please DM your confirmation number. Also, please make sure you understand the restrictions of this type of ticket before your flight: http://bit.ly/2f20e8K . ^JBhttps://twitter.com/messages/compose?recipient_id=260907612 …",2018-01-29 21:43:53,0,0,0.0,0.737,0.263,0.8807
Y’all paid to promote this?,2018-01-29 21:43:34,0,1,0.0,0.606,0.394,0.3818
Coliseum sells naming rights to United Airlines http://www.espn.com/college-football/story/_/id/22259284 …,2018-01-29 21:43:27,2,3,0.0,0.714,0.286,0.4215
United Airlines Secures Naming Rights to L.A. Coliseum http://ift.tt/2nok5lg,2018-01-29 21:43:08,0,0,0.0,0.579,0.421,0.6249
"Wait...United Airlines is dead, and this is their memorial? I know they had some problems with their PR disasters over the past year, but I thought they were starting to bounce back?",2018-01-29 21:42:57,0,0,0.21,0.79,0.0,-0.7319
Third time in a row that WIFI isn’t working on @ united flight...two being international. maybe it’ll work the next two flights this week? pic.twitter.com/QdEXmXVW0d,2018-01-29 21:42:26,0,2,0.0,0.887,0.113,0.4215
United Airlines Secures Naming Rights to L.A. Coliseum http://ift.tt/2nok5lg,2018-01-29 21:42:06,0,0,0.0,0.579,0.421,0.6249
"Go home Jack, you're drunk.",2018-01-29 21:40:38,0,0,0.375,0.625,0.0,-0.34
Yankee Echo Sierra,2018-01-29 21:40:26,0,0,0.0,1.0,0.0,0.0
United Airlines Secures Naming Rights to L.A. Coliseum https://www.wsj.com/articles/los-angeles-memorial-coliseum-to-get-new-name-after-deal-with-united-airlines-1517248800?mod=pls_whats_news_us_business_f …,2018-01-29 21:40:13,0,0,0.0,0.579,0.421,0.6249
Wow that's terrible I'm so sorry Kins :(,2018-01-29 21:39:35,0,2,0.502,0.255,0.243,-0.469
United Airlines Secures Naming Rights to L.A. Coliseum http://bit.ly/2Eo8riu # Business # News,2018-01-29 21:39:06,0,0,0.0,0.638,0.362,0.6249
United Airlines Memorial Coliseum: Name change for one of LA's historic venues - http://FOXSports.com http://dlvr.it/QDD3GF,2018-01-29 21:38:48,0,0,0.0,0.811,0.189,0.4215
Owning up to missing my flight. Definitely my fault. Also definitely way more costly than other airlines. Classic millennial calling out other millennials...,2018-01-29 21:36:39,0,0,0.22,0.6,0.18,-0.0498
"Los Angeles Memorial Coliseum To Get New Name After Deal With United Airlines Renaming deal, largest in college sports, supports stadium’s $270 million upgrade ahead of the 2028 Summer Olympics @ USC # FightOn",2018-01-29 21:36:29,0,0,0.0,0.85,0.15,0.6486
Bag Check boutta be a disaster... Coliseum sells naming rights to United Airlines http://www.espn.com/college-football/story/_/id/22259284 …,2018-01-29 21:34:58,0,0,0.0,0.811,0.189,0.4215
The latest online news. Check it in the new WePublish Media ® Paper! https://paper.li/WePublishMedia/1413876768?edition_id=07ffcbf1-057f-11e8-84c2-0cc47a0d164b … # unitedairlines,2018-01-29 21:33:01,0,0,0.0,1.0,0.0,0.0
"Yes, depending on volume, we do our best to engage with all customers who have questions or need assistance. ^JB",2018-01-29 21:32:25,0,0,0.0,0.646,0.354,0.8519
United Airlines Memorial Coliseum. # lame,2018-01-29 21:31:07,0,0,0.326,0.349,0.326,0.0
# WeLoveLA # LARams LA landmark stadium to be renamed as United Airlines Memorial Coliseum http://srhlink.com/QDD1NY # SportsRoadhouse,2018-01-29 21:29:07,0,0,0.0,0.76,0.24,0.4767
# WeLoveLA # LARams Los Angeles Memorial Coliseum to get new name after deal with United Airlines http://srhlink.com/QDD1NP # SportsRoadhouse,2018-01-29 21:29:07,0,0,0.0,0.851,0.149,0.4215
Coliseum sells naming rights to United Airlines http://dlvr.it/QDD1Dr pic.twitter.com/b8luguHIS1,2018-01-29 21:29:06,0,0,0.0,0.714,0.286,0.4215
Still gonna call it the Coliseum.,2018-01-29 21:26:50,0,1,0.0,1.0,0.0,0.0
Congrats on 1k! Thank you for choosing United as your airline to travel!,2018-01-29 21:26:17,0,1,0.0,0.519,0.481,0.8513
United Airlines denies boarsing to a “emotional support peacock.” http://liveandletsfly.boardingarea.com/2018/01/29/united-airlines-peacock/ …,2018-01-29 21:25:14,0,0,0.196,0.42,0.385,0.4019
USC stadium to be renamed United Airlines Memorial Coliseum - ESPN http://dlvr.it/QDD0XG,2018-01-29 21:24:37,0,0,0.0,0.781,0.219,0.4215
Nice!,2018-01-29 21:24:03,0,0,0.0,0.0,1.0,0.4753
Does that mean people will be selected at random to be dragged out of the stadium?,2018-01-29 21:21:57,0,0,0.074,0.926,0.0,-0.0516
@ united Ticket pricing and customer service aren't mutually exclusive. Please try to do a better job at letting people fly on somewhat economical prices while not paying insane fees for checked baggage.,2018-01-29 21:21:28,0,0,0.089,0.697,0.213,0.6834
USC stadium to be renamed United Airlines Memorial Coliseum http://dlvr.it/QDCzsl pic.twitter.com/9Mrl7qWiMN,2018-01-29 21:20:20,0,0,0.0,0.763,0.237,0.4215
The Los Angeles Memorial Coliseum will now be officially known as the United Airlines Memorial Coliseum. http://www.latimes.com/sports/la-sp-usc-coliseum-renovation-20180129-story.html …,2018-01-29 21:20:01,0,0,0.0,0.851,0.149,0.4215
[Charlotte Observer] – USC Trojans’ home is now officially the United Airlines Memorial Coliseum http://sportspyder.com/teams/usc-trojans-football/articles/23948726 …,2018-01-29 21:15:46,0,0,0.0,0.833,0.167,0.4215
Coliseum sells naming rights to United Airlines http://dlvr.it/QDCywz pic.twitter.com/5fZub7ZhkF,2018-01-29 21:15:11,0,0,0.0,0.714,0.286,0.4215
# Sports: USC stadium to be renamed United Airlines Memorial Coliseum - ESPN http://dlvr.it/QDCycn # MixAlotDjz,2018-01-29 21:15:01,0,0,0.0,0.811,0.189,0.4215
USC stadium to be renamed United Airlines Memorial Coliseum - ESPN http://dlvr.it/QDCyT7,2018-01-29 21:14:04,0,0,0.0,0.781,0.219,0.4215
United Airlines purchases naming rights for 'United Airlines Memorial Coliseum' http://www.foxla.com/news/local-news/united-airlines-purchases-naming-rights-for-united-airlines-memorial-coliseum …,2018-01-29 21:13:23,4,8,0.0,0.616,0.384,0.6808
United Airlines purchases naming rights for 'United Airlines Memorial Coliseum' http://www.foxla.com/news/local-news/united-airlines-purchases-naming-rights-for-united-airlines-memorial-coliseum …,2018-01-29 21:13:23,27,27,0.0,0.616,0.384,0.6808
"Très célèbre LA Memorial Coliseum, domicile @ USC Trojans depuis 1923, sera renommé United Airlines Memorial Coliseum dès 2019. United Airlines paiera 69M$/16 ans pour les droits. Avec une réno de 270M$ menant aux JO de 2028, ces $$ serviront à absorber une partie des coûts pic.twitter.com/lGzpAHxwZw",2018-01-29 21:12:06,2,4,0.0,0.887,0.113,0.6808
11:11 for my dad to get a job in united airlines at sf,2018-01-29 21:11:33,0,0,0.0,0.797,0.203,0.4215
"I don't have a problem with selling the naming rights. It is an excellent source of revenue. And the almost 70 million dollars in the deal will be nice. However, @ united has to prove it's a worth partner for @ USC's tradition.http://www.latimes.com/sports/la-sp-usc-coliseum-renovation-20180129-story.html …",2018-01-29 21:09:36,0,0,0.0,0.71,0.29,0.9092
"Hey, Joseph. We understand that this was never in your travel plans, and we are sorry to hear that you were so heavily delayed. Once your travel is complete, we encourage you to reach out to our Customer Care team http://bit.ly/U46edh . ^TY",2018-01-29 21:07:17,0,0,0.072,0.77,0.158,0.6275
victims of united airlines,2018-01-29 21:07:10,0,1,0.324,0.282,0.394,0.128
@ united - traveled with you folks on Saturday. Never do after ur PR disaster last year. Was pleasantly surprised. Better experience than with @ AmericanAir & FAAAR surpassed @ Delta (not that it’s hard to do). Only downside is @ Dulles_Airport as the hub. Not at all user friendly.,2018-01-29 21:06:19,0,0,0.131,0.627,0.242,0.7506
thank you for your quick reply may i ask are you required to respond to every one of these,2018-01-29 21:05:34,0,0,0.0,0.872,0.128,0.3612
The Los Angeles Memorial Coliseum is now the United Airlines Memorial Coliseum and now instead of honoring fallen soldiers it sounds like a memorial for the victims of 9/11 but only the ones who flew on United.,2018-01-29 21:05:33,2,22,0.079,0.699,0.221,0.7269
United Airlines forced emotional support peacock to give up its seat: Travel & Leisure -http://www.travelandleisure.com/travel-news/united-airlines-denies-boarding-emotional-support-peacock …,2018-01-29 21:05:00,1,1,0.149,0.498,0.353,0.4767
"These are felt at home, nothing left to tell ;)",2018-01-29 21:04:21,0,0,0.0,0.826,0.174,0.2263
"I'm finally in the guest room at @ Hillsdale--17 hours, 9 minutes, door to door, from @ DakotaState in Madison, SD. @ United made me work for it, but here I am--ready to talk about 1960s music tomorrow.",2018-01-29 21:04:17,0,8,0.0,0.944,0.056,0.2263
The United Airlines Memorial Coliseum? Nope. I just can’t. https://twitter.com/wsj/status/958054119096442880 …,2018-01-29 21:02:50,0,0,0.0,0.741,0.259,0.4215
@ hollyrpeete @ jaz @ abc7ashley The United Airlines Memorial Coliseum??...,2018-01-29 21:01:24,0,0,0.0,0.689,0.311,0.4871
"Right now we do have the route confirmed through January 2019, but I cannot confirm yet for the months following. Are you looking to explore different connection options for your March travel? ^SV",2018-01-29 21:00:40,0,0,0.0,1.0,0.0,0.0
"On 11/08/2007 a United Airlines A-320 collided with a Snow Bunting at Logan Intl Airport, MA. pic.twitter.com/istFng6ytz",2018-01-29 21:00:09,0,0,0.0,0.833,0.167,0.4215
"Breaking: Los Angeles Memorial Coliseum To Get New Name After Deal With United Airlines. Renaming deal, largest in college sports, supports stadium’s $270 million upgrade ahead of the 2028 Summer Olympics via @ USC http://www.president.usc.edu/files/2018/01/Wall-Street-Journal-LA-Coliseum.pdf …",2018-01-29 20:58:43,3,13,0.0,0.858,0.142,0.6486
Does this mean United Airlines died?,2018-01-29 20:58:08,0,1,0.346,0.385,0.269,-0.2023
"70. Estoy viendo ""The Disaster Artist"" otra vez y neta, faltó Franco en los Oscar, imho.https://youtu.be/cMKX2tE5Luk",2018-01-29 20:56:49,0,1,0.227,0.773,0.0,-0.6249
Los Angeles Memorial Coliseum to get new name after deal with United Airlines https://www.wsj.com/articles/los-angeles-memorial-coliseum-to-get-new-name-after-deal-with-united-airlines-1517248800 … via @ WSJ,2018-01-29 20:56:36,0,0,0.0,0.843,0.157,0.4215
A big day officially kicking off the renovation of the @ united Airlines Memorial Coliseum. Lots of work to do but looking forward to bringing the home of @ USC_Athletics it into the 21st century. # FightOnhttps://twitter.com/usc_athletics/status/958128336974135296 …,2018-01-29 20:55:58,3,46,0.0,0.944,0.056,0.2263
"LA Memorial Coliseum sells naming rights to become: ""United Airlines Memorial Coliseum"" Um.... anyone else thinks this sounds a little dark? http://www.latimes.com/sports/la-sp-usc-coliseum-renovation-20180129-story.html …",2018-01-29 20:55:27,0,4,0.0,0.877,0.123,0.4215
"Honestly, they are not fond memories either.",2018-01-29 20:55:14,0,0,0.231,0.48,0.288,0.1516
"United Airlines Selects Brooks Bros., Tracy Reese, Carhartt for New Uniforms http://dlvr.it/QDCtYN pic.twitter.com/Ik0EiqstRl",2018-01-29 20:55:04,0,0,0.0,0.797,0.203,0.4215
"If you're trying to destroy my lifelong love of USC, you're well on the way. This is disgusting news.",2018-01-29 20:53:50,0,0,0.245,0.532,0.223,-0.1531
