text,date,retweets,favorites,negative,neutral,positive,compound
Can you imagine if the next person bring a ororororororororor. This is too funny,2018-01-30 08:20:29,0,7,0.0,0.805,0.195,0.4404
Did @ emirates contract out # CustomerService to # UnitedAirlines? @ UAL @ unitedsucksbuzz,2018-01-30 08:20:03,0,0,0.0,1.0,0.0,0.0
"I hope your son rents cars instead of flys, God forbid someone needs a service dog. I’m sure they don’t want their dog tortured until it dies right in front of them.",2018-01-30 08:20:03,0,0,0.153,0.623,0.223,0.1779
But you get to save your energy for more important activities and skip the security line.,2018-01-30 08:20:00,0,1,0.0,0.551,0.449,0.8313
We thought @ United was bad!,2018-01-30 08:19:18,0,0,0.395,0.313,0.292,-0.2481
"Ignorance is not a virtue, http://Mike.You  should travel beyond Walmart.",2018-01-30 08:19:18,0,1,0.408,0.592,0.0,-0.5903
I always have emotional support vodka.,2018-01-30 08:19:04,1,9,0.0,0.411,0.589,0.5106
Ugh - you are so right.,2018-01-30 08:19:00,0,0,0.412,0.588,0.0,-0.4215
All the wrong information by @ united providing HORRIBLE customer service. # YOUSUCKUNITEDhttps://twitter.com/kmk6435/status/957251947899314177 …,2018-01-30 08:18:33,0,0,0.404,0.441,0.154,-0.6739
@ united told me the same thing about my emotional support buffalo that i tried to take to Florida. THESE RULES NEED CHANGED # TRIGGERED,2018-01-30 08:18:32,0,0,0.0,0.728,0.272,0.7269
# ReleaseTheMemo # WeThePeople,2018-01-30 08:18:03,0,1,0.0,1.0,0.0,0.0
How diverse will these 'selfie' people become only for attention? (and/or lawsuits) Just like bad children. Pitiful. @ PressSec @ larryelder @ JudgeJeanine @ JesseBWatters @ realDonaldTrump @ FoxNews @ BreitbartNews @ DianeBlackTN,2018-01-30 08:18:02,1,1,0.215,0.705,0.08,-0.6369
This is so funny! I for one do not want to sit by a peacock when I fly!,2018-01-30 08:17:59,0,0,0.066,0.701,0.233,0.6253
Leave it to that unscrupulous shit stain of an institution to develop a brilliant renovation plan and then take a massive chipotle fueled shit right on it. United airlines memorial coliseum my ass.,2018-01-30 08:17:23,0,0,0.274,0.575,0.152,-0.6486
Standing with @ united on this one.,2018-01-30 08:17:17,0,0,0.0,0.641,0.359,0.4215
Yes Gov Huckabee it is I hate it now.,2018-01-30 08:17:14,0,0,0.298,0.484,0.218,-0.25
I bet you she voted for HRC.,2018-01-30 08:17:11,0,0,0.0,1.0,0.0,0.0
"Well, we do have a Jackass in the White House... # AnimalFarm # Resistance",2018-01-30 08:16:35,0,0,0.201,0.647,0.151,-0.1779
"When you need absolute clarity on stupid acts from the liberal crowd, Gov Huck can cut to the quick with the best of them. And the apple doesn't fall far as his daughter @ PressSec, Mrs. Sanders, chops down MSM daily. Patriots thru and thru. God bless.",2018-01-30 08:16:33,1,2,0.096,0.698,0.206,0.743
So true. I can remember when we dressed in Sunday clothes to take a trip on a plane. We had stewardesses that served you. Not Flight attendants who just attended the same flight you are on. Seats were comfortable. Plane was clean. Now its like riding the old Trailways bus.,2018-01-30 08:16:31,0,3,0.0,0.788,0.212,0.8908
"If I were getting on an airplane with my dog and found out your son was on the same plane, I would definitely rent a car.",2018-01-30 08:16:22,0,3,0.0,0.891,0.109,0.4019
Toss her off let the peacock ride bird probably has better people mixing values.,2018-01-30 08:15:56,0,8,0.0,0.682,0.318,0.6808
Well this takes the cake,2018-01-30 08:15:41,0,1,0.0,0.656,0.344,0.2732
"We are getting so out of hand. Who makes up the rules? The service dogs are trained to do many things. If your peacock, pig or boa constrictor can't do what these dogs are trained to do take a hike.",2018-01-30 08:15:35,0,5,0.0,0.916,0.084,0.5367
Tango Hotel India Sierra India Sierra Hotel Alpha Romeo Delta Tango Oscar Romeo Echo Alpha Delta >~>,2018-01-30 08:15:32,0,0,0.0,1.0,0.0,0.0
I'm a firm believer in cerified trained service dogs or animals. But these uncertified untrained emotional animals thing is a freaking scam.,2018-01-30 08:15:30,0,15,0.259,0.677,0.064,-0.7096
"I WANT HIS LITTLE VEST BACK TOO, @ united https://twitter.com/FoxNews/status/958369092817350656 …",2018-01-30 08:15:20,2,26,0.0,0.554,0.446,0.5904
Peacock? Disgusting. I say make her buy a full priced ticket for the bird and stick it in the cargo hold. That oughta do it.,2018-01-30 08:15:18,0,0,0.134,0.866,0.0,-0.5267
". @ united's Premium Plus offers more choice, but we still need an Economy cabin # design revolution | http://ow.ly/LgCG30i5qOI pic.twitter.com/uR7bMveoxw",2018-01-30 08:15:07,0,0,0.0,1.0,0.0,0.0
"Just in...Fox News reporting that 2 DACA ""Dreamers"" have been arrested for human smuggling across our southern border! According to Schumer & Pelosi, all of these people were working or in school! @ realDonaldTrump BUILD THE WALL!...NO WALL, NO DACA!...PERIOD!",2018-01-30 08:14:47,0,1,0.233,0.767,0.0,-0.8834
Huh? Peacock?,2018-01-30 08:14:47,0,0,0.0,1.0,0.0,0.0
"For once I'm in agreement with United Airlines, I don't want a passenger on my flight that can peck my eyes out. http://www.travelandleisure.com/travel-news/united-airlines-denies-boarding-emotional-support-peacock … via @ TravelLeisure",2018-01-30 08:14:43,0,3,0.045,0.735,0.22,0.6983
"As usual....people with real support animals wil be punished because of ""special"" people and their ""special"" pets.",2018-01-30 08:14:24,0,4,0.145,0.725,0.13,-0.0772
"I’m with @ united on this one, not a fan of the airline but a peacock? I’m companionate to need for support, but 200 others on plane",2018-01-30 08:14:22,0,0,0.053,0.752,0.195,0.6084
Standing with @ united on this one...,2018-01-30 08:14:03,0,8,0.0,0.641,0.359,0.4215
It's amazing our Country was ever founded.,2018-01-30 08:13:38,0,0,0.0,0.612,0.388,0.5859
I’m gonna need my Emotional Support Rhinoceros on my next flight…may need extra leg room as well.,2018-01-30 08:13:23,0,5,0.0,0.686,0.314,0.6597
Lol I heard peacocks make excellent guard dogs,2018-01-30 08:13:21,0,1,0.0,0.435,0.565,0.7579
"There are rules about pets in the cabin, and peacocks don't qualify.",2018-01-30 08:13:12,0,1,0.0,1.0,0.0,0.0
Lolll @ united paid 69 MILLION dollars for the naming rights to the Colosseum but can’t get a flight out on time to save their lives. I’m done,2018-01-30 08:13:06,1,1,0.0,0.795,0.205,0.7351
That’s for commerce business reasons that woman had mental problems,2018-01-30 08:13:05,0,1,0.231,0.769,0.0,-0.4019
"Good!!! STOP WITH THE MADNESS! @ Delta @ AmericanAir @ united PLEASE create policies NO emotional support animals on board! These people are trying to make fools of you &get attention! Flying is not the only mode of transporation in the world! Drive, take a train or take a valium! pic.twitter.com/VRSjWisyYg",2018-01-30 08:12:59,0,0,0.195,0.554,0.251,0.3822
Nunya business filthy Huckabee,2018-01-30 08:12:48,0,0,0.0,1.0,0.0,0.0
The LA Coliseum is gonna be named United Airlines Memorial Coliseum...not impressed,2018-01-30 08:12:47,0,0,0.0,0.629,0.371,0.7096
Congrats man that’s huge! My friends and family talk about how often I fly and I’m just silver,2018-01-30 08:12:34,0,0,0.0,0.606,0.394,0.8439
"Hey, I might want to take my chickens flying!!!!",2018-01-30 08:12:34,0,6,0.0,0.739,0.261,0.3544
Good thing you prefer Delta! We are tightening up our rules!,2018-01-30 08:12:29,0,4,0.0,0.742,0.258,0.5399
So true,2018-01-30 08:12:12,0,0,0.0,0.244,0.756,0.4754
in viaggio verso Roma Fiumicino da Newark Airport: United Airlines https://fb.me/7szlXtaiW,2018-01-30 08:12:06,0,0,0.0,0.781,0.219,0.4215
A peacock?pic.twitter.com/4cLDnBVHym,2018-01-30 08:11:59,0,2,0.0,1.0,0.0,0.0
pic.twitter.com/GLSijpflix,2018-01-30 08:11:47,0,0,0.0,1.0,0.0,0.0
Rule of Acquisition #87: Learn the customer's weaknesses so you can better take advantage of them.,2018-01-30 08:11:29,0,1,0.121,0.629,0.25,0.3947
Know any hookups with United Airlines? Lol,2018-01-30 08:11:19,0,0,0.0,0.472,0.528,0.6808
# ReleaseTheMemo # WeThePeople # InternetBillOfRights,2018-01-30 08:11:15,0,1,0.0,1.0,0.0,0.0
,2018-01-30 08:11:08,0,1,0.0,1.0,0.0,0.0
Flying into unfriendlier skies: @ United tries to stay aloft as the # BayArea’s dominant air carrier while rivals circle http://bizj.us/1pgkn1 # airlines # travel $ UALpic.twitter.com/DJrulWVHJ8,2018-01-30 08:11:06,0,0,0.0,0.882,0.118,0.4215
,2018-01-30 08:10:58,0,2,0.0,1.0,0.0,0.0
I didn’t yet because I was occupied with the funeral. The flight isn’t scheduled until feb 6. I’ll DM the details now.,2018-01-30 08:10:33,0,0,0.116,0.884,0.0,-0.3612
"Okay....gotta side w/ @ united on this one! If someone is so fragile about flying they need a peacock, they really should just rent a car..flying is becoming like riding a bus in Central America where ppl get on with their chickens, pigs, and goats. https://twitter.com/FoxNews/status/958369092817350656 …",2018-01-30 08:10:27,559,2063,0.0,0.877,0.123,0.68
Coliseum sells naming rights to United Airlines http://www.espn.com/college-football/story/_/id/22259284 …,2018-01-30 08:10:23,0,0,0.0,0.714,0.286,0.4215
"Way to go @ united the abuse of emotional support animal rules has gotten WAY out of hand. Ban the big dogs, too -- its absurd! https://twitter.com/FoxNews/status/958369092817350656 …",2018-01-30 08:10:18,0,0,0.203,0.521,0.276,0.2003
@ united partners with @ USC and gets naming rights to the @ lacoliseum - becoming the United Airlines Memorial Coliseum in 2019! # FlightOn ... Move will support the $270M renovation ... http://ow.ly/XhTr30i5C4m pic.twitter.com/W360cNQdjP,2018-01-30 08:10:12,0,1,0.0,0.752,0.248,0.8221
Shame on @ united ! https://twitter.com/FoxNews/status/958369092817350656 …,2018-01-30 08:09:36,0,0,0.414,0.244,0.342,-0.1511
"This whole thing has gotten way out of hand. If you can't fly without a large animal you should drive instead, and not ruin it for everybody else on the plane! Good for United Airlines!",2018-01-30 08:09:21,0,0,0.0,0.705,0.295,0.911
"@ FoxNews continues war on @ NBCNews and @ MSNBC, here: Woman denied emotional support peacock on @ United flight http://fxn.ws/2DPMWKA",2018-01-30 08:09:11,0,0,0.263,0.463,0.274,-0.1779
"Rick Garcia, PM & SharePoint Engineering Team Lead at United Airlines # CollabTalk",2018-01-30 08:08:51,0,1,0.0,0.781,0.219,0.4215
So United Airlines & USC are going in on revamping the Coliseum! A 200 million dollar renovation. Another good short read!! https://twitter.com/1027KIISFM/status/958128895882018816 …,2018-01-30 08:08:34,0,1,0.0,0.724,0.276,0.7826
"RJ, this is concerning. Please DM more information. ^NC",2018-01-30 08:08:18,0,0,0.0,0.777,0.223,0.3182
"My father, who played in The Los Angeles Memorial Colliseum as a Cal Bear and later attended the 1932 Olympics there, and who spent most of his professional career w/ United Airlines is spinning in his grave today. # Wrong # Sad",2018-01-30 08:08:15,1,6,0.183,0.708,0.108,-0.5574
I’m done with @ united https://twitter.com/foxnews/status/958369092817350656 …,2018-01-30 08:08:04,0,0,0.0,0.588,0.412,0.4215
Rolf Meyer de @ united y Karol Rattinger de @ BestDay_Travel Anunciaron Alianza y la creación de # UnitedVacation en México. Además nos dieron a conocer sobre el portal http://www.unitedvacationmx.com  Enhorabuena!! # DestinosyNegociospic.twitter.com/qsnsutjOwr,2018-01-30 08:08:00,10,5,0.0,0.881,0.119,0.5242
Did you alert United that you would be rebooking on another airline? Please direct message us your United confirmation number: ^NJhttps://twitter.com/messages/compose?recipient_id=260907612 …,2018-01-30 08:06:58,0,0,0.0,0.576,0.424,0.8677
# ICYMI Woman denied emotional support peacock on United flight | Fox News http://ow.ly/heJG30i5CS7 # SMH # UnitedAirlines # travel # emotionalsupport,2018-01-30 08:06:54,1,2,0.247,0.458,0.295,0.0431
# ICYMI Woman denied emotional support peacock on United flight | Fox News http://ow.ly/heJG30i5CS7 # SMH # UnitedAirlines # travel # emotionalsupport,2018-01-30 08:06:54,0,0,0.247,0.458,0.295,0.0431
I’m at home now and at this point I would like a refund or at least a travel credit like @ JetBlue has done in these circumstances,2018-01-30 08:05:24,1,0,0.0,0.725,0.275,0.765
"An @ united @ BoeingAirplanes 757-324 [N74856] landing on 24R at Los Angeles International Airport ( @ flyLAXairport) on May 27, 2017 # avgeek # LAX # KLAX # UA # UAL # B757 # Boeing # N74856 # UnitedAirlines https://youtu.be/bZC6_MxYegg",2018-01-30 08:05:18,2,0,0.0,0.906,0.094,0.4215
"A treta com um PAVÃO ""United Airlines recently shot down one traveler’s request to bring her emotional support peacock on a flight"" ""even though the unidentified woman claimed that she had a second ticket for the peacock, the airline denied her request"" http://www.foxnews.com/travel/2018/01/30/woman-denied-emotional-support-peacock-on-united-flight.html …",2018-01-30 08:03:46,2,1,0.063,0.783,0.154,0.4939
Seriously? smh,2018-01-30 08:03:42,0,0,1.0,0.0,0.0,-0.4588
Yankee Echo Sierra,2018-01-30 08:02:54,0,0,0.0,1.0,0.0,0.0
I need the socks :),2018-01-30 08:01:05,0,0,0.0,0.5,0.5,0.4588
"Hey, does that mean I could bring my Bantam rooster? He's a lot smaller! United Airlines Denies Boarding to Emotional Service Animal&#8230;a Peacock http://liveandletsfly.boardingarea.com/2018/01/29/united-airlines-peacock/ … ( @ hahabita)pic.twitter.com/wzzzY3YeUn",2018-01-30 08:01:04,0,0,0.102,0.727,0.171,0.2244
The Wall Street Journal New name for Los Angeles Memorial Coliseum with United Airlines deal that is largest in college sports http://dlvr.it/QDHcW4,2018-01-30 08:00:44,0,0,0.0,0.882,0.118,0.4215
It would be nice if @ united could stop being monsters.,2018-01-30 08:00:17,0,0,0.149,0.473,0.378,0.5267
https://youtu.be/TOj0Qd57fM0,2018-01-30 07:59:55,0,0,0.0,1.0,0.0,0.0
https://youtu.be/TOj0Qd57fM0,2018-01-30 07:59:45,0,0,0.0,1.0,0.0,0.0
https://youtu.be/TOj0Qd57fM0,2018-01-30 07:59:40,0,0,0.0,1.0,0.0,0.0
"No comment, Next question",2018-01-30 07:59:35,0,0,0.423,0.577,0.0,-0.296
I’m dying can you imagine flying with that?? I’m sure you would love that! Animal lover that you are,2018-01-30 07:58:44,0,2,0.0,0.594,0.406,0.899
"Too cool, Matt! Thanks for showing us how awesome they look. ^NJ",2018-01-30 07:58:38,0,1,0.0,0.484,0.516,0.8622
Omg thank you Sir. I needed this,2018-01-30 07:57:56,0,1,0.0,0.667,0.333,0.3612
"I have 10 flights to book over the next 35 days, instead of paying $25 for my backpack each flight @ united I’ll be booking @ SouthwestAir",2018-01-30 07:56:58,0,0,0.0,0.891,0.109,0.4215
"First the 19ft of legroom, now an upgrade to First Class. @ United you’ve got my heart",2018-01-30 07:56:53,0,0,0.0,0.843,0.157,0.4215
Booking my next three trips today,2018-01-30 07:56:35,0,0,0.0,1.0,0.0,0.0
Woman denied emotional support peacock on @ United Airlines flight http://fxn.ws/2DPMWKA # flying # travel,2018-01-30 07:56:13,2,8,0.161,0.444,0.394,0.4939
"I'm confused, did United Airlines recently die? http://www.nydailynews.com/sports/college/historic-coliseum-renamed-united-airlines-memorial-coliseum-article-1.3787193 …",2018-01-30 07:55:17,0,1,0.443,0.357,0.2,-0.5267
The United Airlines Memorial Coliseum in United Airlines South Central Los Angeles.,2018-01-30 07:55:09,0,0,0.0,0.641,0.359,0.6808
"Hey, @ United. I've been trying for a week and a HALF to get the email on my MileagePlus account changed. You have my passport, address, and signature. Where do I send the DNA sample?",2018-01-30 07:54:35,0,1,0.0,0.915,0.085,0.4215
"We are glad our flight attendants could remedy a situation, Connie. We hope you're having a good flight. ^NJ",2018-01-30 07:53:39,0,0,0.0,0.614,0.386,0.8316
Renovated Home of USC Football to Be Know as United Airlines Memorial Coliseum in Naming Rights: http://youtu.be/V2TkJP3ud2w?a  via @ YouTube,2018-01-30 07:53:09,0,0,0.0,0.865,0.135,0.4215
Landmark L.A. venue to be renamed United Airlines Memorial Coliseum (updated): http://youtu.be/9qAtc3m-4qM?a  via @ YouTube,2018-01-30 07:53:04,0,0,0.0,0.745,0.255,0.4767
Does this mean @ united is going to have the cops drag you out of your seat and beat the hell out of you? http://abc7.com/sports/usc-stadium-to-be-renamed-united-airlines-memorial-coliseum/3004771/ …,2018-01-30 07:52:25,0,0,0.215,0.693,0.092,-0.5719
Still gonna call it the Coliseum. Always called the Forum the Forum (not great western) Still call Qualcomm the Murph The only people who will call it United Airlines Coliseum are the reporters and tv commentators,2018-01-30 07:52:09,0,0,0.0,0.831,0.169,0.7845
"Good luck, GO TEAM USSPEEDSKATING",2018-01-30 07:52:08,0,2,0.0,0.337,0.663,0.7096
United Airlines Denies Boarding to Emotional Service Animal&#8230;a Peacock http://liveandletsfly.boardingarea.com/2018/01/29/united-airlines-peacock/ … BRAVO @ United ENOUGH with this crap!!!,2018-01-30 07:52:05,0,0,0.233,0.442,0.325,0.3129
USC Trojans' home is now officially the United Airlines Memorial Coliseum http://www.latimes.com/sports/usc/la-sp-usc-coliseum-renovation-20180129-story.html …,2018-01-30 07:52:04,0,0,0.0,0.797,0.203,0.4215
Plus side: drinking fountain at @ flySFO smells like maple syrup downside: @ united charges $25 for my backpack. I’ll rebook my 10 flights,2018-01-30 07:51:57,0,1,0.15,0.657,0.193,0.296
https://youtu.be/TOj0Qd57fM0,2018-01-30 07:50:36,0,0,0.0,1.0,0.0,0.0
https://youtu.be/TOj0Qd57fM0,2018-01-30 07:49:56,0,0,0.0,1.0,0.0,0.0
https://youtu.be/TOj0Qd57fM0,2018-01-30 07:49:54,0,0,0.0,1.0,0.0,0.0
https://youtu.be/TOj0Qd57fM0,2018-01-30 07:49:35,0,0,0.0,1.0,0.0,0.0
"United airlines, cancels my flight, doesn’t provide any food vouchers or hotel accommodation, not even entry into their lounge, even though the rebooked flight isn’t until another 12+ hours, and to top it all off loses my luggage??? # UnitedAirlines worst flying experience yet",2018-01-30 07:49:22,5,11,0.172,0.739,0.089,-0.6416
"Given zero context, what is the first thing that comes to your mind when you see the following name? ""United Airlines Memorial Coliseum""",2018-01-30 07:49:06,0,0,0.0,0.887,0.113,0.4215
We're happy to take a closer look at this. Can you please direct message us the confirmation number for each ticket? ^NJhttps://twitter.com/messages/compose?recipient_id=260907612 …,2018-01-30 07:48:40,0,0,0.0,0.701,0.299,0.7691
Just the renaming of the Sears tower... The locals will adjust and start calling it the “Los Angeles Memorial United Airlines Coliseum presented by AT&T with consideration from you helpful SoCal Honda dealers”.,2018-01-30 07:48:11,0,0,0.0,0.847,0.153,0.6808
@ united very upset this morning UA3745 EWR - CLT (door3 lvl2) 20yrs exp gate staff member Levern rolled her eyes & tutted and said loud enough for me to hear 'SO extra' after I asked a seat upgrade question. she clearly did not want to help me. But she was happy to insult me :(,2018-01-30 07:45:08,0,0,0.194,0.664,0.142,-0.3341
We’re kicking off our staff Winter Institute ‘18! TY @ united for making it possible to bring in all of our # DC and # PNW staff to Oakland! # ExciteEducateEquip # teambuilding # TBG2018Institiute # techbridgegirls,2018-01-30 07:45:07,1,2,0.0,0.807,0.193,0.7729
cc @ prnsports USC stadium to be renamed United Airlines Memorial Coliseum http://ow.ly/YIMO30i5nqo  ^ab,2018-01-30 07:45:05,0,0,0.0,0.811,0.189,0.4215
On a half full flight to Chicago. Thank you @ united flight attendants for allowing me a different seat since the person next to me is taking up half of my seat. GREAT customer service.,2018-01-30 07:44:55,0,0,0.0,0.741,0.259,0.8788
I can finally wear em,2018-01-30 07:44:40,0,1,0.0,1.0,0.0,0.0
$4.3M a year over 16 years for naming rights to LA Coliseum for @ united Airlines seems like pretty good deal...it's one of the most iconic sports stadiums in America! Problem is it doesn't have a whole Helluva lot of events to get that name said a lot! https://twitter.com/MarketWatch/status/958360561833701376 …,2018-01-30 07:42:43,2,0,0.049,0.731,0.219,0.8513
"# BDTravelSolutions y # UnitedAirlines anuncian en Ciudad de México, alianza para # UnitedVacations Más en nuestro próximo Newsletter # DestinosyNegociospic.twitter.com/gsbT4E3jQN",2018-01-30 07:41:59,10,4,0.0,1.0,0.0,0.0
"@ Delta - Flight 2648 today, “we forgot to bring the plane to the gate; don’t count on being on time”... now # weather... 2.5 hours delayed and no real update. Expect this from @ united, not you.",2018-01-30 07:41:46,0,0,0.108,0.818,0.074,-0.0772
@ united # oscarmunoz hasn’t resigned yet? Y’all still beating paying customers? Surprised people still fly # united.,2018-01-30 07:40:32,0,0,0.219,0.437,0.344,0.4329
I'm not a fan of this change to the Coliseum - Los Angeles Memorial Coliseum to get new name after deal with United Airlines https://www.wsj.com/articles/los-angeles-memorial-coliseum-to-get-new-name-after-deal-with-united-airlines-1517248800 … via @ WSJ,2018-01-30 07:40:06,0,0,0.071,0.828,0.101,0.2115
"I'm at United Airlines - Flight Attendant Domicile Office SFOSW in San Francisco, CA https://www.swarmapp.com/c/barc5GWIu8v",2018-01-30 07:39:36,0,0,0.0,0.823,0.177,0.4215
Lol,2018-01-30 07:38:25,0,0,0.0,0.0,1.0,0.4215
"I'm at @ United Club in Newark, NJ https://www.swarmapp.com/c/l5uHmMftShz",2018-01-30 07:38:24,0,0,0.0,0.714,0.286,0.4215
We're talking with Rich Kline from @ united this morning about exciting 2018 updates in the airline and for our clients. Thanks Rich! # businesstravel # United # travelmanagement # TravelTuesday – bei Christopherson Business Travel,2018-01-30 07:37:32,2,4,0.0,0.566,0.434,0.9595
The latest The Client Angel Paper! https://paper.li/theclientangel/1385775429?edition_id=792227c0-05d3-11e8-b29f-0cc47a0d15fd … # unitedairlines # smallbiz,2018-01-30 07:37:31,0,0,0.0,1.0,0.0,0.0
I do like a nice United 757. Here's N14107 on approach to BHXpic.twitter.com/wcAHZQV86q,2018-01-30 07:36:40,0,8,0.0,0.497,0.503,0.7964
Historic L.A. Coliseum renamed United Airlines Memorial Coliseum http://nydn.us/2EnWVUb,2018-01-30 07:36:28,0,0,0.0,0.741,0.259,0.4215
"We're happy to hear that, Grant! ^NJ",2018-01-30 07:36:24,0,0,0.0,0.435,0.565,0.7574
Flying gives me a sense of freedom and calmness. I think best on an airplane. Thanks @ united for always keeping me safe. pic.twitter.com/Uv96h6h4AG,2018-01-30 07:36:19,1,3,0.0,0.432,0.568,0.9623
Loving my new 747 socks! Thanks @ united pic.twitter.com/jb22HsZYzX,2018-01-30 07:35:54,2,43,0.0,0.336,0.664,0.8718
I’ll still prefer Southwest. Should have spent the money on a better flying experience for your CUSTOMERS.,2018-01-30 07:35:23,0,2,0.0,0.838,0.162,0.4404
Exciting moment for @ OpenFairSkies @ AmericanAir @ Delta @ united @ APFAunity @ WeAreALPA @ afa_cwa @ swapapilots @ APA # OpenSkies # Qatar_USAhttps://twitter.com/StateDept/status/958358829158170624 …,2018-01-30 07:33:47,0,5,0.0,0.667,0.333,0.7184
Los Angeles Memorial Coliseum to become the United Airlines Memorial Coliseum https://worldairlinenews.com/2018/01/30/los-angeles-memorial-coliseum-to-become-the-united-airlines-memorial-coliseum/ … via @ WorldALNews,2018-01-30 07:33:26,0,0,0.0,0.823,0.177,0.4215
". @ United Airlines will commit US$69 million as part of a 16-year deal for the naming rights to the historic LA Memorial Coliseum, which is set to undergo a US$270 million refurbishment ahead of hosting the 2028 Olympics http://www.sportspromedia.com/news/la-coliseum-united-airlines-naming-rights-Olympics … # Olympics # SportsBizpic.twitter.com/pR2oRUebwj",2018-01-30 07:29:26,0,1,0.0,0.878,0.122,0.6124
Even the host of EVERYDAY doesn't get a chance like that every day.,2018-01-30 07:29:20,0,1,0.278,0.722,0.0,-0.431
Anuncian BD Travel Solution y United Airlines la alianza United Vacations pic.twitter.com/O1Mf80k7J2,2018-01-30 07:29:18,2,2,0.0,0.503,0.497,0.7845
"Benjamin, we appreciate you letting us know about this. Can we have your flight number and seat number? Please feel free to direct message if that's more comfortable for you: ^NJhttps://twitter.com/messages/compose?recipient_id=260907612 …",2018-01-30 07:28:38,0,0,0.0,0.627,0.373,0.9162
# Japan # Japantravel # travel Inflight WIFI On United Airlines http://bit.ly/2DLITL6 pic.twitter.com/qOMXELThZ1,2018-01-30 07:28:08,0,2,0.0,0.741,0.259,0.4215
Shame on you @ united and @ USChttps://twitter.com/kairyssdal/status/958158917837602819 …,2018-01-30 07:26:38,0,0,0.313,0.404,0.283,-0.0772
The Wall Street Journal: New name for Los Angeles Memorial Coliseum with United Airlines… https://goo.gl/fb/DJmcGv,2018-01-30 07:25:47,0,0,0.0,0.833,0.167,0.4215
New name for Los Angeles Memorial Coliseum with United Airlines deal that is largest in college sports http://on.mktw.net/2EoeWSx,2018-01-30 07:25:38,5,6,0.0,0.859,0.141,0.4215
"Woman denied emotional support peacock on United flight http://2uwash.com/2018/01/30/woman-denied-emotional-support-peacock-on-united-flight/ … The large bird was not allowed to board.  (http://Thejetset.tv ) Birds of a feather may flock together, but United Airlines recently shot down one traveler’... pic.twitter.com/KWshzzzb55",2018-01-30 07:24:53,0,0,0.05,0.724,0.226,0.7003
Los Angeles Memorial Coliseum to get new name after deal with United Airlines https://www.wsj.com/articles/los-angeles-memorial-coliseum-to-get-new-name-after-deal-with-united-airlines-1517248800 … via @ WSJ # sportsbiz $,2018-01-30 07:24:47,0,0,0.0,0.851,0.149,0.4215
# VacationWasRuinedWhen @ united messed up my flights and took my luggage.,2018-01-30 07:24:32,0,0,0.182,0.606,0.212,0.1027
Yo @ united this never happens on @ Delta yuck !pic.twitter.com/wgmG4ryjOJ,2018-01-30 07:24:30,0,0,0.0,0.721,0.279,0.4753
"The Wall Street Journal: New name for Los Angeles Memorial Coliseum with United Airlines deal that is largest in college sports http://www.marketwatch.com/news/story.asp?guid=%7BE6040402-05C0-11E8-9347-506271A811B3%7D&siteid=rss&rss=1 … The Los Angeles Memorial Coliseum, a city landmark and historic venue for both sports and music, will become the United Airlin…",2018-01-30 07:22:23,0,0,0.0,0.85,0.15,0.7096
